prod_link,tags,seller_address,meta_description,meta_keyword
dresses/ruhaans/ruhaans-multicoloured-tie-and-dye-kaftan-dress/17680542/buy,"['clothing', 'women-clothing', 'dresses', 'ruhaans-dresses']","FIRST FLOOR, RZ-19-A, BLOCK-R, CHANAKYA PALCE, PART-II,UTTAM NAGAR, New Delhi, Delhi, 110059Delhi , Delhi - 110059",Buy Ruhaans Multicoloured Tie And Dye Kaftan Dress - Dresses for Women from Ruhaans at Rs. 799. Style ID: 17680542,"Ruhaans Multicoloured Tie And Dye Kaftan Dress,  Ruhaans, Dresses, Dress, Apparel, Apparel for Women, Buy Ruhaans Multicoloured Tie And Dye Kaftan Dress Online in India, Buy Dresses at best price"
kurtas/indo-era/indo-era-women-pink-yoke-design-kurta/15262284/buy,"['clothing', 'women-clothing', 'kurtas', 'indo-era-kurtas']","4TH FLOOR, Block No B-4021/4022/4023/4026/4038/4039/4040ASHIRWAD TEXTILE MARKET, OPP. LANDMARK TEXTILE MARKET, MAGOB,Surat , Gujarat - 395010",Buy Indo Era Women Pink Yoke Design Kurta - Kurtas for Women from Indo Era at Rs. 839. Style ID: 15262284,"Indo Era Women Pink Yoke Design Kurta,  Indo Era, Kurtas, Topwear, Apparel, Apparel for Women, Buy Indo Era Women Pink Yoke Design Kurta Online in India, Buy Kurtas at best price"
shirts/ruggers/ruggers-men-beige-regular-fit-solid-casual-shirt/13400510/buy,"['clothing', 'men-clothing', 'shirts', 'ruggers-shirts']","10TH FLOOR, DU PARC TRINITY, NO 17, M.G ROAD, Bengaluru (Bangalore) Rural,Bengaluru , Karnataka - 560001",Buy Ruggers Men Beige Regular Fit Solid Casual Shirt - Shirts for Men from Ruggers at Rs. 699. Style ID: 13400510,"Ruggers Men Beige Regular Fit Solid Casual Shirt,  Ruggers, Shirts, Topwear, Apparel, Apparel for Men, Buy Ruggers Men Beige Regular Fit Solid Casual Shirt Online in India, Buy Shirts at best price"
tshirts/hummel/hummel-men-coffee-brown--white-brand-logo-printed-pure-cotton-t-shirt/17175574/buy,"['clothing', 'men-clothing', 'tshirts', 'hummel-tshirts']","11th B-1107 Signature Tower Block-B NH-8 South City IGurugram , Haryana - 122001",Buy Hummel Men Coffee Brown & White Brand Logo Printed Pure Cotton T Shirt - Tshirts for Men from Hummel at Rs. 399. Style ID: 17175574,"Hummel Men Coffee Brown & White Brand Logo Printed Pure Cotton T Shirt,  Hummel, Tshirts, Topwear, Apparel, Apparel for Men, Buy Hummel Men Coffee Brown & White Brand Logo Printed Pure Cotton T Shirt Online in India, Buy Tshirts at best price"
shirts/roadster/the-roadster-lifestyle-co-men-mauve--white-printed-pure-cotton-casual-shirt/17050502/buy,"['clothing', 'men-clothing', 'shirts', 'roadster-shirts']","406, B2 and C, 4th Floor,Centrum Plaza, Golf Course Road, Sector - 53,Gurugram , Haryana - 122102",Buy The Roadster Lifestyle Co Men Mauve & White Printed Pure Cotton Casual Shirt - Shirts for Men from Roadster at Rs. 849. Style ID: 17050502,"The Roadster Lifestyle Co Men Mauve & White Printed Pure Cotton Casual Shirt,  Roadster, Shirts, Topwear, Apparel, Apparel for Men, Buy The Roadster Lifestyle Co Men Mauve & White Printed Pure Cotton Casual Shirt Online in India, Buy Shirts at best price"
shirts/mast--harbour/mast--harbour-men-peach-coloured--navy-blue-printed-casual-shirt/16284090/buy,"['clothing', 'men-clothing', 'shirts', 'mast-and-harbour-shirts']","Awfis, 7th floor, HM Vibha Tower, 25 Laskar Hosur Road, Adugodi, Bengalore 560029Bengaluru , Karnataka - 560029",Buy Mast & Harbour Men Peach Coloured & Navy Blue Printed Casual Shirt - Shirts for Men from Mast & Harbour at Rs. 799. Style ID: 16284090,"Mast & Harbour Men Peach Coloured & Navy Blue Printed Casual Shirt,  Mast & Harbour, Shirts, Topwear, Apparel, Apparel for Men, Buy Mast & Harbour Men Peach Coloured & Navy Blue Printed Casual Shirt Online in India, Buy Shirts at best price"
kurtas/shashvi/shashvi-women-turquoise-blue--red-floral-embroidered-anarkali-kurta/17608668/buy,"['clothing', 'women-clothing', 'kurtas', 'shashvi-kurtas']","A 36 SECTOR 57Gautam Buddha NagarNoida , UTTAR PRADESH - 201307",Buy Shashvi Women Turquoise Blue & Red Floral Embroidered Anarkali Kurta - Kurtas for Women from Shashvi at Rs. 519. Style ID: 17608668,"Shashvi Women Turquoise Blue & Red Floral Embroidered Anarkali Kurta,  Shashvi, Kurtas, Topwear, Apparel, Apparel for Women, Buy Shashvi Women Turquoise Blue & Red Floral Embroidered Anarkali Kurta Online in India, Buy Kurtas at best price"
blazers/hangup/hangup-men-multicoloured-printed-uv-protected-bandhgala-blazer/12694480/buy,"['clothing', 'men-clothing', 'blazers', 'hangup-blazers']","676,phase-2sector-37Gurugram , Haryana - 122001",Buy Hangup Men Multicoloured Printed UV Protected Bandhgala Blazer - Blazers for Men from Hangup at Rs. 1919. Style ID: 12694480,"Hangup Men Multicoloured Printed UV Protected Bandhgala Blazer,  Hangup, Blazers, Topwear, Apparel, Apparel for Men, Buy Hangup Men Multicoloured Printed UV Protected Bandhgala Blazer Online in India, Buy Blazers at best price"
shirts/cavallo-by-linen-club/cavallo-by-linen-club-men-yellow-casual-shirt/18306854/buy,"['clothing', 'men-clothing', 'shirts', 'cavallo-by-linen-club-shirts']","Village Babra Bakipur, Pataudi Road,Near Adani Logistic Park, ICD PatliGurugram , Haryana - 122503",Buy CAVALLO By Linen Club Men Yellow Casual Shirt - Shirts for Men from CAVALLO By Linen Club at Rs. 1259. Style ID: 18306854,"CAVALLO By Linen Club Men Yellow Casual Shirt,  CAVALLO By Linen Club, Shirts, Topwear, Apparel, Apparel for Men, Buy CAVALLO By Linen Club Men Yellow Casual Shirt Online in India, Buy Shirts at best price"
sarees/perfect-wear/perfect-wear-navy-blue--red-woven-design-zari-silk-cotton-banarasi-saree/17979502/buy,"['clothing', 'women-clothing', 'sarees', 'perfect-wear-sarees']","2nd FLOOR, GATE NO-3, PLOT NO. F-1129, LAXMI TEXTILEPARK, G.I.D.C., SACHIN, Surat, Gujarat, 394230Surat , GUJARAT - 394230",Buy PERFECT WEAR Navy Blue & Red Woven Design Zari Silk Cotton Banarasi Saree - Sarees for Women from PERFECT WEAR at Rs. 1199. Style ID: 17979502,"PERFECT WEAR Navy Blue & Red Woven Design Zari Silk Cotton Banarasi Saree,  PERFECT WEAR, Sarees, Saree, Apparel, Apparel for Women, Buy PERFECT WEAR Navy Blue & Red Woven Design Zari Silk Cotton Banarasi Saree Online in India, Buy Sarees at best price"
deodorant/police/police-men-set-of-wings-titanium--millionaire-homme-deodorant/12192474/buy,"['personal-care', 'men-personal-care', 'deodorant', 'police-deodorant']","10, Cabin No 17, PVR Plaza Building, H Block, Connaught CircusDelhi , Delhi - 110001",Buy Police Men Set Of Wings Titanium & Millionaire Homme Deodorant - Deodorant for Men from Police at Rs. 518. Style ID: 12192474,"Police Men Set Of Wings Titanium & Millionaire Homme Deodorant,  Police, Deodorant, Fragrance, Personal Care, Personal Care for Men, Buy Police Men Set Of Wings Titanium & Millionaire Homme Deodorant Online in India, Buy Deodorant at best price"
shirts/roadster/the-roadster-lifestyle-co-women-blue-classic-denim-casual-shirt/16874850/buy,"['clothing', 'women-clothing', 'shirts', 'roadster-shirts']","2ND, 212, BHULLAR STAR INDUSTRIAL PREMISESTELEPHONE EXCHANGE LANE, ANDHERI KURLA ROAD, ANDHERI EASTMumbai , Maharashtra - 400072",Buy The Roadster Lifestyle Co Women Blue Classic Denim Casual Shirt - Shirts for Women from Roadster at Rs. 899. Style ID: 16874850,"The Roadster Lifestyle Co Women Blue Classic Denim Casual Shirt,  Roadster, Shirts, Topwear, Apparel, Apparel for Women, Buy The Roadster Lifestyle Co Women Blue Classic Denim Casual Shirt Online in India, Buy Shirts at best price"
watches/chumbak/chumbak-women-blue--off-white-interchangeable-strap-analogue-watch-8907605100482/12333270/buy,"['accessories', 'women-accessories', 'watches', 'chumbak-watches']","No.35, Doddanekkundi Industrial Area, Phase 1, K.R.Puram,Hoodi Sub Division, Behind IFB Factory,Bengaluru , Karnataka - 560048",Buy Chumbak Women Blue & Off White Interchangeable Strap Analogue Watch 8907605100482 - Watches for Women from Chumbak at Rs. 1617. Style ID: 12333270,"Chumbak Women Blue & Off White Interchangeable Strap Analogue Watch 8907605100482,  Chumbak, Watches, Watches, Accessories, Accessories for Women, Buy Chumbak Women Blue & Off White Interchangeable Strap Analogue Watch 8907605100482 Online in India, Buy Watches at best price"
tshirts/kay-dee/kay-dee-men-black-typography-printed-cotton-t-shirt/17290826/buy,"['clothing', 'men-clothing', 'tshirts', 'kay-dee-tshirts']",,Buy KAY DEE Men Black Typography Printed Cotton T Shirt - Tshirts for Men from KAY DEE at Rs. 499. Style ID: 17290826,"KAY DEE Men Black Typography Printed Cotton T Shirt,  KAY DEE, Tshirts, Topwear, Apparel, Apparel for Men, Buy KAY DEE Men Black Typography Printed Cotton T Shirt Online in India, Buy Tshirts at best price"
trousers/jaipur-kurti/jaipur-kurti-women-green-regular-fit-solid-trousers/9435995/buy,"['clothing', 'women-clothing', 'trousers', 'jaipur-kurti-trousers']","G-13, KARTARPURA INDUSTRIAL AREA,NEAR 22 GODAM,JAIPUR ,RAJASTHAN-302006Jaipur , Rajasthan - 302006",Buy Jaipur Kurti Women Green Regular Fit Solid Trousers - Trousers for Women from Jaipur Kurti at Rs. 610. Style ID: 9435995,"Jaipur Kurti Women Green Regular Fit Solid Trousers,  Jaipur Kurti, Trousers, Bottomwear, Apparel, Apparel for Women, Buy Jaipur Kurti Women Green Regular Fit Solid Trousers Online in India, Buy Trousers at best price"
shirts/sojanya/sojanya-men-navy-blue--white-regular-fit-printed-formal-shirt/11562602/buy,"['clothing', 'men-clothing', 'shirts', 'sojanya-shirts']","103 Vaishali (2nd Floor)PitampuraNew Delhi , Delhi - 110034",Buy SOJANYA Men Navy Blue & White Regular Fit Printed Formal Shirt - Shirts for Men from SOJANYA at Rs. 755. Style ID: 11562602,"SOJANYA Men Navy Blue & White Regular Fit Printed Formal Shirt,  SOJANYA, Shirts, Topwear, Apparel, Apparel for Men, Buy SOJANYA Men Navy Blue & White Regular Fit Printed Formal Shirt Online in India, Buy Shirts at best price"
nightdress/claura/claura-grey-printed-nightdress/18337326/buy,"['clothing', 'women-clothing', 'nightdress', 'claura-nightdress']","2, E-905, Saraswati Vihar, Pitampura, North West Delhi, Delhi, 110034Delhi , Delhi - 110034",Buy Claura Grey Printed Nightdress - Nightdress for Women from Claura at Rs. 649. Style ID: 18337326,"Claura Grey Printed Nightdress,  Claura, Nightdress, Loungewear And Nightwear, Apparel, Apparel for Women, Buy Claura Grey Printed Nightdress Online in India, Buy Nightdress at best price"
tshirts/forever-21/forever-21-men-white-typography-printed-t-shirt/17130226/buy,"['clothing', 'men-clothing', 'tshirts', 'forever-21-tshirts']","Cabin No. 6, Property 2, Gujarat Vihar, Vikas Marg, New Delhi, Delhi, 110092Delhi , Delhi - 110092",Buy FOREVER 21 Men White Typography Printed T Shirt - Tshirts for Men from FOREVER 21 at Rs. 524. Style ID: 17130226,"FOREVER 21 Men White Typography Printed T Shirt,  FOREVER 21, Tshirts, Topwear, Apparel, Apparel for Men, Buy FOREVER 21 Men White Typography Printed T Shirt Online in India, Buy Tshirts at best price"
tops/bostreet/bostreet-multicoloured-floral-print-styled-back-top/18139142/buy,"['clothing', 'women-clothing', 'tops', 'bostreet-tops']","HOUSE NO 356, BUILDING F-4, GALA 5/A,HOUSE NO 356, BUILDING F-4, GALA 5/A,Bhiwandi , Maharashtra - 421302",Buy BoStreet Green & Orange Floral Print Boxy Top - Tops for Women from BoStreet at Rs. 1511. Style ID: 18139142,"BoStreet Green & Orange Floral Print Boxy Top,  BoStreet, Tops, Topwear, Apparel, Apparel for Women, Buy BoStreet Green & Orange Floral Print Boxy Top Online in India, Buy Tops at best price"
track-pants/peter-england/peter-england-men-maroon-red-solid-cotton-track-pants/18661112/buy,"['clothing', 'men-clothing', 'track-pants', 'peter-england-track-pants']","Ground Floor, No 65/64, old No 65, 6th Block, Ward No 21, 2ndMain Road,Bengaluru , Karnataka - 560044",Buy Peter England Men Maroon Red Solid Cotton Track Pants - Track Pants for Men from Peter England at Rs. 1079. Style ID: 18661112,"Peter England Men Maroon Red Solid Cotton Track Pants,  Peter England, Track Pants, Bottomwear, Apparel, Apparel for Men, Buy Peter England Men Maroon Red Solid Cotton Track Pants Online in India, Buy Track Pants at best price"
sarees/mitera/mitera-mustard-yellow-ethnic-motifs-zari-organza-kanjeevaram-saree/17392526/buy,"['clothing', 'women-clothing', 'sarees', 'mitera-sarees']","4038, New Sardar Traders marketNear Sardar Fruit MarketSurat , Gujarat - 395010",Buy Mitera Mustard Yellow Ethnic Motifs Zari Organza Kanjeevaram Saree - Sarees for Women from Mitera at Rs. 1494. Style ID: 17392526,"Mitera Mustard Yellow Ethnic Motifs Zari Organza Kanjeevaram Saree,  Mitera, Sarees, Saree, Apparel, Apparel for Women, Buy Mitera Mustard Yellow Ethnic Motifs Zari Organza Kanjeevaram Saree Online in India, Buy Sarees at best price"
tshirts/madame/madame-women-white-typography-printed-pure-cotton-t-shirt/17822436/buy,"['clothing', 'women-clothing', 'tshirts', 'madame-tshirts']","JAIN AMAR CLOTHING PVT LTD, JAIN COMPLEX,NOORWALALudhiana , Punjab - 141007",Buy Madame Women White Typography Printed Pure Cotton T Shirt - Tshirts for Women from Madame at Rs. 899. Style ID: 17822436,"Madame Women White Typography Printed Pure Cotton T Shirt,  Madame, Tshirts, Topwear, Apparel, Apparel for Women, Buy Madame Women White Typography Printed Pure Cotton T Shirt Online in India, Buy Tshirts at best price"
tshirts/only/only-women-white-typography-printed-t-shirt/17939606/buy,"['clothing', 'women-clothing', 'tshirts', 'only-tshirts']","5th Floor, The Lalit Residency, The Lalit Mumbai, Sahar Airport Road, Andheri East, Mumbai Suburban, Maharashtra, 400059Mumbai , Maharashtra - 400059",Buy ONLY Women White Typography Printed T Shirt - Tshirts for Women from ONLY at Rs. 699. Style ID: 17939606,"ONLY Women White Typography Printed T Shirt,  ONLY, Tshirts, Topwear, Apparel, Apparel for Women, Buy ONLY Women White Typography Printed T Shirt Online in India, Buy Tshirts at best price"
dresses/dodo--moa/dodo--moa-brown--black-animal-printed-georgette-fit--flared-dress/17024926/buy,"['clothing', 'women-clothing', 'dresses', 'dodo-and-moa-dresses']","Plot No 33-34,Phase VI, Sector 37 GURUGRAM GurgaonGurugram , Haryana - 122001",Buy DODO & MOA Brown & Black Animal Printed Georgette Fit & Flared Dress - Dresses for Women from DODO & MOA at Rs. 1184. Style ID: 17024926,"DODO & MOA Brown & Black Animal Printed Georgette Fit & Flared Dress,  DODO & MOA, Dresses, Dress, Apparel, Apparel for Women, Buy DODO & MOA Brown & Black Animal Printed Georgette Fit & Flared Dress Online in India, Buy Dresses at best price"
track-pants/duke/duke-women-blue-solid-regular-fit-cotton-track-pants/17100506/buy,"['clothing', 'women-clothing', 'track-pants', 'duke-track-pants']","shopbox Ecommerce Pvt Ltd c/o MJ Logistics Private Limited,,Seabird Marine services Pvt Ltd Village Babra Bakirpur,Pataudi Road Near Adani Logistic Park, ICD PatliGurugram , Haryana - 122503",Buy Duke Women Blue Solid Regular Fit Cotton Track Pants - Track Pants for Women from Duke at Rs. 647. Style ID: 17100506,"Duke Women Blue Solid Regular Fit Cotton Track Pants,  Duke, Track Pants, Bottomwear, Apparel, Apparel for Women, Buy Duke Women Blue Solid Regular Fit Cotton Track Pants Online in India, Buy Track Pants at best price"
capris/broadstar/broadstar-women-blue-skinny-fit-denim-capris/17603682/buy,"['clothing', 'women-clothing', 'capris', 'broadstar-capris']","8A/6, GEETA COLONY, DELHI-110031Delhi , Delhi - 110031",Buy BROADSTAR Women Blue Skinny Fit Denim Capris - Capris for Women from BROADSTAR at Rs. 799. Style ID: 17603682,"BROADSTAR Women Blue Skinny Fit Denim Capris,  BROADSTAR, Capris, Bottomwear, Apparel, Apparel for Women, Buy BROADSTAR Women Blue Skinny Fit Denim Capris Online in India, Buy Capris at best price"
shirts/wrogn/wrogn-men-grey-slim-fit-checked-pure-cotton-casual-shirt/18297754/buy,"['clothing', 'men-clothing', 'shirts', 'wrogn-shirts']","10, Cabin No 17, PVR Plaza Building, H Block, Connaught CircusDelhi , Delhi - 110001",Buy WROGN Men Grey Slim Fit Checked Pure Cotton Casual Shirt - Shirts for Men from WROGN at Rs. 1559. Style ID: 18297754,"WROGN Men Grey Slim Fit Checked Pure Cotton Casual Shirt,  WROGN, Shirts, Topwear, Apparel, Apparel for Men, Buy WROGN Men Grey Slim Fit Checked Pure Cotton Casual Shirt Online in India, Buy Shirts at best price"
night-suits/etc/etc-women-navy-blue--white-striped-night-suit/17281282/buy,"['clothing', 'women-clothing', 'night-suits', 'etc-night-suits']","A-201SECTOR 63Noida , UTTAR PRADESH - 201301",Buy ETC Women Navy Blue & White Striped Night Suit - Night Suits for Women from ETC at Rs. 639. Style ID: 17281282,"ETC Women Navy Blue & White Striped Night Suit,  ETC, Night Suits, Loungewear And Nightwear, Apparel, Apparel for Women, Buy ETC Women Navy Blue & White Striped Night Suit Online in India, Buy Night Suits at best price"
sarees/kalini/kalini-grey-abstract-printed-poly-georgette-saree/17407672/buy,"['clothing', 'women-clothing', 'sarees', 'kalini-sarees']","7007, Hindustan Textile Centre-2,Dumbhal,Surat , Gujarat - 395010",Buy KALINI Grey Abstract Printed Poly Georgette Saree - Sarees for Women from KALINI at Rs. 464. Style ID: 17407672,"KALINI Grey Abstract Printed Poly Georgette Saree,  KALINI, Sarees, Saree, Apparel, Apparel for Women, Buy KALINI Grey Abstract Printed Poly Georgette Saree Online in India, Buy Sarees at best price"
kurta-sets/kalini/kalini-women-blue-floral-printed-kurta-with-trousers/18119954/buy,"['clothing', 'women-clothing', 'kurta-sets', 'kalini-kurta-sets']","Plot T01-06 ,Road 2, Laxminarayan Industrail Estate, BRC CompoundOpposite Dakeshwar mandir, Jeevan Jyothi Nagar, Udhna,Surat , Gujarat - 394210",Buy KALINI Women Blue Floral Printed Kurta With Trousers - Kurta Sets for Women from KALINI at Rs. 959. Style ID: 18119954,"KALINI Women Blue Floral Printed Kurta With Trousers,  KALINI, Kurta Sets, Apparel Set, Apparel, Apparel for Women, Buy KALINI Women Blue Floral Printed Kurta With Trousers Online in India, Buy Kurta Sets at best price"
socks/hrx-by-hrithik-roshan/hrx-by-hrithik-roshan-men-pack-of-3-ankle-length-socks/16543098/buy,"['accessories', 'boys-accessories', 'socks', 'hrx-by-hrithik-roshan-socks']","11th Floor, Flat No. 1106, 1107, 26, Kailash, Kasturba Gandhi Marg, New Delhi, New Delhi, Delhi, 110001Delhi , Delhi - 110001",Buy HRX By Hrithik Roshan Men Pack Of 3 Ankle Length Socks - Socks for Boys from HRX By Hrithik Roshan at Rs. 356. Style ID: 16543098,"HRX By Hrithik Roshan Men Pack Of 3 Ankle Length Socks,  HRX By Hrithik Roshan, Socks, Socks, Accessories, Accessories for Boys, Buy HRX By Hrithik Roshan Men Pack Of 3 Ankle Length Socks Online in India, Buy Socks at best price"
shorts/dressberry/dressberry-women-coral-pink-pure-cotton-solid-regular-fit-shorts/13179650/buy,"['clothing', 'women-clothing', 'shorts', 'dressberry-shorts']","5th Floor, Office No 504, Punj Essen House, 17-18, Nehru PlaceDelhi , Delhi - 110019",Buy DressBerry Women Coral Pink Pure Cotton Solid Regular Fit Shorts - Shorts for Women from DressBerry at Rs. 599. Style ID: 13179650,"DressBerry Women Coral Pink Pure Cotton Solid Regular Fit Shorts,  DressBerry, Shorts, Bottomwear, Apparel, Apparel for Women, Buy DressBerry Women Coral Pink Pure Cotton Solid Regular Fit Shorts Online in India, Buy Shorts at best price"
jeans/orchid-blues/orchid-blues-women-blue-mom-fit-high-rise-mildly-distressed-jeans/16452630/buy,"['clothing', 'women-clothing', 'jeans', 'orchid-blues-jeans']","3E/16 BPNIT FARIDABADFaridabad , Haryana - 121001",Buy Orchid Blues Women Blue Mom Fit High Rise Mildly Distressed Jeans - Jeans for Women from Orchid Blues at Rs. 883. Style ID: 16452630,"Orchid Blues Women Blue Mom Fit High Rise Mildly Distressed Jeans,  Orchid Blues, Jeans, Bottomwear, Apparel, Apparel for Women, Buy Orchid Blues Women Blue Mom Fit High Rise Mildly Distressed Jeans Online in India, Buy Jeans at best price"
casual-shoes/extrimos/extrimos-men-black-textured-slip-on-sneakers/15311102/buy,"['footwear', 'men-footwear', 'casual-shoes', 'extrimos-casual-shoes']","MASTER PLAN ROAD, 7, LAJPAT KUNJ, KHANDARI,AGRA , UTTAR PRADESH - 282002",Buy EXTRIMOS Men Black Textured Slip On Sneakers - Casual Shoes for Men from EXTRIMOS at Rs. 1215. Style ID: 15311102,"EXTRIMOS Men Black Textured Slip On Sneakers,  EXTRIMOS, Casual Shoes, Shoes, Footwear, Footwear for Men, Buy EXTRIMOS Men Black Textured Slip On Sneakers Online in India, Buy Casual Shoes at best price"
vases/exclusivelane/exclusivelane-red--white-printed-ceramic-round-vase/18158610/buy,"['home-furnishing', 'unisex-home-furnishing', 'vases', 'exclusivelane-vases']",,Buy ExclusiveLane Red & White Printed Ceramic Round Vase - Vases for Unisex from ExclusiveLane at Rs. 947. Style ID: 18158610,"ExclusiveLane Red & White Printed Ceramic Round Vase,  ExclusiveLane, Vases, Home Decor, Home, Home for Unisex, Buy ExclusiveLane Red & White Printed Ceramic Round Vase Online in India, Buy Vases at best price"
wallets/baggit/baggit-women-violet-three-fold-wallet/15979254/buy,"['accessories', 'women-accessories', 'wallets', 'baggit-wallets']","204/218Narayan Udyog BhavanLalbaughMumbai , Maharashtra - 400012",Buy Baggit Women Violet Three Fold Wallet - Wallets for Women from Baggit at Rs. 474. Style ID: 15979254,"Baggit Women Violet Three Fold Wallet,  Baggit, Wallets, Wallets, Accessories, Accessories for Women, Buy Baggit Women Violet Three Fold Wallet Online in India, Buy Wallets at best price"
dresses/poppi/poppi-grey-satin-a-line-midi-dress/18248674/buy,"['clothing', 'women-clothing', 'dresses', 'poppi-dresses']","F48, Ground Floor, Shivji Market Co-Op Premises Society Ltd. Plot 8-9, Sector-19 D, Vashi, Navi-Mumbai. 400703.Mumbai , MAHARASHTRA - 400703",Buy POPPI Grey Satin A Line Smocked Waist Cut Out Midi Dress - Dresses for Women from POPPI at Rs. 4250. Style ID: 18248674,"POPPI Grey Satin A Line Smocked Waist Cut Out Midi Dress,  POPPI, Dresses, Dress, Apparel, Apparel for Women, Buy POPPI Grey Satin A Line Smocked Waist Cut Out Midi Dress Online in India, Buy Dresses at best price"
shirts/canary-london/canary-london-men-white-smart-slim-fit-checked-casual-shirt/18275290/buy,"['clothing', 'men-clothing', 'shirts', 'canary-london-shirts']","13 388Civil Lines VIP Road KanpurKanpur , Uttar pradesh - 208001",Buy Canary London Men White Smart Slim Fit Checked Casual Shirt - Shirts for Men from Canary London at Rs. 1799. Style ID: 18275290,"Canary London Men White Smart Slim Fit Checked Casual Shirt,  Canary London, Shirts, Topwear, Apparel, Apparel for Men, Buy Canary London Men White Smart Slim Fit Checked Casual Shirt Online in India, Buy Shirts at best price"
sweaters/kalt/kalt-women-navy-blue-floral-printed-cardigan-sweater/13270978/buy,"['clothing', 'women-clothing', 'sweaters', 'kalt-sweaters']","415 , Industrial Area ALudhianaLudhiana , Punjab - 141003",Buy Kalt Women Navy Blue Floral Printed Cardigan Sweater - Sweaters for Women from Kalt at Rs. 1040. Style ID: 13270978,"Kalt Women Navy Blue Floral Printed Cardigan Sweater,  Kalt, Sweaters, Topwear, Apparel, Apparel for Women, Buy Kalt Women Navy Blue Floral Printed Cardigan Sweater Online in India, Buy Sweaters at best price"
casual-shoes/kazarmax/kazarmax-unisex-kids-white-pu-flat-boots/16377434/buy,"['footwear', 'unisex-kids-footwear', 'casual-shoes', 'kazarmax-casual-shoes']","Khasra No. 31/9/2, 12/2, Sector-35, Village Begumpur Khatola, Gurgaon, Haryana, 122001Gurugram , Haryana - 122001",Buy KazarMax Unisex Kids White PU Flat Boots - Casual Shoes for Unisex Kids from KazarMax at Rs. 1289. Style ID: 16377434,"KazarMax Unisex Kids White PU Flat Boots,  KazarMax, Casual Shoes, Shoes, Footwear, Footwear for Unisex Kids, Buy KazarMax Unisex Kids White PU Flat Boots Online in India, Buy Casual Shoes at best price"
tshirts/mufti/mufti-men-navy-blue-printed-round-neck-t-shirt/13874784/buy,"['clothing', 'men-clothing', 'tshirts', 'mufti-tshirts']","NO. 271 to 275,281 TO 285 l2TH & l3tH CROSS,KAREEMSAAB LAYOUT, HENNAGANAHALLI , VISHWANEEDAM POST,Karnataka,India,560091Bengaluru , Karnataka - 560091",Buy Mufti Men Navy Blue Printed Round Neck T Shirt - Tshirts for Men from Mufti at Rs. 629. Style ID: 13874784,"Mufti Men Navy Blue Printed Round Neck T Shirt,  Mufti, Tshirts, Topwear, Apparel, Apparel for Men, Buy Mufti Men Navy Blue Printed Round Neck T Shirt Online in India, Buy Tshirts at best price"
saree-blouse/siril/siril-women-black-solid-woven-design-cotton-saree-blouse/17967906/buy,"['clothing', 'women-clothing', 'saree-blouse', 'siril-saree-blouse']","7007, Hindustan Textile Centre-2,Dumbhal,Surat , Gujarat - 395010",Buy SIRIL Women Black Solid Woven Design Cotton Saree Blouse - Saree Blouse for Women from SIRIL at Rs. 470. Style ID: 17967906,"SIRIL Women Black Solid Woven Design Cotton Saree Blouse,  SIRIL, Saree Blouse, Saree, Apparel, Apparel for Women, Buy SIRIL Women Black Solid Woven Design Cotton Saree Blouse Online in India, Buy Saree Blouse at best price"
sandals/softio/softio-men-black-textured-comfort-sandals/17164630/buy,"['footwear', 'men-footwear', 'sandals', 'softio-sandals']","50/1 B, GYAS PURA, SHAHGANJ, PUSHPANJALI DHAMAgra, Uttar PradeshAgra , Uttar pradesh - 282010",Buy SOFTIO Men Black Textured Comfort Sandals - Sandals for Men from SOFTIO at Rs. 909. Style ID: 17164630,"SOFTIO Men Black Textured Comfort Sandals,  SOFTIO, Sandals, Sandal, Footwear, Footwear for Men, Buy SOFTIO Men Black Textured Comfort Sandals Online in India, Buy Sandals at best price"
