prod_link,tags,seller_address,meta_description,meta_keyword
tshirts/fleximaa/fleximaa-men-black-polo-collar-t-shirt/18101168/buy,"['clothing', 'men-clothing', 'tshirts', 'fleximaa-tshirts']","82, KAVERY STREET,ODAKKADUTirupur , TAMILNADU - 641602",Buy Fleximaa Men Black Polo Collar T Shirt - Tshirts for Men from Fleximaa at Rs. 470. Style ID: 18101168,"Fleximaa Men Black Polo Collar T Shirt,  Fleximaa, Tshirts, Topwear, Apparel, Apparel for Men, Buy Fleximaa Men Black Polo Collar T Shirt Online in India, Buy Tshirts at best price"
flats/liberty/liberty-women-grey-ballerinas-flats/18540442/buy,"['footwear', 'women-footwear', 'flats', 'liberty-flats']","Liberty Shoes Limited Central House office, Railway Road, Karnal, Haryana, 132001 - INDIAJNTU Road, KukatPally Housing Board, Karnal , Haryana - 132001",Buy Liberty Women Grey Ballerinas Flats - Flats for Women from Liberty at Rs. 549. Style ID: 18540442,"Liberty Women Grey Ballerinas Flats,  Liberty, Flats, Shoes, Footwear, Footwear for Women, Buy Liberty Women Grey Ballerinas Flats Online in India, Buy Flats at best price"
dresses/soch/soch-mustard-yellow-floral-a-line-maxi-dress/18245920/buy,"['clothing', 'women-clothing', 'dresses', 'soch-dresses']","14 bachammal roadBengaluru , Karnataka - 560005",Buy Soch Mustard Yellow Floral Kaftan Dress - Dresses for Women from Soch at Rs. 3748. Style ID: 18245920,"Soch Mustard Yellow Floral Kaftan Dress,  Soch, Dresses, Dress, Apparel, Apparel for Women, Buy Soch Mustard Yellow Floral Kaftan Dress Online in India, Buy Dresses at best price"
trousers/v-mart/v-mart-men-blue-slim-fit-cotton-trousers/18129294/buy,"['clothing', 'men-clothing', 'trousers', 'v-mart-trousers']","Plot No.862, Sector 19, Phase VUdyog Vihar, Industrial AreaGurugram , Haryana - 122016",Buy V Mart Men Blue Slim Fit Cotton Trousers - Trousers for Men from V Mart at Rs. 990. Style ID: 18129294,"V Mart Men Blue Slim Fit Cotton Trousers,  V Mart, Trousers, Bottomwear, Apparel, Apparel for Men, Buy V Mart Men Blue Slim Fit Cotton Trousers Online in India, Buy Trousers at best price"
sports-shoes/hirolas/hirolas-men-grey--white-walking-shoes/15033684/buy,"['footwear', 'men-footwear', 'sports-shoes', 'hirolas-sports-shoes']","F-116, Sector 8Noida , Uttar Pradesh - 201301",Buy HIROLAS Men Grey & White Walking Shoes - Sports Shoes for Men from HIROLAS at Rs. 839. Style ID: 15033684,"HIROLAS Men Grey & White Walking Shoes,  HIROLAS, Sports Shoes, Shoes, Footwear, Footwear for Men, Buy HIROLAS Men Grey & White Walking Shoes Online in India, Buy Sports Shoes at best price"
sarees/house-of-pataudi/house-of-pataudi-sea-green--navy-blue-ethnic-motifs-zari-silk-blend-banarasi-saree/17091914/buy,"['clothing', 'women-clothing', 'sarees', 'house-of-pataudi-sarees']","4-B, Anjani TowerParle PointSurat , Gujarat - 395007",Buy House Of Pataudi Sea Green & Navy Blue Ethnic Motifs Zari Silk Blend Banarasi Saree - Sarees for Women from House Of Pataudi at Rs. 1994. Style ID: 17091914,"House Of Pataudi Sea Green & Navy Blue Ethnic Motifs Zari Silk Blend Banarasi Saree,  House Of Pataudi, Sarees, Saree, Apparel, Apparel for Women, Buy House Of Pataudi Sea Green & Navy Blue Ethnic Motifs Zari Silk Blend Banarasi Saree Online in India, Buy Sarees at best price"
kurta-sets/deyann/deyann-men-blue--cream-coloured-self-design-kurta-with-churidar/10276225/buy,"['clothing', 'men-clothing', 'kurta-sets', 'deyann-kurta-sets']","9 James Hickey Sarani1st Floor, Room No. 106,Kolkata , West Bengal - 700069",Buy DEYANN Men Blue & Cream Coloured Self Design Kurta With Churidar - Kurta Sets for Men from DEYANN at Rs. 1677. Style ID: 10276225,"DEYANN Men Blue & Cream Coloured Self Design Kurta With Churidar,  DEYANN, Kurta Sets, Apparel Set, Apparel, Apparel for Men, Buy DEYANN Men Blue & Cream Coloured Self Design Kurta With Churidar Online in India, Buy Kurta Sets at best price"
sweatshirts/hm/hm-girls-grey-sleeveless-printed-zip-through-hoodie/17607386/buy,"['clothing', 'girls-clothing', 'sweatshirts', 'h-and-m-sweatshirts']","Prakhhyat Infraprojects PVT. LTD., BUILDING 6, K-Square Logistics Park C/O LF LogisticsNear Padgha Toll Naka on MUMBAI-NASIKThane , Maharashtra - 421101","H&M Girls Grey Sleeveless Printed Zip Through Hoodie,  H&M, Sweatshirts, Topwear, Apparel, Apparel for Girls, Buy H&M Girls Grey Sleeveless Printed Zip Through Hoodie Online in India, Buy Sweatshirts at best price","H&M Girls Grey Sleeveless Printed Zip Through Hoodie,  H&M, Sweatshirts, Topwear, Apparel, Apparel for Girls, Buy H&M Girls Grey Sleeveless Printed Zip Through Hoodie Online in India, Buy Sweatshirts at best price"
tshirts/pluss/pluss-women-lovely-olive-solid-volume-play-tshirt/17901300/buy,"['clothing', 'women-clothing', 'tshirts', 'pluss-tshirts']","First and Second Floor, A 38/3, MAYAPURI INDUSTRIAL AREA-1,  New Delhi, West Delhi, Delhi, 110064New Delhi , Delhi - 110064",Buy PlusS Women Lovely Olive Solid Volume Play Tshirt - Tshirts for Women from PlusS at Rs. 737. Style ID: 17901300,"PlusS Women Lovely Olive Solid Volume Play Tshirt,  PlusS, Tshirts, Topwear, Apparel, Apparel for Women, Buy PlusS Women Lovely Olive Solid Volume Play Tshirt Online in India, Buy Tshirts at best price"
palazzos/bitterlime/bitterlime-women-white-flared-solid-palazzos/4320433/buy,"['clothing', 'women-clothing', 'palazzos', 'bitterlime-palazzos']","E-97/1, FLAT NO 303, BENGALI COLONY, MAHAVIR ENCLAVE, NEW DELHI 110045Delhi , Delhi - 110045",Buy Bitterlime Women White Flared Solid Palazzos - Palazzos for Women from Bitterlime at Rs. 584. Style ID: 4320433,"Bitterlime Women White Flared Solid Palazzos,  Bitterlime, Palazzos, Bottomwear, Apparel, Apparel for Women, Buy Bitterlime Women White Flared Solid Palazzos Online in India, Buy Palazzos at best price"
nightdress/vemante/vemante-blue--white-floral-printed-pure-cotton-maxi-nightdress/13982840/buy,"['clothing', 'women-clothing', 'nightdress', 'vemante-nightdress']","2441, F/F, FAIZ ROAD KAROL BAGH, NAGAR, Central Delhi, Delhi, 110005Delhi , Delhi - 110005",Buy Vemante Blue & White Floral Printed Pure Cotton Maxi Nightdress - Nightdress for Women from Vemante at Rs. 689. Style ID: 13982840,"Vemante Blue & White Floral Printed Pure Cotton Maxi Nightdress,  Vemante, Nightdress, Loungewear And Nightwear, Apparel, Apparel for Women, Buy Vemante Blue & White Floral Printed Pure Cotton Maxi Nightdress Online in India, Buy Nightdress at best price"
kurta-sets/vbuyz/vbuyz-women-grey--pink-printed-kurta-with-palazzos--dupatta/12222550/buy,"['clothing', 'women-clothing', 'kurta-sets', 'vbuyz-kurta-sets']","813, Raghuvir Textile MallSurat , Gujarat - 395010",Buy Vbuyz Women Grey & Pink Printed Kurta With Palazzos & Dupatta - Kurta Sets for Women from Vbuyz at Rs. 1439. Style ID: 12222550,"Vbuyz Women Grey & Pink Printed Kurta With Palazzos & Dupatta,  Vbuyz, Kurta Sets, Apparel Set, Apparel, Apparel for Women, Buy Vbuyz Women Grey & Pink Printed Kurta With Palazzos & Dupatta Online in India, Buy Kurta Sets at best price"
shirts/campus-sutra/campus-sutra-men-black-opaque-casual-shirt/15940574/buy,"['clothing', 'men-clothing', 'shirts', 'campus-sutra-shirts']","10, Cabin No 17, PVR Plaza Building, H Block, Connaught CircusDelhi , Delhi - 110001",Buy Campus Sutra Men Black Opaque Casual Shirt - Shirts for Men from Campus Sutra at Rs. 749. Style ID: 15940574,"Campus Sutra Men Black Opaque Casual Shirt,  Campus Sutra, Shirts, Topwear, Apparel, Apparel for Men, Buy Campus Sutra Men Black Opaque Casual Shirt Online in India, Buy Shirts at best price"
jeans/mufti/mufti-men-blue-skinny-fit-mid-rise-mildly-distressed-jeans/13188606/buy,"['clothing', 'men-clothing', 'jeans', 'mufti-jeans']","Ethix House,3 Castelino Road Pune Camp,Pune Pune Maharashtra 411001PUNE , Maharashtra - 411001",Buy Mufti Men Blue Skinny Fit Mid Rise Mildly Distressed Jeans - Jeans for Men from Mufti at Rs. 1979. Style ID: 13188606,"Mufti Men Blue Skinny Fit Mid Rise Mildly Distressed Jeans,  Mufti, Jeans, Bottomwear, Apparel, Apparel for Men, Buy Mufti Men Blue Skinny Fit Mid Rise Mildly Distressed Jeans Online in India, Buy Jeans at best price"
tshirts/us-polo-assn-kids/us-polo-assn-kids-boys-multicoloured-striped-pure-cotton-sleeveless-pure-cotton-t-shirt/14081860/buy,"['clothing', 'boys-clothing', 'tshirts', 'u.s.-polo-assn.-kids-tshirts']","10TH FLOOR, DU PARC TRINITY, NO 17, M.G ROAD, Bengaluru (Bangalore) Rural,Bengaluru , Karnataka - 560001",Buy U.S. Polo Assn. Kids Boys Multicoloured Striped Pure Cotton Sleeveless Pure Cotton T Shirt - Tshirts for Boys from U.S. Polo Assn. Kids at Rs. 383. Style ID: 14081860,"U.S. Polo Assn. Kids Boys Multicoloured Striped Pure Cotton Sleeveless Pure Cotton T Shirt,  U.S. Polo Assn. Kids, Tshirts, Topwear, Apparel, Apparel for Boys, Buy U.S. Polo Assn. Kids Boys Multicoloured Striped Pure Cotton Sleeveless Pure Cotton T Shirt Online in India, Buy Tshirts at best price"
tshirts/moda-rapido/moda-rapido-men-white-typography-printed-casual-t-shirt/15822236/buy,"['clothing', 'men-clothing', 'tshirts', 'moda-rapido-tshirts']","5th Floor, Office No 504, Punj Essen House, 17-18, Nehru PlaceDelhi , Delhi - 110019",Buy Moda Rapido Men White Typography Printed Casual T Shirt - Tshirts for Men from Moda Rapido at Rs. 399. Style ID: 15822236,"Moda Rapido Men White Typography Printed Casual T Shirt,  Moda Rapido, Tshirts, Topwear, Apparel, Apparel for Men, Buy Moda Rapido Men White Typography Printed Casual T Shirt Online in India, Buy Tshirts at best price"
casual-shoes/kleat/kleat-men-black-colourblocked-sneakers/17164496/buy,"['footwear', 'men-footwear', 'casual-shoes', 'kleat-casual-shoes']","Ashish enterprises C-37 new agra colony  Opp community hall  Agra 282005Agra , Uttar Pradesh - 282005",Buy KLEAT Men Black Colourblocked Sneakers - Casual Shoes for Men from KLEAT at Rs. 1199. Style ID: 17164496,"KLEAT Men Black Colourblocked Sneakers,  KLEAT, Casual Shoes, Shoes, Footwear, Footwear for Men, Buy KLEAT Men Black Colourblocked Sneakers Online in India, Buy Casual Shoes at best price"
bedsheets/jc-collection/jc-collection-yellow--blue-geometric-160-tc-king-bedsheet/18016166/buy,"['home-furnishing', 'unisex-home-furnishing', 'bedsheets', 'jc-collection-bedsheets']","Second Floor, Plot No. 82, Okhla Industrial Estate, Phase - III, New Delhi, Delhi, 110020Delhi , Delhi - 110020",Buy JC Collection Yellow & Blue Geometric 160 TC King Bedsheet - Bedsheets for Unisex from JC Collection at Rs. 959. Style ID: 18016166,"JC Collection Yellow & Blue Geometric 160 TC King Bedsheet,  JC Collection, Bedsheets, Bedding, Home, Home for Unisex, Buy JC Collection Yellow & Blue Geometric 160 TC King Bedsheet Online in India, Buy Bedsheets at best price"
shirts/office--you/office--you-women-peach-coloured-casual-shirt/17994348/buy,"['clothing', 'women-clothing', 'shirts', 'office-and-you-shirts']","J-4 Shri Ram Trade Center 2nd Floor C-1 & C-2Main Road Bishanpura Sector-58Noida , Uttar pradesh - 201301",Buy OFFICE & YOU Women Peach Coloured Casual Shirt - Shirts for Women from OFFICE & YOU at Rs. 2999. Style ID: 17994348,"OFFICE & YOU Women Peach Coloured Casual Shirt,  OFFICE & YOU, Shirts, Topwear, Apparel, Apparel for Women, Buy OFFICE & YOU Women Peach Coloured Casual Shirt Online in India, Buy Shirts at best price"
tshirts/louis-philippe-athplay/louis-philippe-athplay-men-blue-solid-henley-neck-slim-fit-pure-cotton-t-shirt/17205814/buy,"['clothing', 'men-clothing', 'tshirts', 'louis-philippe-athplay-tshirts']","Ground Floor, No 65/64, old No 65, 6th Block, Ward No 21, 2ndMain Road,Bengaluru , Karnataka - 560044",Buy Louis Philippe ATHPLAY Men Blue Solid Henley Neck Slim Fit Pure Cotton T Shirt - Tshirts for Men from Louis Philippe ATHPLAY at Rs. 1614. Style ID: 17205814,"Louis Philippe ATHPLAY Men Blue Solid Henley Neck Slim Fit Pure Cotton T Shirt,  Louis Philippe ATHPLAY, Tshirts, Topwear, Apparel, Apparel for Men, Buy Louis Philippe ATHPLAY Men Blue Solid Henley Neck Slim Fit Pure Cotton T Shirt Online in India, Buy Tshirts at best price"
tops/studio-rasa/studio-rasa-gold-toned-embellished-net-fitted-crop-top/15179760/buy,"['clothing', 'women-clothing', 'tops', 'studio-rasa-tops']","A-96, M B Road, SaidulajabNear BikanerDelhi , DELHI - 110030",Buy Studio Rasa Gold Toned Embellished Net Fitted Crop Top - Tops for Women from Studio Rasa at Rs. 689. Style ID: 15179760,"Studio Rasa Gold Toned Embellished Net Fitted Crop Top,  Studio Rasa, Tops, Topwear, Apparel, Apparel for Women, Buy Studio Rasa Gold Toned Embellished Net Fitted Crop Top Online in India, Buy Tops at best price"
bedding-set/jc-collection/jc-collection-grey--black-printed-double-king-bedding-set/18062400/buy,"['home-furnishing', 'unisex-home-furnishing', 'bedding-set', 'jc-collection-bedding-set']","Second Floor, Plot No. 82, Okhla Industrial Estate, Phase - III, New Delhi, Delhi, 110020Delhi , Delhi - 110020",Buy JC Collection Grey & Black Printed Double King Bedding Set - Bedding Set for Unisex from JC Collection at Rs. 2879. Style ID: 18062400,"JC Collection Grey & Black Printed Double King Bedding Set,  JC Collection, Bedding Set, Bedding, Home, Home for Unisex, Buy JC Collection Grey & Black Printed Double King Bedding Set Online in India, Buy Bedding Set at best price"
dinnerware/india-circus/india-circus-white--pink-set-of-6-ceramic-printed-plates-/14035766/buy,"['home-furnishing', 'unisex-home-furnishing', 'dinnerware', 'india-circus-dinnerware']","A66, 801, GOVIND REGENCY,, SHANTI PATH, TILAK NAGAR, JAIPUR, Rajasthan, India, 302004Jaipur , Rajasthan - 302004",Buy India Circus White & Pink Set Of 6 Ceramic Printed Plates - Dinnerware for Unisex from India Circus at Rs. 1626. Style ID: 14035766,"India Circus White & Pink Set Of 6 Ceramic Printed Plates,  India Circus, Dinnerware, Kitchen And Dining, Home, Home for Unisex, Buy India Circus White & Pink Set Of 6 Ceramic Printed Plates Online in India, Buy Dinnerware at best price"
necklace-and-chains/lilly--sparkle/lilly--sparkle-gold-plated-layered-charm-necklace/17152408/buy,"['accessories', 'women-accessories', 'necklace-and-chains', 'lilly-and-sparkle-necklace-and-chains']",,Buy Lilly & Sparkle Gold Plated Layered Charm Necklace - Necklace And Chains for Women from Lilly & Sparkle at Rs. 749. Style ID: 17152408,"Lilly & Sparkle Gold Plated Layered Charm Necklace,  Lilly & Sparkle, Necklace And Chains, Jewellery, Accessories, Accessories for Women, Buy Lilly & Sparkle Gold Plated Layered Charm Necklace Online in India, Buy Necklace And Chains at best price"
tshirts/puma/puma-men-white-printed-slim-fit-training-or-gym-cotton-t-shirt/17537514/buy,"['clothing', 'men-clothing', 'tshirts', 'puma-tshirts']","Puma sports India Pvt Ltd/ Word Cat India Pvt Ltd. 496, Mahadevapura Main RoadNext to Hewlett Packard Service Gate, Mahadevapura, BangaloreBengaluru , Karnataka - 560048",Buy Puma Men White Printed Slim Fit Training Or Gym Cotton T Shirt - Tshirts for Men from Puma at Rs. 639. Style ID: 17537514,"Puma Men White Printed Slim Fit Training Or Gym Cotton T Shirt,  Puma, Tshirts, Topwear, Apparel, Apparel for Men, Buy Puma Men White Printed Slim Fit Training Or Gym Cotton T Shirt Online in India, Buy Tshirts at best price"
tops/friskers/friskers-womens-2-blue--grey-tank-top/15050328/buy,"['clothing', 'women-clothing', 'tops', 'friskers-tops']","Flat no 61Vijay veer awas, Sec.18A, DwarkaDelhi , Delhi - 110075",Buy Friskers Womens 2 Blue & Grey Tank Top - Tops for Women from Friskers at Rs. 528. Style ID: 15050328,"Friskers Womens 2 Blue & Grey Tank Top,  Friskers, Tops, Topwear, Apparel, Apparel for Women, Buy Friskers Womens 2 Blue & Grey Tank Top Online in India, Buy Tops at best price"
casual-shoes/neemans/neemans-women-cream-coloured-woven-design-loafers/16963396/buy,"['footwear', 'women-footwear', 'casual-shoes', 'neemans-casual-shoes']","6-3-885/7/B/5,First Floor,V V Mansion,, Opp.Amrutha Mall,Somajiguda Circle, Telangana, India, 500082Opp.Amrutha Mall,Somajiguda CircleHyderabad , Telangana - 500082",Buy NEEMANS Women Cream Coloured Woven Design Loafers - Casual Shoes for Women from NEEMANS at Rs. 2639. Style ID: 16963396,"NEEMANS Women Cream Coloured Woven Design Loafers,  NEEMANS, Casual Shoes, Shoes, Footwear, Footwear for Women, Buy NEEMANS Women Cream Coloured Woven Design Loafers Online in India, Buy Casual Shoes at best price"
shirts/yovish/yovish-men-brown-smart-slim-fit-printed-casual-shirt/18215484/buy,"['clothing', 'men-clothing', 'shirts', 'yovish-shirts']","3rd FLOOR, 3/1, NAYANDHALLI, OPP GOPALAN ARCH MALLMYSORE ROAD CROSSBangalore , KARNATAKA - 560039",Buy YOVISH Men Brown Smart Slim Fit Printed Casual Shirt - Shirts for Men from YOVISH at Rs. 959. Style ID: 18215484,"YOVISH Men Brown Smart Slim Fit Printed Casual Shirt,  YOVISH, Shirts, Topwear, Apparel, Apparel for Men, Buy YOVISH Men Brown Smart Slim Fit Printed Casual Shirt Online in India, Buy Shirts at best price"
track-pants/mast--harbour/mast--harbour-women-red--side-stripes-cropped-track-pants/14819940/buy,"['clothing', 'women-clothing', 'track-pants', 'mast-and-harbour-track-pants']","Awfis, 7th floor, HM Vibha Tower, 25 Laskar Hosur Road, Adugodi, Bengalore 560029Bengaluru , Karnataka - 560029",Buy Mast & Harbour Women Red  Side Stripes Cropped Track Pants - Track Pants for Women from Mast & Harbour at Rs. 629. Style ID: 14819940,"Mast & Harbour Women Red  Side Stripes Cropped Track Pants,  Mast & Harbour, Track Pants, Bottomwear, Apparel, Apparel for Women, Buy Mast & Harbour Women Red  Side Stripes Cropped Track Pants Online in India, Buy Track Pants at best price"
shorts/gini-and-jony/gini-and-jony-boys-navy-blue--grey-cotton-brand-logo-print-mid-rise-knee-length-shorts/15540712/buy,"['clothing', 'boys-clothing', 'shorts', 'gini-and-jony-shorts']","5A/19,Ground Floor ( Front Portion),Ansari Raod,DaryaganjDelhi , Delhi - 110002",Buy Gini And Jony Boys Navy Blue & Grey Cotton Brand Logo Print Mid Rise Knee Length Shorts - Shorts for Boys from Gini And Jony at Rs. 399. Style ID: 15540712,"Gini And Jony Boys Navy Blue & Grey Cotton Brand Logo Print Mid Rise Knee Length Shorts,  Gini And Jony, Shorts, Bottomwear, Apparel, Apparel for Boys, Buy Gini And Jony Boys Navy Blue & Grey Cotton Brand Logo Print Mid Rise Knee Length Shorts Online in India, Buy Shorts at best price"
kurta-sets/ortange/ortange-women-navy-blue-ethnic-motifs-printed-gotta-patti-kurta-with-palazzos--with-dupatta/18140466/buy,"['clothing', 'women-clothing', 'kurta-sets', 'ortange-kurta-sets']","P.NO. C-24, BHANWAR NAGARNEAR BALAJI MANDIR, KHATRI NAGAR, SANGANERJaipur , Rajasthan - 302029",Buy ORTANGE Women Navy Blue Ethnic Motifs Printed Gotta Patti Kurta With Palazzos & With Dupatta - Kurta Sets for Women from ORTANGE at Rs. 1349. Style ID: 18140466,"ORTANGE Women Navy Blue Ethnic Motifs Printed Gotta Patti Kurta With Palazzos & With Dupatta,  ORTANGE, Kurta Sets, Apparel Set, Apparel, Apparel for Women, Buy ORTANGE Women Navy Blue Ethnic Motifs Printed Gotta Patti Kurta With Palazzos & With Dupatta Online in India, Buy Kurta Sets at best price"
tshirts/jump-usa/jump-usa-men-blue-colourblocked-round-neck-sleeveless-t-shirt/12731290/buy,"['clothing', 'men-clothing', 'tshirts', 'jump-usa-tshirts']","JPCA29Noida , Uttar pradesh - 201301",Buy JUMP USA Men Blue Colourblocked Round Neck Sleeveless T Shirt - Tshirts for Men from JUMP USA at Rs. 479. Style ID: 12731290,"JUMP USA Men Blue Colourblocked Round Neck Sleeveless T Shirt,  JUMP USA, Tshirts, Topwear, Apparel, Apparel for Men, Buy JUMP USA Men Blue Colourblocked Round Neck Sleeveless T Shirt Online in India, Buy Tshirts at best price"
kurta-sets/jaipur-kurti/jaipur-kurti-women-purple--golden-printed-kurta-with-trousers/13081586/buy,"['clothing', 'women-clothing', 'kurta-sets', 'jaipur-kurti-kurta-sets']","G-13, KARTARPURA INDUSTRIAL AREA,NEAR 22 GODAM,JAIPUR ,RAJASTHAN-302006Jaipur , Rajasthan - 302006",Buy Jaipur Kurti Women Purple & Golden Printed Kurta With Trousers - Kurta Sets for Women from Jaipur Kurti at Rs. 877. Style ID: 13081586,"Jaipur Kurti Women Purple & Golden Printed Kurta With Trousers,  Jaipur Kurti, Kurta Sets, Apparel Set, Apparel, Apparel for Women, Buy Jaipur Kurti Women Purple & Golden Printed Kurta With Trousers Online in India, Buy Kurta Sets at best price"
tops/roadster/the-roadster-lifestyle-co-women-green-striped-ruffles-tank-cropped-top/16902220/buy,"['clothing', 'women-clothing', 'tops', 'roadster-tops']","406, B2 and C, 4th Floor,Centrum Plaza, Golf Course Road, Sector - 53,Gurugram , Haryana - 122102",Buy The Roadster Lifestyle Co Women Green Striped Ruffles Tank Cropped Top - Tops for Women from Roadster at Rs. 439. Style ID: 16902220,"The Roadster Lifestyle Co Women Green Striped Ruffles Tank Cropped Top,  Roadster, Tops, Topwear, Apparel, Apparel for Women, Buy The Roadster Lifestyle Co Women Green Striped Ruffles Tank Cropped Top Online in India, Buy Tops at best price"
heels/shoetopia/shoetopia-women-black-embellished-heels/12314812/buy,"['footwear', 'women-footwear', 'heels', 'shoetopia-heels']","Basement floor B- 86 Mayapuri Industerial Area Phase-1New Delhi , Delhi - 110064",Buy Shoetopia Women Black Embellished Heels - Heels for Women from Shoetopia at Rs. 799. Style ID: 12314812,"Shoetopia Women Black Embellished Heels,  Shoetopia, Heels, Shoes, Footwear, Footwear for Women, Buy Shoetopia Women Black Embellished Heels Online in India, Buy Heels at best price"
flats/bata/bata-women-brown-t-strap-flats/17002452/buy,"['footwear', 'women-footwear', 'flats', 'bata-flats']","BATA INDIA LTDGurugram , Haryana - 122504",Buy Bata Women Brown T Strap Flats - Flats for Women from Bata at Rs. 639. Style ID: 17002452,"Bata Women Brown T Strap Flats,  Bata, Flats, Shoes, Footwear, Footwear for Women, Buy Bata Women Brown T Strap Flats Online in India, Buy Flats at best price"
trousers/max/max-boys-black-joggers-trousers/18325500/buy,"['clothing', 'boys-clothing', 'trousers', 'max-trousers']","#41/2,42/2,Oblapura Gram panchyat,Anugondanahalli HobliDevangundi Main RoadHoskote TalukBengaluru , Karnataka - 560067",Buy Max Boys Black Joggers Trousers - Trousers for Boys from Max at Rs. 949. Style ID: 18325500,"Max Boys Black Joggers Trousers,  Max, Trousers, Bottomwear, Apparel, Apparel for Boys, Buy Max Boys Black Joggers Trousers Online in India, Buy Trousers at best price"
nightdress/klamotten/klamotten-red-maxi-nightdress/18522736/buy,"['clothing', 'women-clothing', 'nightdress', 'klamotten-nightdress']","C-181 3rd FLOORSECTOR 63 NOIDANoida , Uttar Pradesh - 201301",Buy Klamotten Red Maxi Nightdress - Nightdress for Women from Klamotten at Rs. 439. Style ID: 18522736,"Klamotten Red Maxi Nightdress,  Klamotten, Nightdress, Loungewear And Nightwear, Apparel, Apparel for Women, Buy Klamotten Red Maxi Nightdress Online in India, Buy Nightdress at best price"
shirts/us-polo-assn/u-s-polo-assn-men-black-printed-casual-shirt/18329222/buy,"['clothing', 'men-clothing', 'shirts', 'u.s.-polo-assn.-shirts']","10TH FLOOR, DU PARC TRINITY, NO 17, M.G ROAD, Bengaluru (Bangalore) Rural,Bengaluru , Karnataka - 560001",Buy U S Polo Assn Men Black Printed Casual Shirt - Shirts for Men from U.S. Polo Assn. at Rs. 2599. Style ID: 18329222,"U S Polo Assn Men Black Printed Casual Shirt,  U.S. Polo Assn., Shirts, Topwear, Apparel, Apparel for Men, Buy U S Polo Assn Men Black Printed Casual Shirt Online in India, Buy Shirts at best price"
kurtas/mohanlal-sons/mohanlal-sons-men-green-geometric-printed-thread-work-kurta/18324008/buy,"['clothing', 'men-clothing', 'kurtas', 'mohanlal-sons-kurtas']","140, Anupam Garden,Sainik Farms IGNOU RoadDelhi , Delhi - 110062",Buy MOHANLAL SONS Men Green Geometric Printed Thread Work Kurta - Kurtas for Men from MOHANLAL SONS at Rs. 2999. Style ID: 18324008,"MOHANLAL SONS Men Green Geometric Printed Thread Work Kurta,  MOHANLAL SONS, Kurtas, Topwear, Apparel, Apparel for Men, Buy MOHANLAL SONS Men Green Geometric Printed Thread Work Kurta Online in India, Buy Kurtas at best price"
shirts/office--you/office--you-women-off-white-casual-shirt/17994352/buy,"['clothing', 'women-clothing', 'shirts', 'office-and-you-shirts']","J-4 Shri Ram Trade Center 2nd Floor C-1 & C-2Main Road Bishanpura Sector-58Noida , Uttar pradesh - 201301",Buy OFFICE & YOU Women Off White Casual Shirt - Shirts for Women from OFFICE & YOU at Rs. 2850. Style ID: 17994352,"OFFICE & YOU Women Off White Casual Shirt,  OFFICE & YOU, Shirts, Topwear, Apparel, Apparel for Women, Buy OFFICE & YOU Women Off White Casual Shirt Online in India, Buy Shirts at best price"
track-pants/jade-blue/-jade-blue-men-blue-solid-pure-cotton-slim-fit-track-pants/18428468/buy,"['clothing', 'men-clothing', 'track-pants', 'jade-blue-track-pants']","25-28, Pariseema Complex,Nr. Lal Bunglow Cross Road, C.G. RoadAhmedabad , Gujarat - 380006",Buy JADE BLUE Men Blue Solid Pure Cotton Slim Fit Track Pants - Track Pants for Men from JADE BLUE at Rs. 1749. Style ID: 18428468,"JADE BLUE Men Blue Solid Pure Cotton Slim Fit Track Pants,  JADE BLUE, Track Pants, Bottomwear, Apparel, Apparel for Men, Buy JADE BLUE Men Blue Solid Pure Cotton Slim Fit Track Pants Online in India, Buy Track Pants at best price"
socks/heelium/heelium-multicolored-4-pair-bamboo-no-show-socks/16571670/buy,"['accessories', 'men-accessories', 'socks', 'heelium-socks']","Fl no. A-406, Sr No 47/1A, Nandan EuphoraDhanoriPune , Maharashtra - 411015",Buy Heelium Multicolored 4 Pair Bamboo No Show Socks - Socks for Men from Heelium at Rs. 499. Style ID: 16571670,"Heelium Multicolored 4 Pair Bamboo No Show Socks,  Heelium, Socks, Socks, Accessories, Accessories for Men, Buy Heelium Multicolored 4 Pair Bamboo No Show Socks Online in India, Buy Socks at best price"
