prod_link,tags,seller_address,meta_description,meta_keyword
tops/athena/athena-women-charming-black-solid-midriff-flossing-top/17650674/buy,"['clothing', 'women-clothing', 'tops', 'athena-tops']","595, Pace City 2, Sector 37,Gurugram,Haryana,India,122001GurugramGurugram , Haryana - 122001",Buy Athena Women Charming Black Solid Midriff Flossing Top - Tops for Women from Athena at Rs. 659. Style ID: 17650674,"Athena Women Charming Black Solid Midriff Flossing Top,  Athena, Tops, Topwear, Apparel, Apparel for Women, Buy Athena Women Charming Black Solid Midriff Flossing Top Online in India, Buy Tops at best price"
shirts/allen-solly/allen-solly-men-blue-slim-fit-casual-cotton-shirt/16375074/buy,"['clothing', 'men-clothing', 'shirts', 'allen-solly-shirts']","Ground Floor, No 65/64, old No 65, 6th Block, Ward No 21, 2ndMain Road,Bengaluru , Karnataka - 560044",Buy Allen Solly Men Blue Slim Fit Casual Cotton Shirt - Shirts for Men from Allen Solly at Rs. 1494. Style ID: 16375074,"Allen Solly Men Blue Slim Fit Casual Cotton Shirt,  Allen Solly, Shirts, Topwear, Apparel, Apparel for Men, Buy Allen Solly Men Blue Slim Fit Casual Cotton Shirt Online in India, Buy Shirts at best price"
shirts/allen-solly/allen-solly-men-white-slim-fit-printed-casual-shirt/17479422/buy,"['clothing', 'men-clothing', 'shirts', 'allen-solly-shirts']","5A/19,Ground Floor ( Front Portion),Ansari Raod,DaryaganjDelhi , Delhi - 110002",Buy Allen Solly Men White Slim Fit Printed Casual Shirt - Shirts for Men from Allen Solly at Rs. 1954. Style ID: 17479422,"Allen Solly Men White Slim Fit Printed Casual Shirt,  Allen Solly, Shirts, Topwear, Apparel, Apparel for Men, Buy Allen Solly Men White Slim Fit Printed Casual Shirt Online in India, Buy Shirts at best price"
shirts/mufti/mufti-men-blue-slim-fit-opaque-pure-cotton-casual-shirt/15241092/buy,"['clothing', 'men-clothing', 'shirts', 'mufti-shirts']","Ethix House,3 Castelino Road Pune Camp,Pune Pune Maharashtra 411001PUNE , Maharashtra - 411001",Buy Mufti Men Blue Slim Fit Opaque Pure Cotton Casual Shirt - Shirts for Men from Mufti at Rs. 1494. Style ID: 15241092,"Mufti Men Blue Slim Fit Opaque Pure Cotton Casual Shirt,  Mufti, Shirts, Topwear, Apparel, Apparel for Men, Buy Mufti Men Blue Slim Fit Opaque Pure Cotton Casual Shirt Online in India, Buy Shirts at best price"
dresses/panit/panit-peach-coloured-floral-dress/18182830/buy,"['clothing', 'women-clothing', 'dresses', 'panit-dresses']","G-68, SECTOR-6, NOIDAGautam Buddha NagarNoida , Uttar pradesh - 201301",Buy PANIT Peach Coloured Floral Fit And Flare Dress - Dresses for Women from PANIT at Rs. 999. Style ID: 18182830,"PANIT Peach Coloured Floral Fit And Flare Dress,  PANIT, Dresses, Dress, Apparel, Apparel for Women, Buy PANIT Peach Coloured Floral Fit And Flare Dress Online in India, Buy Dresses at best price"
dresses/dodo--moa/dodo--moa-charming-maroon-conversational-ruffled-dress/16588292/buy,"['clothing', 'women-clothing', 'dresses', 'dodo-and-moa-dresses']","Plot No 33-34,Phase VI, Sector 37 GURUGRAM GurgaonGurugram , Haryana - 122001",Buy DODO & MOA Charming Maroon Conversational Ruffled Dress - Dresses for Women from DODO & MOA at Rs. 1184. Style ID: 16588292,"DODO & MOA Charming Maroon Conversational Ruffled Dress,  DODO & MOA, Dresses, Dress, Apparel, Apparel for Women, Buy DODO & MOA Charming Maroon Conversational Ruffled Dress Online in India, Buy Dresses at best price"
dresses/athena/athena-women-gorgeous-green-solid-cut-out-dress/17715938/buy,"['clothing', 'women-clothing', 'dresses', 'athena-dresses']","BESEMENT/GROUND/FIRST FLOOR/SECOND FLOORPlot No. 595, Pace City-2 Sector-37Gurugram , Haryana - 122001",Buy Athena Women Gorgeous Green Solid Cut Out Dress - Dresses for Women from Athena at Rs. 1079. Style ID: 17715938,"Athena Women Gorgeous Green Solid Cut Out Dress,  Athena, Dresses, Dress, Apparel, Apparel for Women, Buy Athena Women Gorgeous Green Solid Cut Out Dress Online in India, Buy Dresses at best price"
dresses/zink-london/zink-london-women-off-white--grey-striped-fit-and-flare-cotton-dress/14070620/buy,"['clothing', 'women-clothing', 'dresses', 'zink-london-dresses']","148, 149, 150 Arupota VillagePragati Maidan PSKolkata , West bengal - 700105",Buy Zink London Women Off White & Grey Striped Fit And Flare Cotton Dress - Dresses for Women from Zink London at Rs. 1079. Style ID: 14070620,"Zink London Women Off White & Grey Striped Fit And Flare Cotton Dress,  Zink London, Dresses, Dress, Apparel, Apparel for Women, Buy Zink London Women Off White & Grey Striped Fit And Flare Cotton Dress Online in India, Buy Dresses at best price"
dungarees/panit/panit-women-teal--white-solid-dungarees-with-side-stripes-/15196206/buy,"['clothing', 'women-clothing', 'dungarees', 'panit-dungarees']","G-68, SECTOR-6, NOIDAGautam Buddha NagarNoida , Uttar pradesh - 201301",Buy PANIT Women Teal & White Solid Dungarees With Side Stripes - Dungarees for Women from PANIT at Rs. 1079. Style ID: 15196206,"PANIT Women Teal & White Solid Dungarees With Side Stripes,  PANIT, Dungarees, Bottomwear, Apparel, Apparel for Women, Buy PANIT Women Teal & White Solid Dungarees With Side Stripes Online in India, Buy Dungarees at best price"
track-pants/slazenger/slazenger-men-black-solid-joggers-with-side-stripe-detail/15800298/buy,"['clothing', 'men-clothing', 'track-pants', 'slazenger-track-pants']","Awfis, 7th floor, HM Vibha Tower, 25 Laskar Hosur Road, Adugodi, Bengalore 560029Bengaluru , Karnataka - 560029",Buy Slazenger Men Black Solid Joggers With Side Stripe Detail - Track Pants for Men from Slazenger at Rs. 949. Style ID: 15800298,"Slazenger Men Black Solid Joggers With Side Stripe Detail,  Slazenger, Track Pants, Bottomwear, Apparel, Apparel for Men, Buy Slazenger Men Black Solid Joggers With Side Stripe Detail Online in India, Buy Track Pants at best price"
trousers/louis-philippe/louis-philippe-men-purple-textured-slim-fit-trousers/17161790/buy,"['clothing', 'men-clothing', 'trousers', 'louis-philippe-trousers']","5A/19,Ground Floor ( Front Portion),Ansari Raod,DaryaganjDelhi , Delhi - 110002",Buy Louis Philippe Men Purple Textured Slim Fit Trousers - Trousers for Men from Louis Philippe at Rs. 2549. Style ID: 17161790,"Louis Philippe Men Purple Textured Slim Fit Trousers,  Louis Philippe, Trousers, Bottomwear, Apparel, Apparel for Men, Buy Louis Philippe Men Purple Textured Slim Fit Trousers Online in India, Buy Trousers at best price"
blazers/louis-philippe/louis-philippe-men-brown--black-checked-single-breasted-pure-wool-formal-blazer/16608144/buy,"['clothing', 'men-clothing', 'blazers', 'louis-philippe-blazers']","5A/19,Ground Floor ( Front Portion),Ansari Raod,DaryaganjDelhi , Delhi - 110002",Buy Louis Philippe Men Brown & Black Checked Single Breasted Pure Wool Formal Blazer - Blazers for Men from Louis Philippe at Rs. 5499. Style ID: 16608144,"Louis Philippe Men Brown & Black Checked Single Breasted Pure Wool Formal Blazer,  Louis Philippe, Blazers, Topwear, Apparel, Apparel for Men, Buy Louis Philippe Men Brown & Black Checked Single Breasted Pure Wool Formal Blazer Online in India, Buy Blazers at best price"
kurta-sets/sangria/sangria-ethnic-motifs-pure-cotton-short-kurti-with-flared-pants/16256628/buy,"['clothing', 'women-clothing', 'kurta-sets', 'sangria-kurta-sets']","Plot No.- 711, Road No. 7, Opp. Arman Mill, Sachin GIDCSurat , Gujarat - 394230",Buy Sangria Ethnic Motifs Pure Cotton Short Kurti With Flared Pants - Kurta Sets for Women from Sangria at Rs. 2049. Style ID: 16256628,"Sangria Ethnic Motifs Pure Cotton Short Kurti With Flared Pants,  Sangria, Kurta Sets, Apparel Set, Apparel, Apparel for Women, Buy Sangria Ethnic Motifs Pure Cotton Short Kurti With Flared Pants Online in India, Buy Kurta Sets at best price"
kurta-sets/vaaba/vaaba-women-white-ethnic-motifs-embroidered-yoke-design-kurta-with-trousers--dupatta/17968968/buy,"['clothing', 'women-clothing', 'kurta-sets', 'vaaba-kurta-sets']","PLOT NO. 44, JAY HANUMAN INDUSTRIAL ESTATE, U M ROAD, UDHANASurat , Gujarat - 395007",Buy VAABA Women White Ethnic Motifs Embroidered Yoke Design Kurta With Trousers & Dupatta - Kurta Sets for Women from VAABA at Rs. 1376. Style ID: 17968968,"VAABA Women White Ethnic Motifs Embroidered Yoke Design Kurta With Trousers & Dupatta,  VAABA, Kurta Sets, Apparel Set, Apparel, Apparel for Women, Buy VAABA Women White Ethnic Motifs Embroidered Yoke Design Kurta With Trousers & Dupatta Online in India, Buy Kurta Sets at best price"
kurta-sets/indo-era/indo-era-rich-off-white-and-peach-printed-kurta-set/13962378/buy,"['clothing', 'women-clothing', 'kurta-sets', 'indo-era-kurta-sets']","4TH FLOOR, Block No B-4021/4022/4023/4026/4038/4039/4040ASHIRWAD TEXTILE MARKET, OPP. LANDMARK TEXTILE MARKET, MAGOB,Surat , Gujarat - 395010",Buy Indo Era Rich Off White And Peach Printed Kurta Set - Kurta Sets for Women from Indo Era at Rs. 1329. Style ID: 13962378,"Indo Era Rich Off White And Peach Printed Kurta Set,  Indo Era, Kurta Sets, Apparel Set, Apparel, Apparel for Women, Buy Indo Era Rich Off White And Peach Printed Kurta Set Online in India, Buy Kurta Sets at best price"
kurta-sets/sringam/sringam-women-cream-coloured-regular-kurta-with-trousers--with-dupatta/15647424/buy,"['clothing', 'women-clothing', 'kurta-sets', 'sringam-kurta-sets']","D-404, SUPERTECH PALMGREENS,DELHI - HAPUR BYPASS ROAD, MEERUTMeerut , Uttar pradesh - 250103",Buy Sringam Women Cream Coloured Regular Kurta With Trousers & With Dupatta - Kurta Sets for Women from Sringam at Rs. 1246. Style ID: 15647424,"Sringam Women Cream Coloured Regular Kurta With Trousers & With Dupatta,  Sringam, Kurta Sets, Apparel Set, Apparel, Apparel for Women, Buy Sringam Women Cream Coloured Regular Kurta With Trousers & With Dupatta Online in India, Buy Kurta Sets at best price"
kurta-sets/indo-era/indo-era-women-off-white-floral-regular-liva-kurta-with-palazzos--with-dupatta/15390166/buy,"['clothing', 'women-clothing', 'kurta-sets', 'indo-era-kurta-sets']","4TH FLOOR, Block No B-4021/4022/4023/4026/4038/4039/4040ASHIRWAD TEXTILE MARKET, OPP. LANDMARK TEXTILE MARKET, MAGOB,Surat , Gujarat - 395010",Buy Indo Era Women Off White Floral Regular Liva Kurta With Palazzos & With Dupatta - Kurta Sets for Women from Indo Era at Rs. 1499. Style ID: 15390166,"Indo Era Women Off White Floral Regular Liva Kurta With Palazzos & With Dupatta,  Indo Era, Kurta Sets, Apparel Set, Apparel, Apparel for Women, Buy Indo Era Women Off White Floral Regular Liva Kurta With Palazzos & With Dupatta Online in India, Buy Kurta Sets at best price"
kurta-sets/vbuyz/vbuyz-women-yellow-floral-printed-panelled-kurta-with-trousers--with-dupatta/14676728/buy,"['clothing', 'women-clothing', 'kurta-sets', 'vbuyz-kurta-sets']","813, Raghuvir Textile MallSurat , Gujarat - 395010",Buy Vbuyz Women Yellow Floral Printed Panelled Kurta With Trousers & With Dupatta - Kurta Sets for Women from Vbuyz at Rs. 1439. Style ID: 14676728,"Vbuyz Women Yellow Floral Printed Panelled Kurta With Trousers & With Dupatta,  Vbuyz, Kurta Sets, Apparel Set, Apparel, Apparel for Women, Buy Vbuyz Women Yellow Floral Printed Panelled Kurta With Trousers & With Dupatta Online in India, Buy Kurta Sets at best price"
trousers/park-avenue/park-avenue-men-blue-slim-fit-formal-trousers/16122708/buy,"['clothing', 'men-clothing', 'trousers', 'park-avenue-trousers']","JEKEGRAM, POKHARAN ROAD NO 1Thane , MAHARASHTRA - 400606",Buy Park Avenue Men Blue Slim Fit Formal Trousers - Trousers for Men from Park Avenue at Rs. 1999. Style ID: 16122708,"Park Avenue Men Blue Slim Fit Formal Trousers,  Park Avenue, Trousers, Bottomwear, Apparel, Apparel for Men, Buy Park Avenue Men Blue Slim Fit Formal Trousers Online in India, Buy Trousers at best price"
shirts/foga/foga-men-cream-coloured-premium-slim-fit-tartan-checks-checked-casual-shirt/18612508/buy,"['clothing', 'men-clothing', 'shirts', 'foga-shirts']","98/99, 3rd Cross, Azeez Sait Industrial TownNayandhalli, Mysore RoadBengaluru , Karnataka - 560039",Buy FOGA Men Cream Coloured Premium Slim Fit Tartan Checks Checked Casual Shirt - Shirts for Men from FOGA at Rs. 999. Style ID: 18612508,"FOGA Men Cream Coloured Premium Slim Fit Tartan Checks Checked Casual Shirt,  FOGA, Shirts, Topwear, Apparel, Apparel for Men, Buy FOGA Men Cream Coloured Premium Slim Fit Tartan Checks Checked Casual Shirt Online in India, Buy Shirts at best price"
flats/rocia/rocia-women-champagne-embellished-t-strap-flats/16249396/buy,"['footwear', 'women-footwear', 'flats', 'rocia-flats']","Regal Shoes, Bhiwandi Gala no 101/102, AI Bldg., Shree Raj Laxmi ComplexKalher Village Agra Road Bhiwandi,Thane 421302Bhiwandi , Maharashtra - 421302",Buy Rocia Women Champagne Embellished T Strap Flats - Flats for Women from Rocia at Rs. 1992. Style ID: 16249396,"Rocia Women Champagne Embellished T Strap Flats,  Rocia, Flats, Shoes, Footwear, Footwear for Women, Buy Rocia Women Champagne Embellished T Strap Flats Online in India, Buy Flats at best price"
flats/rocia/rocia-women-black-embellished-t-strap-flats/16872124/buy,"['footwear', 'women-footwear', 'flats', 'rocia-flats']","Regal Shoes, Bhiwandi Gala no 101/102, AI Bldg., Shree Raj Laxmi ComplexKalher Village Agra Road Bhiwandi,Thane 421302Bhiwandi , Maharashtra - 421302",Buy Rocia Women Black Embellished T Strap Flats - Flats for Women from Rocia at Rs. 1992. Style ID: 16872124,"Rocia Women Black Embellished T Strap Flats,  Rocia, Flats, Shoes, Footwear, Footwear for Women, Buy Rocia Women Black Embellished T Strap Flats Online in India, Buy Flats at best price"
flats/inc-5/inc-5-women-blue--yellow-colourblocked-open-toe-flats/16391282/buy,"['footwear', 'women-footwear', 'flats', 'inc-5-flats']","Gal a No. 3A to 8A & 3B to 8B, Building C4, Shree Balaji Complex,Vehele Road, Village Bhatale, Tal. Bhiwandi, Dist. ThaneThane , Maharashtra - 421311",Buy Inc 5 Women Blue & Yellow Colourblocked Open Toe Flats - Flats for Women from Inc 5 at Rs. 1890. Style ID: 16391282,"Inc 5 Women Blue & Yellow Colourblocked Open Toe Flats,  Inc 5, Flats, Shoes, Footwear, Footwear for Women, Buy Inc 5 Women Blue & Yellow Colourblocked Open Toe Flats Online in India, Buy Flats at best price"
shorts/cherry-crumble/cherry-crumble-boys-olive-green-dinosaur-embroidered-regular-fit-chino-shorts/11905716/buy,"['clothing', 'boys-clothing', 'shorts', 'cherry-crumble-shorts']","X-59,FIRST AND SECOND FLOOR,  OKHLA INDUSTRIAL AREA, PHASE - II NEW DELHI 110020Delhi , Delhi - 110020",Buy Cherry Crumble Boys Olive Green Dinosaur Embroidered Regular Fit Chino Shorts - Shorts for Boys from Cherry Crumble at Rs. 699. Style ID: 11905716,"Cherry Crumble Boys Olive Green Dinosaur Embroidered Regular Fit Chino Shorts,  Cherry Crumble, Shorts, Bottomwear, Apparel, Apparel for Boys, Buy Cherry Crumble Boys Olive Green Dinosaur Embroidered Regular Fit Chino Shorts Online in India, Buy Shorts at best price"
skirts/aask/aask-women-pink-accordion-pleats-maxi-skirt/17242350/buy,"['clothing', 'women-clothing', 'skirts', 'aask-skirts']","SY NO 25, PL NO 247, FN PL NO 6/C, H NO 409/40,, UMIYA NAGAR, B/S. CHOKSI DYING,, Udhna Magdalla RoadSurat , Gujarat - 395002",Buy AASK Women Pink Accordion Pleats Maxi Skirt - Skirts for Women from AASK at Rs. 594. Style ID: 17242350,"AASK Women Pink Accordion Pleats Maxi Skirt,  AASK, Skirts, Bottomwear, Apparel, Apparel for Women, Buy AASK Women Pink Accordion Pleats Maxi Skirt Online in India, Buy Skirts at best price"
tshirts/red-tape/red-tape-men-green-pure-cotton-t-shirt/16916284/buy,"['clothing', 'men-clothing', 'tshirts', 'red-tape-tshirts']","14/6, MIRZA INTERNATIONAL LIMITED REGISTERED AND HEAD OFFICE, CIVIL LINES, KANPUR, Kanpur Nagar, Uttar Pradesh, 208001Kanpur , Uttar Pradesh - 208001",Buy Red Tape Men Green Pure Cotton T Shirt - Tshirts for Men from Red Tape at Rs. 449. Style ID: 16916284,"Red Tape Men Green Pure Cotton T Shirt,  Red Tape, Tshirts, Topwear, Apparel, Apparel for Men, Buy Red Tape Men Green Pure Cotton T Shirt Online in India, Buy Tshirts at best price"
tops/mayra/mayra-women-off-white-printed-top/5665135/buy,"['clothing', 'women-clothing', 'tops', 'mayra-tops']","23/339  2Nd FloorWazirpura, AgraAgra , Uttar Pradesh - 282003",Buy Mayra Women Off White Printed Top - Tops for Women from Mayra at Rs. 417. Style ID: 5665135,"Mayra Women Off White Printed Top,  Mayra, Tops, Topwear, Apparel, Apparel for Women, Buy Mayra Women Off White Printed Top Online in India, Buy Tops at best price"
shirts/kook-n-keech/kook-n-keech-men-red-tartan-checked-casual-shirt/16618372/buy,"['clothing', 'men-clothing', 'shirts', 'kook-n-keech-shirts']","WZ199/2,Second Floor3,Madipur Village,Madipur,DelhiDelhi , Delhi - 110063",Buy Kook N Keech Men Red Tartan Checked Casual Shirt - Shirts for Men from Kook N Keech at Rs. 1079. Style ID: 16618372,"Kook N Keech Men Red Tartan Checked Casual Shirt,  Kook N Keech, Shirts, Topwear, Apparel, Apparel for Men, Buy Kook N Keech Men Red Tartan Checked Casual Shirt Online in India, Buy Shirts at best price"
tshirts/max/max-women-yellow-puff-sleeves-t-shirt/17166382/buy,"['clothing', 'women-clothing', 'tshirts', 'max-tshirts']","#41/2,42/2,Oblapura Gram panchyat,Anugondanahalli HobliDevangundi Main RoadHoskote TalukBengaluru , Karnataka - 560067",Buy Max Women Yellow Puff Sleeves T Shirt - Tshirts for Women from Max at Rs. 399. Style ID: 17166382,"Max Women Yellow Puff Sleeves T Shirt,  Max, Tshirts, Topwear, Apparel, Apparel for Women, Buy Max Women Yellow Puff Sleeves T Shirt Online in India, Buy Tshirts at best price"
kurtas/indi-inside/indi-inside-women-maroon--biking-red-ethnic-motifs-yoke-design-thread-work-anarkali-kurta/18425506/buy,"['clothing', 'women-clothing', 'kurtas', 'indi-inside-kurtas']","1, Krishna NagarImli Phatak, JaipurJaipur , Rajasthan - 302015",Buy Indi INSIDE Women Maroon & Biking Red Ethnic Motifs Yoke Design Thread Work Anarkali Kurta - Kurtas for Women from Indi INSIDE at Rs. 895. Style ID: 18425506,"Indi INSIDE Women Maroon & Biking Red Ethnic Motifs Yoke Design Thread Work Anarkali Kurta,  Indi INSIDE, Kurtas, Topwear, Apparel, Apparel for Women, Buy Indi INSIDE Women Maroon & Biking Red Ethnic Motifs Yoke Design Thread Work Anarkali Kurta Online in India, Buy Kurtas at best price"
jeans/louis-philippe-jeans/louis-philippe-jeans-men-grey-slim-fit-heavy-fade-jeans/16397888/buy,"['clothing', 'men-clothing', 'jeans', 'louis-philippe-jeans-jeans']","5A/19,Ground Floor ( Front Portion),Ansari Raod,DaryaganjDelhi , Delhi - 110002",Buy Louis Philippe Jeans Men Grey Slim Fit Heavy Fade Jeans - Jeans for Men from Louis Philippe Jeans at Rs. 2339. Style ID: 16397888,"Louis Philippe Jeans Men Grey Slim Fit Heavy Fade Jeans,  Louis Philippe Jeans, Jeans, Bottomwear, Apparel, Apparel for Men, Buy Louis Philippe Jeans Men Grey Slim Fit Heavy Fade Jeans Online in India, Buy Jeans at best price"
dresses/uf/uf-women-pretty-pink-solid-sweetheart-neck-dress/15226916/buy,"['clothing', 'women-clothing', 'dresses', 'u-and-f-dresses']","A-41 Sector 7 NoidaNoida , Uttar pradesh - 201301",Buy U&F Women Pretty Pink Solid Sweetheart Neck Dress - Dresses for Women from U&F at Rs. 759. Style ID: 15226916,"U&F Women Pretty Pink Solid Sweetheart Neck Dress,  U&F, Dresses, Dress, Apparel, Apparel for Women, Buy U&F Women Pretty Pink Solid Sweetheart Neck Dress Online in India, Buy Dresses at best price"
dresses/taavi/taavi-women-white--brown-sanganeri-hand-block-print-pure-cotton-ethnic-sheath-dress/16907456/buy,"['clothing', 'women-clothing', 'dresses', 'taavi-dresses']","Second Floor, Plot No. 82, Okhla Industrial Estate, Phase - III, New Delhi, Delhi, 110020Delhi , Delhi - 110020",Buy Taavi Women White & Brown Sanganeri Hand Block Print Pure Cotton Ethnic Sheath Dress - Dresses for Women from Taavi at Rs. 879. Style ID: 16907456,"Taavi Women White & Brown Sanganeri Hand Block Print Pure Cotton Ethnic Sheath Dress,  Taavi, Dresses, Dress, Apparel, Apparel for Women, Buy Taavi Women White & Brown Sanganeri Hand Block Print Pure Cotton Ethnic Sheath Dress Online in India, Buy Dresses at best price"
kurta-sets/kalini/kalini-women-red-ethnic-motifs-printed-gotta-patti-pure-cotton-kurta-with-palazzos/16773298/buy,"['clothing', 'women-clothing', 'kurta-sets', 'kalini-kurta-sets']","06, SECOND FLOOR SHAKTI VIHAR, CEMENT GODAM ROADKALYANPURA, NEW SANGANER, JAIPURJaipur , Rajasthan - 302020",Buy KALINI Women Red Ethnic Motifs Printed Gotta Patti Pure Cotton Kurta With Palazzos - Kurta Sets for Women from KALINI at Rs. 844. Style ID: 16773298,"KALINI Women Red Ethnic Motifs Printed Gotta Patti Pure Cotton Kurta With Palazzos,  KALINI, Kurta Sets, Apparel Set, Apparel, Apparel for Women, Buy KALINI Women Red Ethnic Motifs Printed Gotta Patti Pure Cotton Kurta With Palazzos Online in India, Buy Kurta Sets at best price"
kurta-sets/all-about-you/all-about-you-women-mustard-yellow-regular-kurta-with-trousers/14708196/buy,"['clothing', 'women-clothing', 'kurta-sets', 'all-about-you-kurta-sets']","5th Floor, Office No 504, Punj Essen House, 17-18, Nehru PlaceDelhi , Delhi - 110019",Buy All About You Women Mustard Yellow Regular Kurta With Trousers - Kurta Sets for Women from All About You at Rs. 824. Style ID: 14708196,"All About You Women Mustard Yellow Regular Kurta With Trousers,  All About You, Kurta Sets, Apparel Set, Apparel, Apparel for Women, Buy All About You Women Mustard Yellow Regular Kurta With Trousers Online in India, Buy Kurta Sets at best price"
kurta-sets/yufta/yufta-women-black--pink-ethnic-motifs-printed-kurta-with-palazzos/14933618/buy,"['clothing', 'women-clothing', 'kurta-sets', 'yufta-kurta-sets']","C-5, RIICO Mansarovar, Mansarovar Industril AreaJaipur , Rajasthan - 302020",Buy Yufta Women Black & Pink Ethnic Motifs Printed Kurta With Palazzos - Kurta Sets for Women from Yufta at Rs. 879. Style ID: 14933618,"Yufta Women Black & Pink Ethnic Motifs Printed Kurta With Palazzos,  Yufta, Kurta Sets, Apparel Set, Apparel, Apparel for Women, Buy Yufta Women Black & Pink Ethnic Motifs Printed Kurta With Palazzos Online in India, Buy Kurta Sets at best price"
tshirts/ether/ether-men-yellow-pure-cotton-solid-round-neck-t-shirt/15971012/buy,"['clothing', 'men-clothing', 'tshirts', 'ether-tshirts']","11th Floor, Flat No. 1106, 1107, 26, Kailash, Kasturba Gandhi Marg, New Delhi, New Delhi, Delhi, 110001Delhi , Delhi - 110001",Buy Ether Men Yellow Pure Cotton Solid Round Neck T Shirt - Tshirts for Men from Ether at Rs. 404. Style ID: 15971012,"Ether Men Yellow Pure Cotton Solid Round Neck T Shirt,  Ether, Tshirts, Topwear, Apparel, Apparel for Men, Buy Ether Men Yellow Pure Cotton Solid Round Neck T Shirt Online in India, Buy Tshirts at best price"
trousers/max/max-boys-grey--navy-blue-cotton-joggers-/15600094/buy,"['clothing', 'boys-clothing', 'trousers', 'max-trousers']","#41/2,42/2,Oblapura Gram panchyat,Anugondanahalli HobliDevangundi Main RoadHoskote TalukBengaluru , Karnataka - 560067",Buy Max Boys Grey & Navy Blue Cotton Joggers - Trousers for Boys from Max at Rs. 584. Style ID: 15600094,"Max Boys Grey & Navy Blue Cotton Joggers,  Max, Trousers, Bottomwear, Apparel, Apparel for Boys, Buy Max Boys Grey & Navy Blue Cotton Joggers Online in India, Buy Trousers at best price"
tshirts/mast--harbour/mast--harbour-women-white--navy-blue-pure-cotton-typography-printed-t-shirt/15773724/buy,"['clothing', 'women-clothing', 'tshirts', 'mast-and-harbour-tshirts']",,Buy Mast & Harbour Women White & Navy Blue Pure Cotton Typography Printed T Shirt - Tshirts for Women from Mast & Harbour at Rs. 239. Style ID: 15773724,"Mast & Harbour Women White & Navy Blue Pure Cotton Typography Printed T Shirt,  Mast & Harbour, Tshirts, Topwear, Apparel, Apparel for Women, Buy Mast & Harbour Women White & Navy Blue Pure Cotton Typography Printed T Shirt Online in India, Buy Tshirts at best price"
shorts/kryptic/kryptic-women-orange-printed-regular-fit-regular-shorts/13975516/buy,"['clothing', 'women-clothing', 'shorts', 'kryptic-shorts']","SF. No. 89, Vadaku Thottam, NallurCoimbatore , Tamil Nadu - 641606",Buy Kryptic Women Orange Printed Regular Fit Regular Shorts - Shorts for Women from Kryptic at Rs. 379. Style ID: 13975516,"Kryptic Women Orange Printed Regular Fit Regular Shorts,  Kryptic, Shorts, Bottomwear, Apparel, Apparel for Women, Buy Kryptic Women Orange Printed Regular Fit Regular Shorts Online in India, Buy Shorts at best price"
tops/roadster/roadster-women-pink-solid-top-with-striped-sleeves-/11401432/buy,"['clothing', 'women-clothing', 'tops', 'roadster-tops']",,Buy Roadster Women Pink Solid Top With Striped Sleeves - Tops for Women from Roadster at Rs. 359. Style ID: 11401432,"Roadster Women Pink Solid Top With Striped Sleeves,  Roadster, Tops, Topwear, Apparel, Apparel for Women, Buy Roadster Women Pink Solid Top With Striped Sleeves Online in India, Buy Tops at best price"
shirts/kra/kra-men-white-classic-casual-shirt/17714180/buy,"['clothing', 'men-clothing', 'shirts', 'kra-shirts']","GUT NO 213 P, DINKARPADA,, POST KONDALE, KUDUS, WADA,, PalgharKudus , Maharashtra - 421312",Buy KRA Men White Classic Casual Shirt - Shirts for Men from KRA at Rs. 591. Style ID: 17714180,"KRA Men White Classic Casual Shirt,  KRA, Shirts, Topwear, Apparel, Apparel for Men, Buy KRA Men White Classic Casual Shirt Online in India, Buy Shirts at best price"
shirts/jainish/jainish-men-mustard-smart-grid-tattersall-checks-checked-casual-shirt/16894542/buy,"['clothing', 'men-clothing', 'shirts', 'jainish-shirts']","B-14 G.T karnal RoadIndustrial Area,Near AzadpurDelhi , Delhi - 110033",Buy JAINISH Men Mustard Smart Grid Tattersall Checks Checked Casual Shirt - Shirts for Men from JAINISH at Rs. 591. Style ID: 16894542,"JAINISH Men Mustard Smart Grid Tattersall Checks Checked Casual Shirt,  JAINISH, Shirts, Topwear, Apparel, Apparel for Men, Buy JAINISH Men Mustard Smart Grid Tattersall Checks Checked Casual Shirt Online in India, Buy Shirts at best price"
