prod_link,tags,seller_address,meta_description,meta_keyword
casual-shoes/eego-italy/eego-italy-men-black-colourblocked-leather-mid-top-sneakers/11744854/buy,"['footwear', 'men-footwear', 'casual-shoes', 'eego-italy-casual-shoes']",,Buy Eego Italy Men Black Colourblocked Leather Mid Top Sneakers - Casual Shoes for Men from Eego Italy at Rs. 999. Style ID: 11744854,"Eego Italy Men Black Colourblocked Leather Mid Top Sneakers,  Eego Italy, Casual Shoes, Shoes, Footwear, Footwear for Men, Buy Eego Italy Men Black Colourblocked Leather Mid Top Sneakers Online in India, Buy Casual Shoes at best price"
night-suits/anthrilo/anthrilo-girls-pink--yellow-printed-night-suit/18442262/buy,"['clothing', 'girls-clothing', 'night-suits', 'anthrilo-night-suits']","kh400/413,  rahon road, Bhandari house,Village meharabanLudhiana , PUNJAB - 141007",Buy Anthrilo Girls Pink & Yellow Printed Night Suit - Night Suits for Girls from Anthrilo at Rs. 854. Style ID: 18442262,"Anthrilo Girls Pink & Yellow Printed Night Suit,  Anthrilo, Night Suits, Loungewear And Nightwear, Apparel, Apparel for Girls, Buy Anthrilo Girls Pink & Yellow Printed Night Suit Online in India, Buy Night Suits at best price"
night-suits/eimoie/eimoie-girls-yellow--blue-night-suit-100-cotton/18254484/buy,"['clothing', 'girls-clothing', 'night-suits', 'eimoie-night-suits']","H/215, Ansa Industrial Estate, Saki Vihar Road, Sakinaka, Andheri EastMumbai , Maharashtra - 400072",Buy Eimoie Girls Yellow & Blue Night Suit 100% Cotton - Night Suits for Girls from Eimoie at Rs. 791. Style ID: 18254484,"Eimoie Girls Yellow & Blue Night Suit 100% Cotton,  Eimoie, Night Suits, Loungewear And Nightwear, Apparel, Apparel for Girls, Buy Eimoie Girls Yellow & Blue Night Suit 100% Cotton Online in India, Buy Night Suits at best price"
earrings/w/w-pink-floral-studs-earrings/18436562/buy,"['accessories', 'women-accessories', 'earrings', 'w-earrings']","Unit No. 112, Rectangle 1, 1st Floor, D-4, Saket, New Delhi - 110007New Delhi , Delhi - 110017",Buy W Pink Floral Studs Earrings - Earrings for Women from W at Rs. 419. Style ID: 18436562,"W Pink Floral Studs Earrings,  W, Earrings, Jewellery, Accessories, Accessories for Women, Buy W Pink Floral Studs Earrings Online in India, Buy Earrings at best price"
tshirts/zeki/zeki-men-yellow-raw-edge-slim-fit-t-shirt/18651040/buy,"['clothing', 'men-clothing', 'tshirts', 'zeki-tshirts']","PLOT NO. 286, SECTOR-68IMT FARIDABAD, HARYANAFaridabad , Haryana - 121004",Buy Zeki Men Yellow Raw Edge Slim Fit T Shirt - Tshirts for Men from Zeki at Rs. 559. Style ID: 18651040,"Zeki Men Yellow Raw Edge Slim Fit T Shirt,  Zeki, Tshirts, Topwear, Apparel, Apparel for Men, Buy Zeki Men Yellow Raw Edge Slim Fit T Shirt Online in India, Buy Tshirts at best price"
tshirts/roadster/roadster-men-mauve-striped-pure-cotton-t-shirt/16997588/buy,"['clothing', 'men-clothing', 'tshirts', 'roadster-tshirts']","406, B2 and C, 4th Floor,Centrum Plaza, Golf Course Road, Sector - 53,Gurugram , Haryana - 122102",Buy Roadster Men Mauve Striped Pure Cotton T Shirt - Tshirts for Men from Roadster at Rs. 499. Style ID: 16997588,"Roadster Men Mauve Striped Pure Cotton T Shirt,  Roadster, Tshirts, Topwear, Apparel, Apparel for Men, Buy Roadster Men Mauve Striped Pure Cotton T Shirt Online in India, Buy Tshirts at best price"
dresses/poppi/poppi-white-floral-crepe-maxi-dress/18248664/buy,"['clothing', 'women-clothing', 'dresses', 'poppi-dresses']","F48, Ground Floor, Shivji Market Co-Op Premises Society Ltd. Plot 8-9, Sector-19 D, Vashi, Navi-Mumbai. 400703.Mumbai , MAHARASHTRA - 400703",Buy POPPI Off White & Orange Tropical Printed Crepe Maxi Dress - Dresses for Women from POPPI at Rs. 4950. Style ID: 18248664,"POPPI Off White & Orange Tropical Printed Crepe Maxi Dress,  POPPI, Dresses, Dress, Apparel, Apparel for Women, Buy POPPI Off White & Orange Tropical Printed Crepe Maxi Dress Online in India, Buy Dresses at best price"
dresses/bostreet/bostreet-multicoloured-striped-sheath-dress/18246952/buy,"['clothing', 'women-clothing', 'dresses', 'bostreet-dresses']","HOUSE NO 356, BUILDING F-4, GALA 5/A,HOUSE NO 356, BUILDING F-4, GALA 5/A,Bhiwandi , Maharashtra - 421302",Buy BoStreet Multicoloured Striped Sheath Dress - Dresses for Women from BoStreet at Rs. 1557. Style ID: 18246952,"BoStreet Multicoloured Striped Sheath Dress,  BoStreet, Dresses, Dress, Apparel, Apparel for Women, Buy BoStreet Multicoloured Striped Sheath Dress Online in India, Buy Dresses at best price"
clutches/esbeda/esbeda-women-grey--white-embellished-purse-/17974992/buy,"['accessories', 'women-accessories', 'clutches', 'esbeda-clutches']","BMI-2Devidayal MIll Compund next to britannia Dharu Khana Ray Road  Mumbai-400010 Mumbai , Maharashtra - 400010",Buy ESBEDA Women Grey & White Embellished Purse - Clutches for Women from ESBEDA at Rs. 1176. Style ID: 17974992,"ESBEDA Women Grey & White Embellished Purse,  ESBEDA, Clutches, Bags, Accessories, Accessories for Women, Buy ESBEDA Women Grey & White Embellished Purse Online in India, Buy Clutches at best price"
trousers/goldstroms/goldstroms-women-peach-coloured-trousers/18627056/buy,"['clothing', 'women-clothing', 'trousers', 'goldstroms-trousers']","#78/20 8th Cross Shankarappa Garden Magadi RoadBangalore GARDEN MAGADI ROAD Bengaluru (Bangalore) Urban KarnatakaBengaluru , Karnataka - 560023",Buy GOLDSTROMS Women Peach Coloured Trousers - Trousers for Women from GOLDSTROMS at Rs. 840. Style ID: 18627056,"GOLDSTROMS Women Peach Coloured Trousers,  GOLDSTROMS, Trousers, Bottomwear, Apparel, Apparel for Women, Buy GOLDSTROMS Women Peach Coloured Trousers Online in India, Buy Trousers at best price"
sports-shoes/impakto/impakto-women-grey-mesh-non-marking-running-shoes/17511014/buy,"['footwear', 'women-footwear', 'sports-shoes', 'impakto-sports-shoes']","AJANTA FOOTCARE INDIA PRIVATE LIMITED.79/2, AJANTA HOUSE, A.J.C. BOSE ROAD, MOULALI, Kolkata,West Bengal, 700014Kolkata , West Bengal - 700014",Buy IMPAKTO Women Grey Mesh Non Marking Running Shoes - Sports Shoes for Women from IMPAKTO at Rs. 1169. Style ID: 17511014,"IMPAKTO Women Grey Mesh Non Marking Running Shoes,  IMPAKTO, Sports Shoes, Shoes, Footwear, Footwear for Women, Buy IMPAKTO Women Grey Mesh Non Marking Running Shoes Online in India, Buy Sports Shoes at best price"
heels/sapatos/sapatos-blue-block-pumps-with-laser-cuts/18725756/buy,"['footwear', 'women-footwear', 'heels', 'sapatos-heels']","OFFICE NO - 1,2, PLOT NO -50,HASANPUR I.P EXTENSION, NEW DELHI, East DelhiEAST DELHI , DELHI - 110092",Buy SAPATOS Blue Block Pumps With Laser Cuts - Heels for Women from SAPATOS at Rs. 2499. Style ID: 18725756,"SAPATOS Blue Block Pumps With Laser Cuts,  SAPATOS, Heels, Shoes, Footwear, Footwear for Women, Buy SAPATOS Blue Block Pumps With Laser Cuts Online in India, Buy Heels at best price"
tights/urbanic/-urbanic-women-red--patterned-tights/18592788/buy,"['clothing', 'women-clothing', 'tights', 'urbanic-tights']",,Buy URBANIC Women Red  Patterned Tights - Tights for Women from URBANIC at Rs. 990. Style ID: 18592788,"URBANIC Women Red  Patterned Tights,  URBANIC, Tights, Bottomwear, Apparel, Apparel for Women, Buy URBANIC Women Red  Patterned Tights Online in India, Buy Tights at best price"
shorts/arise/arise-men-maroon--grey-melange-colourblocked-shorts/17897050/buy,"['clothing', 'men-clothing', 'shorts', 'arise-shorts']","101, SRI GANAPATHI COMPLEXAKSHYANAGAR MAIN ROADBengaluru , Karnataka - 560076",Buy ARISE Men Maroon & Grey Melange Colourblocked Shorts - Shorts for Men from ARISE at Rs. 623. Style ID: 17897050,"ARISE Men Maroon & Grey Melange Colourblocked Shorts,  ARISE, Shorts, Bottomwear, Apparel, Apparel for Men, Buy ARISE Men Maroon & Grey Melange Colourblocked Shorts Online in India, Buy Shorts at best price"
trousers/v-mart/v-mart-men-rust-slim-fit-twill-cotton-chinos-trousers/18129282/buy,"['clothing', 'men-clothing', 'trousers', 'v-mart-trousers']","Plot No.862, Sector 19, Phase VUdyog Vihar, Industrial AreaGurugram , Haryana - 122016",Buy V Mart Men Rust Slim Fit Twill Cotton Chinos Trousers - Trousers for Men from V Mart at Rs. 765. Style ID: 18129282,"V Mart Men Rust Slim Fit Twill Cotton Chinos Trousers,  V Mart, Trousers, Bottomwear, Apparel, Apparel for Men, Buy V Mart Men Rust Slim Fit Twill Cotton Chinos Trousers Online in India, Buy Trousers at best price"
handbags/safyr/safyr-black-half-moon-sling-bag-with-chain-detail/17998506/buy,"['accessories', 'women-accessories', 'handbags', 'safyr-handbags']","Ground Floor, Kh No-68/23, Old No-11, Newno-RZ-11-ANew Colony, Gali No-6, Raj Nagar, Palam ColonyDelhi , DELHI - 110045",Buy SAFYR Black Half Moon Sling Bag With Chain Detail - Handbags for Women from SAFYR at Rs. 4500. Style ID: 17998506,"SAFYR Black Half Moon Sling Bag With Chain Detail,  SAFYR, Handbags, Bags, Accessories, Accessories for Women, Buy SAFYR Black Half Moon Sling Bag With Chain Detail Online in India, Buy Handbags at best price"
tops/zalora-work/zalora-work-women-blue-solid-shirt-style-top/17991744/buy,"['clothing', 'women-clothing', 'tops', 'zalora-work-tops']","Second Floor, Plot No. 82, Okhla Industrial Estate, Phase - III, New Delhi, Delhi, 110020Delhi , Delhi - 110020",Buy ZALORA WORK Women Blue Solid Shirt Style Top - Tops for Women from ZALORA WORK at Rs. 2024. Style ID: 17991744,"ZALORA WORK Women Blue Solid Shirt Style Top,  ZALORA WORK, Tops, Topwear, Apparel, Apparel for Women, Buy ZALORA WORK Women Blue Solid Shirt Style Top Online in India, Buy Tops at best price"
tops/zalora-work/zalora-work-women-black-styled-back-top/17991716/buy,"['clothing', 'women-clothing', 'tops', 'zalora-work-tops']","Second Floor, Plot No. 82, Okhla Industrial Estate, Phase - III, New Delhi, Delhi, 110020Delhi , Delhi - 110020",Buy ZALORA WORK Women Black Styled Back Top - Tops for Women from ZALORA WORK at Rs. 1874. Style ID: 17991716,"ZALORA WORK Women Black Styled Back Top,  ZALORA WORK, Tops, Topwear, Apparel, Apparel for Women, Buy ZALORA WORK Women Black Styled Back Top Online in India, Buy Tops at best price"
tops/zalora-basics/zalora-basics-yellow-solid-sleeveless-top/17991036/buy,"['clothing', 'women-clothing', 'tops', 'zalora-basics-tops']","Second Floor, Plot No. 82, Okhla Industrial Estate, Phase - III, New Delhi, Delhi, 110020Delhi , Delhi - 110020",Buy ZALORA BASICS Yellow Solid Sleeveless Top - Tops for Women from ZALORA BASICS at Rs. 1274. Style ID: 17991036,"ZALORA BASICS Yellow Solid Sleeveless Top,  ZALORA BASICS, Tops, Topwear, Apparel, Apparel for Women, Buy ZALORA BASICS Yellow Solid Sleeveless Top Online in India, Buy Tops at best price"
messenger-bag/hidesign/hidesign-men-blue--black-textured-messenger-bag/15294072/buy,"['accessories', 'men-accessories', 'messenger-bag', 'hidesign-messenger-bag']","244/1, OTHIAMPET VILLAGE, VILLIANUR, Pondicherry,  Puducherry, 605110Puducherry , Pondicherry - 605110",Buy Hidesign Men Blue & Black Textured Messenger Bag - Messenger Bag for Men from Hidesign at Rs. 9695. Style ID: 15294072,"Hidesign Men Blue & Black Textured Messenger Bag,  Hidesign, Messenger Bag, Bags, Accessories, Accessories for Men, Buy Hidesign Men Blue & Black Textured Messenger Bag Online in India, Buy Messenger Bag at best price"
nehru-jackets/linen-club/linen-club-men-black-solid-woven-linen-nehru-jacket/17453192/buy,"['clothing', 'men-clothing', 'nehru-jackets', 'linen-club-nehru-jackets']","Village Babra Bakipur, Pataudi Road,Near Adani Logistic Park, ICD PatliGurugram , Haryana - 122503",Buy Linen Club Men Black Solid Woven Linen Nehru Jacket - Nehru Jackets for Men from Linen Club at Rs. 3749. Style ID: 17453192,"Linen Club Men Black Solid Woven Linen Nehru Jacket,  Linen Club, Nehru Jackets, Topwear, Apparel, Apparel for Men, Buy Linen Club Men Black Solid Woven Linen Nehru Jacket Online in India, Buy Nehru Jackets at best price"
dresses/label-ritu-kumar/label-ritu-kumar-peach-coloured-floral-crepe-maxi-dress/15940704/buy,"['clothing', 'women-clothing', 'dresses', 'label-ritu-kumar-dresses']","138 BELIGHATA ROAD, KOLKATAKolkata , West Bengal - 700015",Buy Label Ritu Kumar Peach Coloured Floral Crepe Maxi Dress - Dresses for Women from Label Ritu Kumar at Rs. 4830. Style ID: 15940704,"Label Ritu Kumar Peach Coloured Floral Crepe Maxi Dress,  Label Ritu Kumar, Dresses, Dress, Apparel, Apparel for Women, Buy Label Ritu Kumar Peach Coloured Floral Crepe Maxi Dress Online in India, Buy Dresses at best price"
nehru-jackets/kisah/kisah-men-grey--green-printed-woven-nehru-jacket--/18489498/buy,"['clothing', 'men-clothing', 'nehru-jackets', 'kisah-nehru-jackets']","P62 Canal South Road, Metropolitan Cooperative Housing SocietySector B, Third LaneKolkata , West bengal - 700105",Buy KISAH Men Grey & Green Printed Woven Nehru Jacket - Nehru Jackets for Men from KISAH at Rs. 2749. Style ID: 18489498,"KISAH Men Grey & Green Printed Woven Nehru Jacket,  KISAH, Nehru Jackets, Topwear, Apparel, Apparel for Men, Buy KISAH Men Grey & Green Printed Woven Nehru Jacket Online in India, Buy Nehru Jackets at best price"
dress-material/biba/biba-peach-coloured--maroon-printed-unstitched-dress-material/15079308/buy,"['clothing', 'women-clothing', 'dress-material', 'biba-dress-material']","Biba Apparels Pvt. Ltd., 13 MIN, 7,14, 15/1, 15/2, 60/6, REET/KILLA No 60/8,Village Sikri, Tehsil Ballabgarh, District Faridabad, Faridabad, Faridabad, Haryana-121004Faridabad , Haryana - 121004",Buy Biba Peach Coloured & Maroon Printed Unstitched Dress Material - Dress Material for Women from Biba at Rs. 2099. Style ID: 15079308,"Biba Peach Coloured & Maroon Printed Unstitched Dress Material,  Biba, Dress Material, Apparel Set, Apparel, Apparel for Women, Buy Biba Peach Coloured & Maroon Printed Unstitched Dress Material Online in India, Buy Dress Material at best price"
sunglasses/ted-smith/ted-smith-unisex-grey-lens--black-square-sunglasses-with-uv-protected-lens-wayflexc2/18083064/buy,"['accessories', 'unisex-accessories', 'sunglasses', 'ted-smith-sunglasses']","Basement,C-68 LOWER GROUND FLOOR,LAJPAT NAGAR PART - 2Delhi , Delhi - 110024",Buy Ted Smith Unisex Grey Lens & Black Square Sunglasses With UV Protected Lens WAYFLEX_C2 - Sunglasses for Unisex from Ted Smith at Rs. 1011. Style ID: 18083064,"Ted Smith Unisex Grey Lens & Black Square Sunglasses With UV Protected Lens WAYFLEX_C2,  Ted Smith, Sunglasses, Eyewear, Accessories, Accessories for Unisex, Buy Ted Smith Unisex Grey Lens & Black Square Sunglasses With UV Protected Lens WAYFLEX_C2 Online in India, Buy Sunglasses at best price"
dresses/revolution/revolution-plus-size-olive-green-pure-cotton-knitted-a-line-midi-dress/13993792/buy,"['clothing', 'women-clothing', 'dresses', 'revolution-dresses']","203 ShahpurjatDilip Singh ChowkDelhi , Delhi - 110049",Buy Revolution Plus Size Olive Green Pure Cotton Knitted A Line Midi Dress - Dresses for Women from Revolution at Rs. 1725. Style ID: 13993792,"Revolution Plus Size Olive Green Pure Cotton Knitted A Line Midi Dress,  Revolution, Dresses, Dress, Apparel, Apparel for Women, Buy Revolution Plus Size Olive Green Pure Cotton Knitted A Line Midi Dress Online in India, Buy Dresses at best price"
dresses/anayna/anayna-women-white--pink-pure-cotton-printed-maternity-layered-a-line-dress/13264608/buy,"['clothing', 'women-clothing', 'dresses', 'anayna-dresses']",,Buy Anayna Women White & Pink Pure Cotton Printed Maternity Layered A Line Dress - Dresses for Women from Anayna at Rs. 1750. Style ID: 13264608,"Anayna Women White & Pink Pure Cotton Printed Maternity Layered A Line Dress,  Anayna, Dresses, Dress, Apparel, Apparel for Women, Buy Anayna Women White & Pink Pure Cotton Printed Maternity Layered A Line Dress Online in India, Buy Dresses at best price"
belts/louis-philippe/louis-philippe-men-black--brown-solid-reversible-leather-belt/13207176/buy,"['accessories', 'men-accessories', 'belts', 'louis-philippe-belts']","Ground Floor, No 65/64, old No 65, 6th Block, Ward No 21, 2ndMain Road,Bengaluru , Karnataka - 560044",Buy Louis Philippe Men Black & Brown Solid Reversible Leather Belt - Belts for Men from Louis Philippe at Rs. 1099. Style ID: 13207176,"Louis Philippe Men Black & Brown Solid Reversible Leather Belt,  Louis Philippe, Belts, Belts, Accessories, Accessories for Men, Buy Louis Philippe Men Black & Brown Solid Reversible Leather Belt Online in India, Buy Belts at best price"
kurtas/ishin/ishin-women-black-embroidered-anarkali-kurta/13506808/buy,"['clothing', 'women-clothing', 'kurtas', 'ishin-kurtas']","2nd Floor, NO. 39, NGEF Lane, Indiranagar First StageBangaloreBengaluru , Karnataka - 560038",Buy Ishin Women Black Embroidered Anarkali Kurta - Kurtas for Women from Ishin at Rs. 2749. Style ID: 13506808,"Ishin Women Black Embroidered Anarkali Kurta,  Ishin, Kurtas, Topwear, Apparel, Apparel for Women, Buy Ishin Women Black Embroidered Anarkali Kurta Online in India, Buy Kurtas at best price"
kurta-sets/ishin/ishin-women-mustard-yellow-bandhani-printed-gotta-patti-kurta-with-trousers--dupatta/15098960/buy,"['clothing', 'women-clothing', 'kurta-sets', 'ishin-kurta-sets']","2nd Floor, NO. 39, NGEF Lane, Indiranagar First StageBangaloreBengaluru , Karnataka - 560038",Buy Ishin Women Mustard Yellow Bandhani Printed Gotta Patti Kurta With Trousers & Dupatta - Kurta Sets for Women from Ishin at Rs. 2887. Style ID: 15098960,"Ishin Women Mustard Yellow Bandhani Printed Gotta Patti Kurta With Trousers & Dupatta,  Ishin, Kurta Sets, Apparel Set, Apparel, Apparel for Women, Buy Ishin Women Mustard Yellow Bandhani Printed Gotta Patti Kurta With Trousers & Dupatta Online in India, Buy Kurta Sets at best price"
kurta-sets/biba/biba-women-navy-blue--white-indigo-dyed-kurta-with-trousers--dupatta/12185562/buy,"['clothing', 'women-clothing', 'kurta-sets', 'biba-kurta-sets']","10, Cabin No 17, PVR Plaza Building, H Block, Connaught CircusDelhi , Delhi - 110001",Buy Biba Women Navy Blue & White Indigo Dyed Kurta With Trousers & Dupatta - Kurta Sets for Women from Biba at Rs. 2149. Style ID: 12185562,"Biba Women Navy Blue & White Indigo Dyed Kurta With Trousers & Dupatta,  Biba, Kurta Sets, Apparel Set, Apparel, Apparel for Women, Buy Biba Women Navy Blue & White Indigo Dyed Kurta With Trousers & Dupatta Online in India, Buy Kurta Sets at best price"
track-pants/cremlin-clothing/cremlin-clothing-kids-set-of-3-solid-track-pants/17630140/buy,"['clothing', 'unisex-kids-clothing', 'track-pants', 'cremlin-clothing-track-pants']","FIRST FLOOR, PROPERTY BEARING 36, PATPARHGANJ INDUSTRIAL AREA, DELHI, EAST DELHIDelhi , Delhi - 110092",Buy CREMLIN CLOTHING Kids Set Of 3 Solid Track Pants - Track Pants for Unisex Kids from CREMLIN CLOTHING at Rs. 749. Style ID: 17630140,"CREMLIN CLOTHING Kids Set Of 3 Solid Track Pants,  CREMLIN CLOTHING, Track Pants, Bottomwear, Apparel, Apparel for Unisex Kids, Buy CREMLIN CLOTHING Kids Set Of 3 Solid Track Pants Online in India, Buy Track Pants at best price"
leggings/de-moza/de-moza-women-green-solid-ankle-length-leggings/15975328/buy,"['clothing', 'women-clothing', 'leggings', 'de-moza-leggings']","301 Regent Prime,4th Floor,Whitefield Main RoadWhitefield,BangaloreBengaluru , Karnataka - 560066",Buy De Moza Women Green Solid Ankle Length Leggings - Leggings for Women from De Moza at Rs. 499. Style ID: 15975328,"De Moza Women Green Solid Ankle Length Leggings,  De Moza, Leggings, Bottomwear, Apparel, Apparel for Women, Buy De Moza Women Green Solid Ankle Length Leggings Online in India, Buy Leggings at best price"
tshirts/street-9/street-9-women-coral-typography-printed-loose-cotton-outdoor-t-shirt/17904736/buy,"['clothing', 'women-clothing', 'tshirts', 'street-9-tshirts']","D-142 INDL Area GNEPIP, KasnaNoida , Uttar Pradesh - 201310",Buy STREET 9 Women Coral Typography Printed Loose Cotton Outdoor T Shirt - Tshirts for Women from STREET 9 at Rs. 628. Style ID: 17904736,"STREET 9 Women Coral Typography Printed Loose Cotton Outdoor T Shirt,  STREET 9, Tshirts, Topwear, Apparel, Apparel for Women, Buy STREET 9 Women Coral Typography Printed Loose Cotton Outdoor T Shirt Online in India, Buy Tshirts at best price"
tshirts/pepe-jeans/pepe-jeans-boys-red-printed-pure-cotton-polo-collar-pure-cotton-t-shirt/11273994/buy,"['clothing', 'boys-clothing', 'tshirts', 'pepe-jeans-tshirts']","No . 397/1, Parvathi Nilaya, Basavannagudi Main RoadBengaluru , Karnataka - 560068",Buy Pepe Jeans Boys Red Printed Pure Cotton Polo Collar Pure Cotton T Shirt - Tshirts for Boys from Pepe Jeans at Rs. 599. Style ID: 11273994,"Pepe Jeans Boys Red Printed Pure Cotton Polo Collar Pure Cotton T Shirt,  Pepe Jeans, Tshirts, Topwear, Apparel, Apparel for Boys, Buy Pepe Jeans Boys Red Printed Pure Cotton Polo Collar Pure Cotton T Shirt Online in India, Buy Tshirts at best price"
lounge-pants/sweet-dreams/sweet-dreams-women-green-graphic-print-cotton-lounge-pants/18695856/buy,"['clothing', 'women-clothing', 'lounge-pants', 'sweet-dreams-lounge-pants']","D140 PHASE 7, INDUSTRIAL AREARupnagar , Punjab - 160055",Buy Sweet Dreams Women Green Graphic Print Cotton Lounge Pants - Lounge Pants for Women from Sweet Dreams at Rs. 629. Style ID: 18695856,"Sweet Dreams Women Green Graphic Print Cotton Lounge Pants,  Sweet Dreams, Lounge Pants, Loungewear And Nightwear, Apparel, Apparel for Women, Buy Sweet Dreams Women Green Graphic Print Cotton Lounge Pants Online in India, Buy Lounge Pants at best price"
shorts/forever-21/forever-21-women-blue-pure-cotton-chino-shorts/17019442/buy,"['clothing', 'women-clothing', 'shorts', 'forever-21-shorts']","Cabin No. 6, Property 2, Gujarat Vihar, Vikas Marg, New Delhi, Delhi, 110092Delhi , Delhi - 110092",Buy FOREVER 21 Women Blue Pure Cotton Chino Shorts - Shorts for Women from FOREVER 21 at Rs. 899. Style ID: 17019442,"FOREVER 21 Women Blue Pure Cotton Chino Shorts,  FOREVER 21, Shorts, Bottomwear, Apparel, Apparel for Women, Buy FOREVER 21 Women Blue Pure Cotton Chino Shorts Online in India, Buy Shorts at best price"
jumpsuit/flambeur/flambeur-plus-size-black--white-printed-basic-jumpsuit/17747670/buy,"['clothing', 'women-clothing', 'jumpsuit', 'flambeur-jumpsuit']","F-6,7 Arya Samaj RoadDelhi , Delhi - 110059",Buy Flambeur Plus Size Black & White Printed Basic Jumpsuit - Jumpsuit for Women from Flambeur at Rs. 1091. Style ID: 17747670,"Flambeur Plus Size Black & White Printed Basic Jumpsuit,  Flambeur, Jumpsuit, Dress, Apparel, Apparel for Women, Buy Flambeur Plus Size Black & White Printed Basic Jumpsuit Online in India, Buy Jumpsuit at best price"
tshirts/arrow-sport/arrow-sport-men-blue-striped-polo-collar-t-shirt/17936526/buy,"['clothing', 'men-clothing', 'tshirts', 'arrow-sport-tshirts']","10TH FLOOR, DU PARC TRINITY, NO 17, M.G ROAD, Bengaluru (Bangalore) Rural,Bengaluru , Karnataka - 560001",Buy Arrow Sport Men Blue Striped Polo Collar T Shirt - Tshirts for Men from Arrow Sport at Rs. 659. Style ID: 17936526,"Arrow Sport Men Blue Striped Polo Collar T Shirt,  Arrow Sport, Tshirts, Topwear, Apparel, Apparel for Men, Buy Arrow Sport Men Blue Striped Polo Collar T Shirt Online in India, Buy Tshirts at best price"
tshirts/lee/lee-men-black-printed-relaxed-fit-t-shirt/17105786/buy,"['clothing', 'men-clothing', 'tshirts', 'lee-tshirts']","10, Cabin No 17, PVR Plaza Building, H Block, Connaught CircusDelhi , Delhi - 110001",Buy Lee Men Black Printed Relaxed Fit T Shirt - Tshirts for Men from Lee at Rs. 699. Style ID: 17105786,"Lee Men Black Printed Relaxed Fit T Shirt,  Lee, Tshirts, Topwear, Apparel, Apparel for Men, Buy Lee Men Black Printed Relaxed Fit T Shirt Online in India, Buy Tshirts at best price"
kurtas/inddus/inddus-women-pink--silver-toned-striped-keyhole-neck-gotta-patti-kaftan-kurta/14808052/buy,"['clothing', 'women-clothing', 'kurtas', 'inddus-kurtas']","4-B, Anjani TowerParle PointSurat , Gujarat - 395007",Buy Inddus Women Pink & Silver Toned Striped Keyhole Neck Gotta Patti Kaftan Kurta - Kurtas for Women from Inddus at Rs. 1479. Style ID: 14808052,"Inddus Women Pink & Silver Toned Striped Keyhole Neck Gotta Patti Kaftan Kurta,  Inddus, Kurtas, Topwear, Apparel, Apparel for Women, Buy Inddus Women Pink & Silver Toned Striped Keyhole Neck Gotta Patti Kaftan Kurta Online in India, Buy Kurtas at best price"
kurtas/kipek/kipek-women-teal-green--gold-toned-woven-design-a-line-kurta/12015490/buy,"['clothing', 'women-clothing', 'kurtas', 'kipek-kurtas']",,Buy Kipek Women Teal Green & Gold Toned Woven Design A Line Kurta - Kurtas for Women from Kipek at Rs. 1367. Style ID: 12015490,"Kipek Women Teal Green & Gold Toned Woven Design A Line Kurta,  Kipek, Kurtas, Topwear, Apparel, Apparel for Women, Buy Kipek Women Teal Green & Gold Toned Woven Design A Line Kurta Online in India, Buy Kurtas at best price"
kurta-sets/ziyaa/ziyaa-women-black-printed-kurta-with-trousers--dupatta/14429412/buy,"['clothing', 'women-clothing', 'kurta-sets', 'ziyaa-kurta-sets']","Plot No.- 711, Road No. 7, Opp. Arman Mill, Sachin GIDCSurat , Gujarat - 394230",Buy ZIYAA Women Black Printed Kurta With Trousers & Dupatta - Kurta Sets for Women from ZIYAA at Rs. 1407. Style ID: 14429412,"ZIYAA Women Black Printed Kurta With Trousers & Dupatta,  ZIYAA, Kurta Sets, Apparel Set, Apparel, Apparel for Women, Buy ZIYAA Women Black Printed Kurta With Trousers & Dupatta Online in India, Buy Kurta Sets at best price"
boxers/mackly/mackly-boys-pack-of-3-printed-boxers-/17617754/buy,"['clothing', 'boys-clothing', 'boxers', 'mackly-boxers']","1/1135-J, Chenniappa colony, K.chettipalayam,Dharapuram Road,TiruppurTirupur , Tamilnadu - 641608",Buy Mackly Boys Pack Of 3 Printed Boxers - Boxers for Boys from Mackly at Rs. 594. Style ID: 17617754,"Mackly Boys Pack Of 3 Printed Boxers,  Mackly, Boxers, Innerwear, Apparel, Apparel for Boys, Buy Mackly Boys Pack Of 3 Printed Boxers Online in India, Buy Boxers at best price"
