prod_link,tags,seller_address,meta_description,meta_keyword
track-pants/mkh/mkh-men-grey-melange--black-checked-track-pants/16377962/buy,"['clothing', 'men-clothing', 'track-pants', 'mkh-track-pants']","77, BAL SINGH NAGAR, STREET No.11, LUDHIANA, Ludhiana, Punjab, 141007Ludhiana , Punjab - 141007",Buy MKH Men Grey Melange & Black Checked Track Pants - Track Pants for Men from MKH at Rs. 479. Style ID: 16377962,"MKH Men Grey Melange & Black Checked Track Pants,  MKH, Track Pants, Bottomwear, Apparel, Apparel for Men, Buy MKH Men Grey Melange & Black Checked Track Pants Online in India, Buy Track Pants at best price"
jeans/code-61/code-61-men-navy-blue-skinny-fit-low-rise-stretchable-jeans/17779610/buy,"['clothing', 'men-clothing', 'jeans', 'code-61-jeans']","GREEN PARK SEC-3 BUNGLOW NO. 14 GOKULDHAM TOWNSHIP NR. SANATHAL CROSS ROADS SHANTIPURA TALUKA SANANDAhmedabad , Gujarat - 382210",Buy Code 61 Men Navy Blue Skinny Fit Low Rise Stretchable Jeans - Jeans for Men from Code 61 at Rs. 1869. Style ID: 17779610,"Code 61 Men Navy Blue Skinny Fit Low Rise Stretchable Jeans,  Code 61, Jeans, Bottomwear, Apparel, Apparel for Men, Buy Code 61 Men Navy Blue Skinny Fit Low Rise Stretchable Jeans Online in India, Buy Jeans at best price"
kurtas/nayo/nayo-women-grey-yoke-design-embroidered-kurta/16877600/buy,"['clothing', 'women-clothing', 'kurtas', 'nayo-kurtas']","F-255-A, 1st, 2nd, 3rd floor, RIICO INDUSTRIAL AREA MANSAROVARJAIPUR , Rajasthan - 302020",Buy Nayo Women Grey Yoke Design Embroidered Kurta - Kurtas for Women from Nayo at Rs. 849. Style ID: 16877600,"Nayo Women Grey Yoke Design Embroidered Kurta,  Nayo, Kurtas, Topwear, Apparel, Apparel for Women, Buy Nayo Women Grey Yoke Design Embroidered Kurta Online in India, Buy Kurtas at best price"
bra/mod--shy/mod--shy-women-beige-underwired-lightly-padded-t-shirt-bra---ms159a/15259734/buy,"['clothing', 'women-clothing', 'bra', 'mod-and-shy-bra']","FIRST FLOOR, U-155,UPADHYAY BLOCK, SHAKARPUR, East DelhiNear Laxmi Nagar Metro Station Gate No-3,4Delhi , Delhi - 110092",Buy Mod & Shy Women Beige Underwired Lightly Padded T Shirt Bra   MS159A - Bra for Women from Mod & Shy at Rs. 463. Style ID: 15259734,"Mod & Shy Women Beige Underwired Lightly Padded T Shirt Bra   MS159A,  Mod & Shy, Bra, Innerwear, Apparel, Apparel for Women, Buy Mod & Shy Women Beige Underwired Lightly Padded T Shirt Bra   MS159A Online in India, Buy Bra at best price"
trousers/arrow/arrow-men-black-solid-tailored-fit-foraml-trousers/16053970/buy,"['clothing', 'men-clothing', 'trousers', 'arrow-trousers']","5A/19,Ground Floor ( Front Portion),Ansari Raod,DaryaganjDelhi , Delhi - 110002",Buy Arrow Men Black Solid Tailored Fit Foraml Trousers - Trousers for Men from Arrow at Rs. 1249. Style ID: 16053970,"Arrow Men Black Solid Tailored Fit Foraml Trousers,  Arrow, Trousers, Bottomwear, Apparel, Apparel for Men, Buy Arrow Men Black Solid Tailored Fit Foraml Trousers Online in India, Buy Trousers at best price"
shirts/the-indian-garage-co/the-indian-garage-co-men-beige--coffee-brown-classic-floral-printed-casual-shirt/17729520/buy,"['clothing', 'men-clothing', 'shirts', 'the-indian-garage-co-shirts']","2/1,Survey No.4&2,Bomanahalli Industrial Area, ,Begur road,Bengaluru , Karnataka - 560068",Buy The Indian Garage Co Men Beige & Coffee Brown Classic Floral Printed Casual Shirt - Shirts for Men from The Indian Garage Co at Rs. 612. Style ID: 17729520,"The Indian Garage Co Men Beige & Coffee Brown Classic Floral Printed Casual Shirt,  The Indian Garage Co, Shirts, Topwear, Apparel, Apparel for Men, Buy The Indian Garage Co Men Beige & Coffee Brown Classic Floral Printed Casual Shirt Online in India, Buy Shirts at best price"
shirts/dennis-lingo/dennis-lingo-men-green-comfort-slim-fit-solid-pure-cotton-casual-shirt/14167046/buy,"['clothing', 'men-clothing', 'shirts', 'dennis-lingo-shirts']","2nd Floor, NO. 39, NGEF Lane, Indiranagar First StageBangaloreBengaluru , Karnataka - 560038",Buy Dennis Lingo Men Green Comfort Slim Fit Solid Pure Cotton Casual Shirt - Shirts for Men from Dennis Lingo at Rs. 699. Style ID: 14167046,"Dennis Lingo Men Green Comfort Slim Fit Solid Pure Cotton Casual Shirt,  Dennis Lingo, Shirts, Topwear, Apparel, Apparel for Men, Buy Dennis Lingo Men Green Comfort Slim Fit Solid Pure Cotton Casual Shirt Online in India, Buy Shirts at best price"
flats/shezone/shezone-women-cream-coloured-solid-open-toe-flats/13564846/buy,"['footwear', 'women-footwear', 'flats', 'shezone-flats']","Shop no 159, Desh Bandhu Gupta Road, Karol Bagh, Central DelhiDelhi , Delhi - 110005",Buy Shezone Women Cream Coloured Solid Open Toe Flats - Flats for Women from Shezone at Rs. 1049. Style ID: 13564846,"Shezone Women Cream Coloured Solid Open Toe Flats,  Shezone, Flats, Shoes, Footwear, Footwear for Women, Buy Shezone Women Cream Coloured Solid Open Toe Flats Online in India, Buy Flats at best price"
lounge-tshirts/quarantine/quarantine-men-black-solid-round-neck-cotton-lounge-t-shirt/12998556/buy,"['clothing', 'men-clothing', 'lounge-tshirts', 'quarantine-lounge-tshirts']","17 Amarjothi Sathyamoorthy nagar, 1 st street,Kangeyam RoadCoimbatore , Tamil Nadu - 641604",Buy QUARANTINE Men Black Solid Round Neck Cotton Lounge T Shirt - Lounge Tshirts for Men from QUARANTINE at Rs. 391. Style ID: 12998556,"QUARANTINE Men Black Solid Round Neck Cotton Lounge T Shirt,  QUARANTINE, Lounge Tshirts, Loungewear And Nightwear, Apparel, Apparel for Men, Buy QUARANTINE Men Black Solid Round Neck Cotton Lounge T Shirt Online in India, Buy Lounge Tshirts at best price"
dresses/mast--harbour/mast--harbour-women-attractive-peach-polka-dotted-feminine-frills-dress/16888046/buy,"['clothing', 'women-clothing', 'dresses', 'mast-and-harbour-dresses']","Awfis, 7th floor, HM Vibha Tower, 25 Laskar Hosur Road, Adugodi, Bengalore 560029Bengaluru , Karnataka - 560029",Buy Mast & Harbour Women Attractive Peach Polka Dotted Feminine Frills Dress - Dresses for Women from Mast & Harbour at Rs. 799. Style ID: 16888046,"Mast & Harbour Women Attractive Peach Polka Dotted Feminine Frills Dress,  Mast & Harbour, Dresses, Dress, Apparel, Apparel for Women, Buy Mast & Harbour Women Attractive Peach Polka Dotted Feminine Frills Dress Online in India, Buy Dresses at best price"
jeans/flying-machine/flying-machine-men-blue-jackson-skinny-fit-low-rise-heavy-fade-stretchable-jeans/17098034/buy,"['clothing', 'men-clothing', 'jeans', 'flying-machine-jeans']","5A/19,Ground Floor ( Front Portion),Ansari Raod,DaryaganjDelhi , Delhi - 110002",Buy Flying Machine Men Blue Jackson Skinny Fit Low Rise Heavy Fade Stretchable Jeans - Jeans for Men from Flying Machine at Rs. 1319. Style ID: 17098034,"Flying Machine Men Blue Jackson Skinny Fit Low Rise Heavy Fade Stretchable Jeans,  Flying Machine, Jeans, Bottomwear, Apparel, Apparel for Men, Buy Flying Machine Men Blue Jackson Skinny Fit Low Rise Heavy Fade Stretchable Jeans Online in India, Buy Jeans at best price"
tshirts/herenow/herenow-men-maroon--white-colourblocked-pure-cotton-t-shirt/16610982/buy,"['clothing', 'men-clothing', 'tshirts', 'here-and-now-tshirts']","11th Floor, Flat No. 1106, 1107, 26, Kailash, Kasturba Gandhi Marg, New Delhi, New Delhi, Delhi, 110001Delhi , Delhi - 110001",Buy HERE&NOW Men Maroon & White Colourblocked Pure Cotton T Shirt - Tshirts for Men from HERE&NOW at Rs. 359. Style ID: 16610982,"HERE&NOW Men Maroon & White Colourblocked Pure Cotton T Shirt,  HERE&NOW, Tshirts, Topwear, Apparel, Apparel for Men, Buy HERE&NOW Men Maroon & White Colourblocked Pure Cotton T Shirt Online in India, Buy Tshirts at best price"
lehenga-choli/my-little-lambs/my-little-lambs-girls-turquoise-blue--gold-ready-to-wear-lehenga--choli/15954766/buy,"['clothing', 'girls-clothing', 'lehenga-choli', 'my-little-lambs-lehenga-choli']","10/973, Malviya Nagar, Sector 10, Jaipur, Rajasthan, India,Jaipur , Rajasthan - 302017",Buy My Little Lambs Girls Turquoise Blue & Gold Ready To Wear Lehenga & Choli - Lehenga Choli for Girls from My Little Lambs at Rs. 975. Style ID: 15954766,"My Little Lambs Girls Turquoise Blue & Gold Ready To Wear Lehenga & Choli,  My Little Lambs, Lehenga Choli, Topwear, Apparel, Apparel for Girls, Buy My Little Lambs Girls Turquoise Blue & Gold Ready To Wear Lehenga & Choli Online in India, Buy Lehenga Choli at best price"
bodysuit/hm/hm-boys-5-pack-grey--pink-bodysuits/18084374/buy,"['clothing', 'boys-clothing', 'bodysuit', 'h-and-m-bodysuit']","Prakhhyat Infraprojects PVT. LTD., BUILDING 6, K-Square Logistics Park C/O LF LogisticsNear Padgha Toll Naka on MUMBAI-NASIKThane , Maharashtra - 421101",Buy H&M Boys 5 Pack Grey & Pink Bodysuits - Bodysuit for Boys from H&M at Rs. 1499. Style ID: 18084374,"H&M Boys 5 Pack Grey & Pink Bodysuits,  H&M, Bodysuit, Topwear, Apparel, Apparel for Boys, Buy H&M Boys 5 Pack Grey & Pink Bodysuits Online in India, Buy Bodysuit at best price"
casual-shoes/kleat/kleat-men-beige-printed-loafers/18668752/buy,"['footwear', 'men-footwear', 'casual-shoes', 'kleat-casual-shoes']","Ashish enterprises C-37 new agra colony  Opp community hall  Agra 282005Agra , Uttar Pradesh - 282005",Buy KLEAT Men Beige Printed Loafers - Casual Shoes for Men from KLEAT at Rs. 1199. Style ID: 18668752,"KLEAT Men Beige Printed Loafers,  KLEAT, Casual Shoes, Shoes, Footwear, Footwear for Men, Buy KLEAT Men Beige Printed Loafers Online in India, Buy Casual Shoes at best price"
casual-shoes/mutaqinoti/mutaqinoti-men-blue-patent-leather-monks/15342768/buy,"['footwear', 'men-footwear', 'casual-shoes', 'mutaqinoti-casual-shoes']","A-129, Block A, Sushant Lok, Phase-II,Gurugram , Haryana - 122006",Buy MUTAQINOTI Men Blue Patent Leather Monks - Casual Shoes for Men from MUTAQINOTI at Rs. 1249. Style ID: 15342768,"MUTAQINOTI Men Blue Patent Leather Monks,  MUTAQINOTI, Casual Shoes, Shoes, Footwear, Footwear for Men, Buy MUTAQINOTI Men Blue Patent Leather Monks Online in India, Buy Casual Shoes at best price"
casual-shoes/louis-stitch/louis-stitch-men-brown-suede-driving-shoes/15723740/buy,"['footwear', 'men-footwear', 'casual-shoes', 'louis-stitch-casual-shoes']","A-129, Block A, Sushant Lok, Phase-II,Gurugram , Haryana - 122006",Buy LOUIS STITCH Men Brown Suede Driving Shoes - Casual Shoes for Men from LOUIS STITCH at Rs. 1819. Style ID: 15723740,"LOUIS STITCH Men Brown Suede Driving Shoes,  LOUIS STITCH, Casual Shoes, Shoes, Footwear, Footwear for Men, Buy LOUIS STITCH Men Brown Suede Driving Shoes Online in India, Buy Casual Shoes at best price"
casual-shoes/fentacia/fentacia-men-brown-flat-chelsea-boots/14962650/buy,"['footwear', 'men-footwear', 'casual-shoes', 'fentacia-casual-shoes']","LOWER GROUND FLOOR, PROPERTY NO. 32A/D-660A/80/43, KHASRA NO. 941,942,946, PANCHAYATI PANJABA, BALAJI NAGAR,, AGRAAgra , Uttar pradesh - 282005",Buy Fentacia Men Brown Flat Chelsea Boots - Casual Shoes for Men from Fentacia at Rs. 1249. Style ID: 14962650,"Fentacia Men Brown Flat Chelsea Boots,  Fentacia, Casual Shoes, Shoes, Footwear, Footwear for Men, Buy Fentacia Men Brown Flat Chelsea Boots Online in India, Buy Casual Shoes at best price"
tshirts/ajile-by-pantaloons/ajile-by-pantaloons-men-green--blue-colourblocked-slim-fit-t-shirt/18275912/buy,"['clothing', 'men-clothing', 'tshirts', 'ajile-by-pantaloons-tshirts']","Business Ground Floor,No 65/64, old No 65, 6th Block, Ward No 21, 2nd Main RoadBengaluru (Bangalore) UrbanBengaluru , Karnataka - 560044",Buy Ajile By Pantaloons Men Green & Blue Colourblocked Slim Fit T Shirt - Tshirts for Men from Ajile By Pantaloons at Rs. 399. Style ID: 18275912,"Ajile By Pantaloons Men Green & Blue Colourblocked Slim Fit T Shirt,  Ajile By Pantaloons, Tshirts, Topwear, Apparel, Apparel for Men, Buy Ajile By Pantaloons Men Green & Blue Colourblocked Slim Fit T Shirt Online in India, Buy Tshirts at best price"
jumpsuit/mango/mango-black-solid-cut-out-detail-basic-jumpsuit/18257190/buy,"['clothing', 'women-clothing', 'jumpsuit', 'mango-jumpsuit']","406, B2 and C, 4th Floor,Centrum Plaza, Golf Course Road, Sector - 53,Gurugram , Haryana - 122102",Buy MANGO Black Solid Cut Out Detail Basic Jumpsuit - Jumpsuit for Women from MANGO at Rs. 3992. Style ID: 18257190,"MANGO Black Solid Cut Out Detail Basic Jumpsuit,  MANGO, Jumpsuit, Dress, Apparel, Apparel for Women, Buy MANGO Black Solid Cut Out Detail Basic Jumpsuit Online in India, Buy Jumpsuit at best price"
sarees/perfect-wear/perfect-wear-yellow--red-ethnic-motifs-zari-silk-cotton-banarasi-saree/17979514/buy,"['clothing', 'women-clothing', 'sarees', 'perfect-wear-sarees']","2nd FLOOR, GATE NO-3, PLOT NO. F-1129, LAXMI TEXTILEPARK, G.I.D.C., SACHIN, Surat, Gujarat, 394230Surat , GUJARAT - 394230",Buy PERFECT WEAR Yellow & Red Ethnic Motifs Zari Silk Cotton Banarasi Saree - Sarees for Women from PERFECT WEAR at Rs. 4499. Style ID: 17979514,"PERFECT WEAR Yellow & Red Ethnic Motifs Zari Silk Cotton Banarasi Saree,  PERFECT WEAR, Sarees, Saree, Apparel, Apparel for Women, Buy PERFECT WEAR Yellow & Red Ethnic Motifs Zari Silk Cotton Banarasi Saree Online in India, Buy Sarees at best price"
tshirts/elle/elle-women-lime-green-typography-printed-slim-fit-crop-cotton-t-shirt/18208300/buy,"['clothing', 'women-clothing', 'tshirts', 'elle-tshirts']","Iconic Fashion Retailing Pvt Ltd C/o Holisol Pvt Ltd. 24//23/2/2, 24/2, 24/3, 25/2/1, 34//3/3, 4, 5/1, 26, GKP WAREHOUSE GREEN COLOR, FATEHPUR JAURASI ROAD, VILLAGE-JAURASI, Mewat, Haryana, 122105Bhiwadi , HARYANA - 122105",Buy ELLE Women Lime Green Typography Printed Slim Fit Crop Cotton T Shirt - Tshirts for Women from ELLE at Rs. 1609. Style ID: 18208300,"ELLE Women Lime Green Typography Printed Slim Fit Crop Cotton T Shirt,  ELLE, Tshirts, Topwear, Apparel, Apparel for Women, Buy ELLE Women Lime Green Typography Printed Slim Fit Crop Cotton T Shirt Online in India, Buy Tshirts at best price"
bra/floret/floret-pink--black-bra/18364654/buy,"['clothing', 'women-clothing', 'bra', 'floret-bra']","54/24 & 29, NANGLI POONA, G.T. KARNAL ROAD, DELHI-110036Delhi , Delhi - 110036",Buy Floret Pink & Black Bra - Bra for Women from Floret at Rs. 672. Style ID: 18364654,"Floret Pink & Black Bra,  Floret, Bra, Innerwear, Apparel, Apparel for Women, Buy Floret Pink & Black Bra Online in India, Buy Bra at best price"
heels/fitflop/fitflop-beige-embellished-pu-wedge-sandals/18713244/buy,"['footwear', 'women-footwear', 'heels', 'fitflop-heels']",,Buy Fitflop Beige Embellished PU Wedge Sandals - Heels for Women from Fitflop at Rs. 7499. Style ID: 18713244,"Fitflop Beige Embellished PU Wedge Sandals,  Fitflop, Heels, Shoes, Footwear, Footwear for Women, Buy Fitflop Beige Embellished PU Wedge Sandals Online in India, Buy Heels at best price"
shirts/louis-philippe-sport/louis-philippe-sport-men-pink-slim-fit-printed-casual-shirt/18445750/buy,"['clothing', 'men-clothing', 'shirts', 'louis-philippe-sport-shirts']","Ground Floor, No 65/64, old No 65, 6th Block, Ward No 21, 2ndMain Road,Bengaluru , Karnataka - 560044",Buy Louis Philippe Sport Men Pink Slim Fit Printed Casual Shirt - Shirts for Men from Louis Philippe Sport at Rs. 2849. Style ID: 18445750,"Louis Philippe Sport Men Pink Slim Fit Printed Casual Shirt,  Louis Philippe Sport, Shirts, Topwear, Apparel, Apparel for Men, Buy Louis Philippe Sport Men Pink Slim Fit Printed Casual Shirt Online in India, Buy Shirts at best price"
shirts/allen-solly-sport/allen-solly-sport-men-blue-horizontal-stripes-striped-casual-shirt/18333780/buy,"['clothing', 'men-clothing', 'shirts', 'allen-solly-sport-shirts']","Ground Floor, No 65/64, old No 65, 6th Block, Ward No 21, 2ndMain Road,Bengaluru , Karnataka - 560044",Buy Allen Solly Sport Men Blue Horizontal Stripes Striped Casual Shirt - Shirts for Men from Allen Solly Sport at Rs. 1816. Style ID: 18333780,"Allen Solly Sport Men Blue Horizontal Stripes Striped Casual Shirt,  Allen Solly Sport, Shirts, Topwear, Apparel, Apparel for Men, Buy Allen Solly Sport Men Blue Horizontal Stripes Striped Casual Shirt Online in India, Buy Shirts at best price"
shirts/van-heusen/van-heusen-men-grey-printed-formal-shirt/18315512/buy,"['clothing', 'men-clothing', 'shirts', 'van-heusen-shirts']","Ground Floor, No 65/64, old No 65, 6th Block, Ward No 21, 2ndMain Road,Bengaluru , Karnataka - 560044",Buy Van Heusen Men Grey Printed Formal Shirt - Shirts for Men from Van Heusen at Rs. 2634. Style ID: 18315512,"Van Heusen Men Grey Printed Formal Shirt,  Van Heusen, Shirts, Topwear, Apparel, Apparel for Men, Buy Van Heusen Men Grey Printed Formal Shirt Online in India, Buy Shirts at best price"
dresses/jc-collection/jc-collection-women-multicoloured-floral-printed-dress/18228564/buy,"['clothing', 'women-clothing', 'dresses', 'jc-collection-dresses']","Second Floor, Plot No. 82, Okhla Industrial Estate, Phase - III, New Delhi, Delhi, 110020Delhi , Delhi - 110020",Buy JC Collection Women Multicoloured Floral Printed Dress - Dresses for Women from JC Collection at Rs. 4479. Style ID: 18228564,"JC Collection Women Multicoloured Floral Printed Dress,  JC Collection, Dresses, Dress, Apparel, Apparel for Women, Buy JC Collection Women Multicoloured Floral Printed Dress Online in India, Buy Dresses at best price"
wallets/hidesign/hidesign-men-brown-crocodile-skin-textured-two-fold-leather-wallet/12071864/buy,"['accessories', 'men-accessories', 'wallets', 'hidesign-wallets']",,Buy Hidesign Men Brown Crocodile Skin Textured Two Fold Leather Wallet - Wallets for Men from Hidesign at Rs. 1895. Style ID: 12071864,"Hidesign Men Brown Crocodile Skin Textured Two Fold Leather Wallet,  Hidesign, Wallets, Wallets, Accessories, Accessories for Men, Buy Hidesign Men Brown Crocodile Skin Textured Two Fold Leather Wallet Online in India, Buy Wallets at best price"
tops/zink-london/zink-london-yellow-striped-smocked-a-line-top/16958880/buy,"['clothing', 'women-clothing', 'tops', 'zink-london-tops']","148, 149, 150 Arupota VillagePragati Maidan PSKolkata , West bengal - 700105",Buy Zink London Yellow Striped Smocked A Line Top - Tops for Women from Zink London at Rs. 799. Style ID: 16958880,"Zink London Yellow Striped Smocked A Line Top,  Zink London, Tops, Topwear, Apparel, Apparel for Women, Buy Zink London Yellow Striped Smocked A Line Top Online in India, Buy Tops at best price"
dresses/hm/hm-women-beige-polka-dot-fit--flare-puff-sleeved-dress/16395218/buy,"['clothing', 'women-clothing', 'dresses', 'h-and-m-dresses']","Prakhhyat Infraprojects PVT. LTD., BUILDING 6, K-Square Logistics Park C/O LF LogisticsNear Padgha Toll Naka on MUMBAI-NASIKThane , Maharashtra - 421101","H&M Women Beige Polka Dot Fit & Flare Puff Sleeved Dress,  H&M, Dresses, Dress, Apparel, Apparel for Women, Buy H&M Women Beige Polka Dot Fit & Flare Puff Sleeved Dress Online in India, Buy Dresses at best price","H&M Women Beige Polka Dot Fit & Flare Puff Sleeved Dress,  H&M, Dresses, Dress, Apparel, Apparel for Women, Buy H&M Women Beige Polka Dot Fit & Flare Puff Sleeved Dress Online in India, Buy Dresses at best price"
kurta-sets/biba/biba-women-red--golden-striped-kurta-with-palazzos--dupatta/12413366/buy,"['clothing', 'women-clothing', 'kurta-sets', 'biba-kurta-sets']","10, Cabin No 17, PVR Plaza Building, H Block, Connaught CircusDelhi , Delhi - 110001",Buy Biba Women Red & Golden Striped Kurta With Palazzos & Dupatta - Kurta Sets for Women from Biba at Rs. 3597. Style ID: 12413366,"Biba Women Red & Golden Striped Kurta With Palazzos & Dupatta,  Biba, Kurta Sets, Apparel Set, Apparel, Apparel for Women, Buy Biba Women Red & Golden Striped Kurta With Palazzos & Dupatta Online in India, Buy Kurta Sets at best price"
night-suits/herenow/herenow-women-navy-blue--white-printed-night-suit/16557492/buy,"['clothing', 'women-clothing', 'night-suits', 'here-and-now-night-suits']","11th Floor, Flat No. 1106, 1107, 26, Kailash, Kasturba Gandhi Marg, New Delhi, New Delhi, Delhi, 110001Delhi , Delhi - 110001",Buy HERE&NOW Women Navy Blue & White Printed Night Suit - Night Suits for Women from HERE&NOW at Rs. 659. Style ID: 16557492,"HERE&NOW Women Navy Blue & White Printed Night Suit,  HERE&NOW, Night Suits, Loungewear And Nightwear, Apparel, Apparel for Women, Buy HERE&NOW Women Navy Blue & White Printed Night Suit Online in India, Buy Night Suits at best price"
body-wash-and-scrub/forest-essentials/forest-essentials-baby-hair--body-wash-dasapushpadi-200ml/13508718/buy,"['personal-care', 'unisex-kids-personal-care', 'body-wash-and-scrub', 'forest-essentials-body-wash-and-scrub']","Cabin No. 6, Property 2, Gujarat Vihar, Vikas Marg, New Delhi, Delhi, 110092Delhi , Delhi - 110092",Buy Forest Essentials Baby Hair & Body Wash Dasapushpadi 200ml - Body Wash And Scrub for Unisex Kids from Forest Essentials at Rs. 1195. Style ID: 13508718,"Forest Essentials Baby Hair & Body Wash Dasapushpadi 200ml,  Forest Essentials, Body Wash And Scrub, Bath And Body, Personal Care, Personal Care for Unisex Kids, Buy Forest Essentials Baby Hair & Body Wash Dasapushpadi 200ml Online in India, Buy Body Wash And Scrub at best price"
wallets/peter-england/peter-england-men-black--navy-blue-striped-leather-two-fold-wallet/13886592/buy,"['accessories', 'men-accessories', 'wallets', 'peter-england-wallets']","5A/19,Ground Floor ( Front Portion),Ansari Raod,DaryaganjDelhi , Delhi - 110002",Buy Peter England Men Black & Navy Blue Striped Leather Two Fold Wallet - Wallets for Men from Peter England at Rs. 599. Style ID: 13886592,"Peter England Men Black & Navy Blue Striped Leather Two Fold Wallet,  Peter England, Wallets, Wallets, Accessories, Accessories for Men, Buy Peter England Men Black & Navy Blue Striped Leather Two Fold Wallet Online in India, Buy Wallets at best price"
tshirts/peter-england/peter-england-men-black-graphic-printed-casual-t-shirt/17256084/buy,"['clothing', 'men-clothing', 'tshirts', 'peter-england-tshirts']","Ground Floor, No 65/64, old No 65, 6th Block, Ward No 21, 2ndMain Road,Bengaluru , Karnataka - 560044",Buy Peter England Men Black Graphic Printed Casual T Shirt - Tshirts for Men from Peter England at Rs. 489. Style ID: 17256084,"Peter England Men Black Graphic Printed Casual T Shirt,  Peter England, Tshirts, Topwear, Apparel, Apparel for Men, Buy Peter England Men Black Graphic Printed Casual T Shirt Online in India, Buy Tshirts at best price"
blankets-quilts-and-dohars/divine-casa/divine-casa-green--turquoise-blue-geometric-ac-room-110-gsm-single-bed-dohar/10323261/buy,"['home-furnishing', 'unisex-home-furnishing', 'blankets-quilts-and-dohars', 'divine-casa-blankets-quilts-and-dohars']","CTM HOMESTYLE PVT LTD CTM CHAR RASTA RAMOL ROAD, AHEMDABAD GUJRAT 380026, Gujarat, India, 380026AHEMDABAD GUJRAT 380026Ahmedabad , Gujarat - 380026",Buy Divine Casa Green & Turquoise Blue Geometric AC Room 110 GSM Single Bed Dohar - Blankets Quilts And Dohars for Unisex from Divine Casa at Rs. 899. Style ID: 10323261,"Divine Casa Green & Turquoise Blue Geometric AC Room 110 GSM Single Bed Dohar,  Divine Casa, Blankets Quilts And Dohars, Bedding, Home, Home for Unisex, Buy Divine Casa Green & Turquoise Blue Geometric AC Room 110 GSM Single Bed Dohar Online in India, Buy Blankets Quilts And Dohars at best price"
nightdress/secret-wish/secret-wish-peach-coloured--blue-striped-hosiery-nightdress/14026628/buy,"['clothing', 'women-clothing', 'nightdress', 'secret-wish-nightdress']","SECOND FLOOR, PLOT NO 287SECTOR-39, GURGAONGurugram , Haryana - 122001",Buy Secret Wish Peach Coloured & Blue Striped Hosiery Nightdress - Nightdress for Women from Secret Wish at Rs. 494. Style ID: 14026628,"Secret Wish Peach Coloured & Blue Striped Hosiery Nightdress,  Secret Wish, Nightdress, Loungewear And Nightwear, Apparel, Apparel for Women, Buy Secret Wish Peach Coloured & Blue Striped Hosiery Nightdress Online in India, Buy Nightdress at best price"
tshirts/duke/duke-men-green-striped-polo-collar-t-shirt/18748448/buy,"['clothing', 'men-clothing', 'tshirts', 'duke-tshirts']","shopbox Ecommerce Pvt Ltd c/o MJ Logistics Private Limited,,Seabird Marine services Pvt Ltd Village Babra Bakirpur,Pataudi Road Near Adani Logistic Park, ICD PatliGurugram , Haryana - 122503",Buy Duke Men Green Striped Polo Collar T Shirt - Tshirts for Men from Duke at Rs. 711. Style ID: 18748448,"Duke Men Green Striped Polo Collar T Shirt,  Duke, Tshirts, Topwear, Apparel, Apparel for Men, Buy Duke Men Green Striped Polo Collar T Shirt Online in India, Buy Tshirts at best price"
dresses/street-9/street-9-women-mustard-yellow-solid-pinafore-dress/11234412/buy,"['clothing', 'women-clothing', 'dresses', 'street-9-dresses']","D-142 INDL Area GNEPIP, KasnaNoida , Uttar Pradesh - 201310",Buy STREET 9 Women Mustard Yellow Solid Pinafore Dress - Dresses for Women from STREET 9 at Rs. 702. Style ID: 11234412,"STREET 9 Women Mustard Yellow Solid Pinafore Dress,  STREET 9, Dresses, Dress, Apparel, Apparel for Women, Buy STREET 9 Women Mustard Yellow Solid Pinafore Dress Online in India, Buy Dresses at best price"
trousers/louis-philippe/louis-philippe-men-grey-striped-slim-fit-trousers/18218536/buy,"['clothing', 'men-clothing', 'trousers', 'louis-philippe-trousers']","5A/19,Ground Floor ( Front Portion),Ansari Raod,DaryaganjDelhi , Delhi - 110002",Buy Louis Philippe Men Grey Striped Slim Fit Trousers - Trousers for Men from Louis Philippe at Rs. 1799. Style ID: 18218536,"Louis Philippe Men Grey Striped Slim Fit Trousers,  Louis Philippe, Trousers, Bottomwear, Apparel, Apparel for Men, Buy Louis Philippe Men Grey Striped Slim Fit Trousers Online in India, Buy Trousers at best price"
kurtas/vishudh/vishudh-women-coral-floral-embroidered-cotton-straight-kurta/17656902/buy,"['clothing', 'women-clothing', 'kurtas', 'vishudh-kurtas']","10, Cabin No 17, PVR Plaza Building, H Block, Connaught CircusDelhi , Delhi - 110001",Buy Vishudh Women Coral Floral Embroidered Cotton Straight Kurta - Kurtas for Women from Vishudh at Rs. 929. Style ID: 17656902,"Vishudh Women Coral Floral Embroidered Cotton Straight Kurta,  Vishudh, Kurtas, Topwear, Apparel, Apparel for Women, Buy Vishudh Women Coral Floral Embroidered Cotton Straight Kurta Online in India, Buy Kurtas at best price"
