prod_link,tags,seller_address,meta_description,meta_keyword
bedding-set/jc-collection/-jc-collection-beige-textured-bedding-set/17955340/buy,"['home-furnishing', 'unisex-home-furnishing', 'bedding-set', 'jc-collection-bedding-set']","Second Floor, Plot No. 82, Okhla Industrial Estate, Phase - III, New Delhi, Delhi, 110020Delhi , Delhi - 110020",Buy JC Collection Beige Textured Bedding Set - Bedding Set for Unisex from JC Collection at Rs. 5919. Style ID: 17955340,"JC Collection Beige Textured Bedding Set,  JC Collection, Bedding Set, Bedding, Home, Home for Unisex, Buy JC Collection Beige Textured Bedding Set Online in India, Buy Bedding Set at best price"
shirts/peter-england/peter-england-men-brown-slim-fit-casual-shirt/17911510/buy,"['clothing', 'men-clothing', 'shirts', 'peter-england-shirts']","Ground Floor, No 65/64, old No 65, 6th Block, Ward No 21, 2ndMain Road,Bengaluru , Karnataka - 560044",Buy Peter England Men Brown Slim Fit Casual Shirt - Shirts for Men from Peter England at Rs. 979. Style ID: 17911510,"Peter England Men Brown Slim Fit Casual Shirt,  Peter England, Shirts, Topwear, Apparel, Apparel for Men, Buy Peter England Men Brown Slim Fit Casual Shirt Online in India, Buy Shirts at best price"
shorts/nohvoh---sassafras-kids/noh-voh---sassafras-kids-girls-blue-printed-high-rise-denim-shorts/18002868/buy,"['clothing', 'girls-clothing', 'shorts', 'noh.voh-sassafras-kids-shorts']","KH No. 37/19, 3rd FloorKapasheraDelhi , Delhi - 110037",Buy Noh Voh   SASSAFRAS Kids Girls Blue Printed High Rise Denim Shorts - Shorts for Girls from Noh.Voh   SASSAFRAS Kids at Rs. 559. Style ID: 18002868,"Noh Voh   SASSAFRAS Kids Girls Blue Printed High Rise Denim Shorts,  Noh.Voh   SASSAFRAS Kids, Shorts, Bottomwear, Apparel, Apparel for Girls, Buy Noh Voh   SASSAFRAS Kids Girls Blue Printed High Rise Denim Shorts Online in India, Buy Shorts at best price"
lehenga-choli/bitiya-by-bhama/bitiya-by-bhama-girls-red--mustard-yellow-woven-design-gota-patti-ready-to-wear-lehenga-/15729104/buy,"['clothing', 'girls-clothing', 'lehenga-choli', 'bitiya-by-bhama-lehenga-choli']","PLOT NO-4, SMALL SCALE, CO-OP INDUSTRIAL ESTATE, G.T.KARNAL ROAD, DELHIDelhi , Delhi - 110033",Buy Bitiya By Bhama Girls Red & Mustard Yellow Woven Design Gota Patti Ready To Wear Lehenga - Lehenga Choli for Girls from Bitiya By Bhama at Rs. 1434. Style ID: 15729104,"Bitiya By Bhama Girls Red & Mustard Yellow Woven Design Gota Patti Ready To Wear Lehenga,  Bitiya By Bhama, Lehenga Choli, Topwear, Apparel, Apparel for Girls, Buy Bitiya By Bhama Girls Red & Mustard Yellow Woven Design Gota Patti Ready To Wear Lehenga Online in India, Buy Lehenga Choli at best price"
lipstick/c2p-professional-makeup/c2p-professional-makeup-mauve-lip-stain-liquid-lipstick---settin-the-stage-09-5-ml/17986798/buy,"['personal-care', 'women-personal-care', 'lipstick', 'c2p-professional-makeup-lipstick']","GROUND FLOOR, B-46/4,WAZIRPUR INDUSTRIAL AREADelhi , DELHI - 110052",Buy C2P PROFESSIONAL MAKEUP Mauve Lip Stain Liquid Lipstick   Settin' The Stage 09 5 Ml - Lipstick for Women from C2P PROFESSIONAL MAKEUP at Rs. 466. Style ID: 17986798,"C2P PROFESSIONAL MAKEUP Mauve Lip Stain Liquid Lipstick   Settin' The Stage 09 5 Ml,  C2P PROFESSIONAL MAKEUP, Lipstick, Lips, Personal Care, Personal Care for Women, Buy C2P PROFESSIONAL MAKEUP Mauve Lip Stain Liquid Lipstick   Settin' The Stage 09 5 Ml Online in India, Buy Lipstick at best price"
eyeshadow/makeup-revolution-london/makeup-revolution-london-reloaded-combo-iii-eyeshadow-palette/12157432/buy,"['personal-care', 'women-personal-care', 'eyeshadow', 'makeup-revolution-london-eyeshadow']","Second Floor, Plot No. 82, Okhla Industrial Estate, Phase - III, New Delhi, Delhi, 110020Delhi , Delhi - 110020",Buy Makeup Revolution London Reloaded Combo III Eyeshadow Palette - Eyeshadow for Women from Makeup Revolution London at Rs. 1050. Style ID: 12157432,"Makeup Revolution London Reloaded Combo III Eyeshadow Palette,  Makeup Revolution London, Eyeshadow, Makeup, Personal Care, Personal Care for Women, Buy Makeup Revolution London Reloaded Combo III Eyeshadow Palette Online in India, Buy Eyeshadow at best price"
sarees/all-about-you/all-about-you-pink-leheriya-organza-saree/16311694/buy,"['clothing', 'women-clothing', 'sarees', 'all-about-you-sarees']","1ST FLOOR, FLAT - 103,SAKAR TEXTILE MARKET,RING ROAD,Surat , Gujarat - 395002",Buy All About You Pink Leheriya Organza Saree - Sarees for Women from All About You at Rs. 1999. Style ID: 16311694,"All About You Pink Leheriya Organza Saree,  All About You, Sarees, Saree, Apparel, Apparel for Women, Buy All About You Pink Leheriya Organza Saree Online in India, Buy Sarees at best price"
tshirts/pluss/pluss-men-white--blue-striped-polo-collar-pockets-t-shirt/16936668/buy,"['clothing', 'men-clothing', 'tshirts', 'pluss-tshirts']","First and Second Floor, A 38/3, MAYAPURI INDUSTRIAL AREA-1,  New Delhi, West Delhi, Delhi, 110064New Delhi , Delhi - 110064",Buy PlusS Men White & Blue Striped Polo Collar Pockets T Shirt - Tshirts for Men from PlusS at Rs. 990. Style ID: 16936668,"PlusS Men White & Blue Striped Polo Collar Pockets T Shirt,  PlusS, Tshirts, Topwear, Apparel, Apparel for Men, Buy PlusS Men White & Blue Striped Polo Collar Pockets T Shirt Online in India, Buy Tshirts at best price"
dresses/lill/lill-women-off-white--black-printed-a-line-midi-dress/18322528/buy,"['clothing', 'women-clothing', 'dresses', 'lill-dresses']","X-59,FIRST AND SECOND FLOOR,  OKHLA INDUSTRIAL AREA, PHASE - II NEW DELHI 110020Delhi , Delhi - 110020",Buy LILL Women Off White & Black Printed A Line Midi Dress - Dresses for Women from LILL at Rs. 1224. Style ID: 18322528,"LILL Women Off White & Black Printed A Line Midi Dress,  LILL, Dresses, Dress, Apparel, Apparel for Women, Buy LILL Women Off White & Black Printed A Line Midi Dress Online in India, Buy Dresses at best price"
kurta-sets/laado---pamper-yourself/laado---pamper-yourself-burgundy--silver-striped-lurex-angrakha-kurta--afgan-salwar/16125742/buy,"['clothing', 'women-clothing', 'kurta-sets', 'laado-pamper-yourself-kurta-sets']","F-12/25Krishna NagarDelhi , Delhi - 110051",Buy Laado   Pamper Yourself Burgundy & Silver Striped Lurex Angrakha Kurta & Afgan Salwar - Kurta Sets for Women from Laado   Pamper Yourself at Rs. 1123. Style ID: 16125742,"Laado   Pamper Yourself Burgundy & Silver Striped Lurex Angrakha Kurta & Afgan Salwar,  Laado   Pamper Yourself, Kurta Sets, Apparel Set, Apparel, Apparel for Women, Buy Laado   Pamper Yourself Burgundy & Silver Striped Lurex Angrakha Kurta & Afgan Salwar Online in India, Buy Kurta Sets at best price"
dresses/sassafras/sassafras-black--red-floral-a-line-dress/16707808/buy,"['clothing', 'women-clothing', 'dresses', 'sassafras-dresses']","KH No. 37/19, 3rd FloorKapasheraDelhi , Delhi - 110037",Buy SASSAFRAS Black & Red Floral A Line Dress - Dresses for Women from SASSAFRAS at Rs. 804. Style ID: 16707808,"SASSAFRAS Black & Red Floral A Line Dress,  SASSAFRAS, Dresses, Dress, Apparel, Apparel for Women, Buy SASSAFRAS Black & Red Floral A Line Dress Online in India, Buy Dresses at best price"
jackets/hrx-by-hrithik-roshan/hrx-by-hrithik-roshan-football-men-optic-white-rapid-dry-colourblocked-jacket/14646422/buy,"['clothing', 'men-clothing', 'jackets', 'hrx-by-hrithik-roshan-jackets']","11th Floor, Flat No. 1106, 1107, 26, Kailash, Kasturba Gandhi Marg, New Delhi, New Delhi, Delhi, 110001Delhi , Delhi - 110001",Buy HRX By Hrithik Roshan Football Men Optic White Rapid Dry Colourblocked Jacket - Jackets for Men from HRX By Hrithik Roshan at Rs. 2999. Style ID: 14646422,"HRX By Hrithik Roshan Football Men Optic White Rapid Dry Colourblocked Jacket,  HRX By Hrithik Roshan, Jackets, Topwear, Apparel, Apparel for Men, Buy HRX By Hrithik Roshan Football Men Optic White Rapid Dry Colourblocked Jacket Online in India, Buy Jackets at best price"
formal-shoes/rapawalk/rapawalk-tan-handcrafted-standard-width-leather-derbys/7283116/buy,"['footwear', 'men-footwear', 'formal-shoes', 'rapawalk-formal-shoes']","21, Basement, Oxford Towers, Kodihalli, ,Bengaluru , Karnataka - 560008",Buy Rapawalk Tan Handcrafted Standard Width Leather Derbys - Formal Shoes for Men from RAPAWALK at Rs. 4425. Style ID: 7283116,"Rapawalk Tan Handcrafted Standard Width Leather Derbys,  RAPAWALK, Formal Shoes, Shoes, Footwear, Footwear for Men, Buy Rapawalk Tan Handcrafted Standard Width Leather Derbys Online in India, Buy Formal Shoes at best price"
shirts/jainish/jainish-men-blue-solid-regular-fit-casual-shirt/14404532/buy,"['clothing', 'men-clothing', 'shirts', 'jainish-shirts']","B-14 G.T karnal RoadIndustrial Area,Near AzadpurDelhi , Delhi - 110033",Buy JAINISH Men Blue Solid Regular Fit Casual Shirt - Shirts for Men from JAINISH at Rs. 545. Style ID: 14404532,"JAINISH Men Blue Solid Regular Fit Casual Shirt,  JAINISH, Shirts, Topwear, Apparel, Apparel for Men, Buy JAINISH Men Blue Solid Regular Fit Casual Shirt Online in India, Buy Shirts at best price"
earrings/kord-store/kord-store-silver-plated-oxidised-crescent-shaped-chandbalis/13475234/buy,"['accessories', 'women-accessories', 'earrings', 'kord-store-earrings']","1st floor, Kapadia Niwas,Nadiadwala Colony No. 1, S.V. Road, Malad WestMumbai , Maharashtra - 400064",Buy Kord Store Silver Plated Oxidised Crescent Shaped Chandbalis - Earrings for Women from Kord Store at Rs. 249. Style ID: 13475234,"Kord Store Silver Plated Oxidised Crescent Shaped Chandbalis,  Kord Store, Earrings, Jewellery, Accessories, Accessories for Women, Buy Kord Store Silver Plated Oxidised Crescent Shaped Chandbalis Online in India, Buy Earrings at best price"
dresses/jc-collection/jc-collection-off-white-floral-midi-dress/18228694/buy,"['clothing', 'women-clothing', 'dresses', 'jc-collection-dresses']","Second Floor, Plot No. 82, Okhla Industrial Estate, Phase - III, New Delhi, Delhi, 110020Delhi , Delhi - 110020",Buy JC Collection Off White Floral Midi Dress - Dresses for Women from JC Collection at Rs. 4639. Style ID: 18228694,"JC Collection Off White Floral Midi Dress,  JC Collection, Dresses, Dress, Apparel, Apparel for Women, Buy JC Collection Off White Floral Midi Dress Online in India, Buy Dresses at best price"
tops/vero-moda-curve/vero-moda-curve-black-floral-print-top/18152344/buy,"['clothing', 'women-clothing', 'tops', 'vero-moda-curve-tops']","4th floor, The Lalit Residency, The Lalit Mumbai, Sahar Airport Road, Andheri east, Mumbai Suburban, Maharashtra, 400059Mumbai , Maharashtra - 400059",Buy VERO MODA CURVE Black & White Printed Top - Tops for Women from VERO MODA CURVE at Rs. 2639. Style ID: 18152344,"VERO MODA CURVE Black & White Printed Top,  VERO MODA CURVE, Tops, Topwear, Apparel, Apparel for Women, Buy VERO MODA CURVE Black & White Printed Top Online in India, Buy Tops at best price"
lipstick/mamaearth/mamaearth-naturally-matte-lip-serum---matte-liquid-lipstick-with-vitamin-c---chirpy-cherry/16631904/buy,"['personal-care', 'women-personal-care', 'lipstick', 'mamaearth-lipstick']","Plot No 63, 4th Floor, BLM TOWERS,GALI NO. 7SECTOR-44, Gurgaon, Gurgaon, Haryana,Gurugram , Haryana - 122003",Buy Mamaearth Naturally Matte Lip Serum   Matte Liquid Lipstick With Vitamin C   Chirpy Cherry - Lipstick for Women from Mamaearth at Rs. 551. Style ID: 16631904,"Mamaearth Naturally Matte Lip Serum   Matte Liquid Lipstick With Vitamin C   Chirpy Cherry,  Mamaearth, Lipstick, Lips, Personal Care, Personal Care for Women, Buy Mamaearth Naturally Matte Lip Serum   Matte Liquid Lipstick With Vitamin C   Chirpy Cherry Online in India, Buy Lipstick at best price"
tshirts/peter-england/peter-england-men-green-brand-logo-printed-t-shirt/17256066/buy,"['clothing', 'men-clothing', 'tshirts', 'peter-england-tshirts']","Ground Floor, No 65/64, old No 65, 6th Block, Ward No 21, 2ndMain Road,Bengaluru , Karnataka - 560044",Buy Peter England Men Green Brand Logo Printed T Shirt - Tshirts for Men from Peter England at Rs. 489. Style ID: 17256066,"Peter England Men Green Brand Logo Printed T Shirt,  Peter England, Tshirts, Topwear, Apparel, Apparel for Men, Buy Peter England Men Green Brand Logo Printed T Shirt Online in India, Buy Tshirts at best price"
jackets/blue-giraffe/blue-giraffe-boys-olive-green-bomber-jacket/16227528/buy,"['clothing', 'boys-clothing', 'jackets', 'blue-giraffe-jackets']","Iconic Fashion Retailing Pvt Ltd C/o Holisol Pvt Ltd. 24//23/2/2, 24/2, 24/3, 25/2/1, 34//3/3, 4, 5/1, 26, GKP WAREHOUSE GREEN COLOR, FATEHPUR JAURASI ROAD, VILLAGE-JAURASI, Mewat, Haryana, 122105Bhiwadi , HARYANA - 122105",Buy Blue Giraffe Boys Olive Green Bomber Jacket - Jackets for Boys from Blue Giraffe at Rs. 2399. Style ID: 16227528,"Blue Giraffe Boys Olive Green Bomber Jacket,  Blue Giraffe, Jackets, Topwear, Apparel, Apparel for Boys, Buy Blue Giraffe Boys Olive Green Bomber Jacket Online in India, Buy Jackets at best price"
dresses/nynsh--pluss-kids/nynsh--pluss-kids-girls-blue-solid-shirt-dress/17586304/buy,"['clothing', 'girls-clothing', 'dresses', 'nynsh-pluss-kids-dresses']","First and Second Floor, A 38/3, MAYAPURI INDUSTRIAL AREA-1,  New Delhi, West Delhi, Delhi, 110064New Delhi , Delhi - 110064",Buy NYNSH  PlusS Kids Girls Blue Solid Shirt Dress - Dresses for Girls from NYNSH  PlusS Kids at Rs. 693. Style ID: 17586304,"NYNSH  PlusS Kids Girls Blue Solid Shirt Dress,  NYNSH  PlusS Kids, Dresses, Dress, Apparel, Apparel for Girls, Buy NYNSH  PlusS Kids Girls Blue Solid Shirt Dress Online in India, Buy Dresses at best price"
shirts/louis-philippe-sport/louis-philippe-sport-men-olive-green-textured-slim-fit-opaque-casual-shirt/15203428/buy,"['clothing', 'men-clothing', 'shirts', 'louis-philippe-sport-shirts']","5A/19,Ground Floor ( Front Portion),Ansari Raod,DaryaganjDelhi , Delhi - 110002",Buy Louis Philippe Sport Men Olive Green Textured Slim Fit Opaque Casual Shirt - Shirts for Men from Louis Philippe Sport at Rs. 1396. Style ID: 15203428,"Louis Philippe Sport Men Olive Green Textured Slim Fit Opaque Casual Shirt,  Louis Philippe Sport, Shirts, Topwear, Apparel, Apparel for Men, Buy Louis Philippe Sport Men Olive Green Textured Slim Fit Opaque Casual Shirt Online in India, Buy Shirts at best price"
toiletry-kit/fabseasons/fabseasons-men-blue-solid-leather-toiletry-kit/13173690/buy,"['personal-care', 'men-personal-care', 'toiletry-kit', 'fabseasons-toiletry-kit']","30, Parathasarathy Bridge Road,Old washermenpetChennai , Tamilnadu - 600021",Buy FabSeasons Men Blue Solid Leather Toiletry Kit - Toiletry Kit for Men from FabSeasons at Rs. 349. Style ID: 13173690,"FabSeasons Men Blue Solid Leather Toiletry Kit,  FabSeasons, Toiletry Kit, Bath And Body, Personal Care, Personal Care for Men, Buy FabSeasons Men Blue Solid Leather Toiletry Kit Online in India, Buy Toiletry Kit at best price"
kurta-sets/all-about-you/all-about-you-women-black--pink-regular-round-neck-kurta-with-palazzos/14381540/buy,"['clothing', 'women-clothing', 'kurta-sets', 'all-about-you-kurta-sets']","5th Floor, Office No 504, Punj Essen House, 17-18, Nehru PlaceDelhi , Delhi - 110019",Buy All About You Women Black & Pink Regular Round Neck Kurta With Palazzos - Kurta Sets for Women from All About You at Rs. 749. Style ID: 14381540,"All About You Women Black & Pink Regular Round Neck Kurta With Palazzos,  All About You, Kurta Sets, Apparel Set, Apparel, Apparel for Women, Buy All About You Women Black & Pink Regular Round Neck Kurta With Palazzos Online in India, Buy Kurta Sets at best price"
kurtas/anouk/anouk-women-mustard-yellow--off-white-bandhani-printed-flared-sleeves-quirky-kurta/16271220/buy,"['clothing', 'women-clothing', 'kurtas', 'anouk-kurtas']","Cabin No. 6, Property 2, Gujarat Vihar, Vikas Marg, New Delhi, Delhi, 110092Delhi , Delhi - 110092",Buy Anouk Women Mustard Yellow & Off White Bandhani Printed Flared Sleeves Quirky Kurta - Kurtas for Women from Anouk at Rs. 944. Style ID: 16271220,"Anouk Women Mustard Yellow & Off White Bandhani Printed Flared Sleeves Quirky Kurta,  Anouk, Kurtas, Topwear, Apparel, Apparel for Women, Buy Anouk Women Mustard Yellow & Off White Bandhani Printed Flared Sleeves Quirky Kurta Online in India, Buy Kurtas at best price"
tshirts/uth-by-roadster/uth-by-roadster-boys-blue-colourblocked-hooded-pure-cotton-t-shirt/17279296/buy,"['clothing', 'boys-clothing', 'tshirts', 'uth-by-roadster-tshirts']","Second Floor, Plot No. 82, Okhla Industrial Estate, Phase - III, New Delhi, Delhi, 110020Delhi , Delhi - 110020",Buy UTH By Roadster Boys Blue Colourblocked Hooded Pure Cotton T Shirt - Tshirts for Boys from UTH By Roadster at Rs. 314. Style ID: 17279296,"UTH By Roadster Boys Blue Colourblocked Hooded Pure Cotton T Shirt,  UTH By Roadster, Tshirts, Topwear, Apparel, Apparel for Boys, Buy UTH By Roadster Boys Blue Colourblocked Hooded Pure Cotton T Shirt Online in India, Buy Tshirts at best price"
dresses/aawari/aawari-brown-a-line-mini-dress/18099836/buy,"['clothing', 'women-clothing', 'dresses', 'aawari-dresses']","18 Mall road shankar colony opp. mother memorial school naya kh Vidhyadhar nagar Jaipur Rajasthan 302039Jaipur , Rajasthan - 302039",Buy Aawari Brown A Line Mini Dress - Dresses for Women from Aawari at Rs. 525. Style ID: 18099836,"Aawari Brown A Line Mini Dress,  Aawari, Dresses, Dress, Apparel, Apparel for Women, Buy Aawari Brown A Line Mini Dress Online in India, Buy Dresses at best price"
facial-kit/aryanveda/-aryanveda-diamond-spa-facial-210gm/18589392/buy,"['personal-care', 'unisex-personal-care', 'facial-kit', 'aryanveda-facial-kit']",,Buy Aryanveda Diamond Spa Facial 210gm - Facial Kit for Unisex from Aryanveda at Rs. 511. Style ID: 18589392,"Aryanveda Diamond Spa Facial 210gm,  Aryanveda, Facial Kit, Skin Care, Personal Care, Personal Care for Unisex, Buy Aryanveda Diamond Spa Facial 210gm Online in India, Buy Facial Kit at best price"
heels/mochi/mochi-grey-striped-block-pumps/18707304/buy,"['footwear', 'women-footwear', 'heels', 'mochi-heels']","Metro Brands Limited,Building no.B-3 Gala No.3,Bhagwan Sheth Estate,purna Village,Taluka Bhiwandi, Dist-ThaneBhiwandi , Maharashtra - 421302",Buy Mochi Grey Striped Block Pumps - Heels for Women from Mochi at Rs. 1990. Style ID: 18707304,"Mochi Grey Striped Block Pumps,  Mochi, Heels, Shoes, Footwear, Footwear for Women, Buy Mochi Grey Striped Block Pumps Online in India, Buy Heels at best price"
handbags/safyr/safyr-white-half-moon-shoulder-bag/17998504/buy,"['accessories', 'women-accessories', 'handbags', 'safyr-handbags']","Ground Floor, Kh No-68/23, Old No-11, Newno-RZ-11-ANew Colony, Gali No-6, Raj Nagar, Palam ColonyDelhi , DELHI - 110045",Buy SAFYR White Half Moon Shoulder Bag - Handbags for Women from SAFYR at Rs. 4500. Style ID: 17998504,"SAFYR White Half Moon Shoulder Bag,  SAFYR, Handbags, Bags, Accessories, Accessories for Women, Buy SAFYR White Half Moon Shoulder Bag Online in India, Buy Handbags at best price"
body-lotion/nivea/nivea-set-of-2-shea-smooth-milk-body-lotions/10340613/buy,"['personal-care', 'unisex-personal-care', 'body-lotion', 'nivea-body-lotion']","Awfis, 7th floor, HM Vibha Tower, 25 Laskar Hosur Road, Adugodi, Bengalore 560029Bengaluru , Karnataka - 560029",Buy Nivea Set Of 2 Shea Smooth Milk Body Lotions - Body Lotion for Unisex from Nivea at Rs. 453. Style ID: 10340613,"Nivea Set Of 2 Shea Smooth Milk Body Lotions,  Nivea, Body Lotion, Bath And Body, Personal Care, Personal Care for Unisex, Buy Nivea Set Of 2 Shea Smooth Milk Body Lotions Online in India, Buy Body Lotion at best price"
sarees/anouk/anouk-pink-embellished-organza-saree/16846706/buy,"['clothing', 'women-clothing', 'sarees', 'anouk-sarees']",,Buy Anouk Pink Embellished Organza Saree - Sarees for Women from Anouk at Rs. 4999. Style ID: 16846706,"Anouk Pink Embellished Organza Saree,  Anouk, Sarees, Saree, Apparel, Apparel for Women, Buy Anouk Pink Embellished Organza Saree Online in India, Buy Sarees at best price"
briefs/bodycare/bodycare-pack-of-6-assorted-solid-hipster-briefs-e26c-6pcs/8637495/buy,"['clothing', 'women-clothing', 'briefs', 'bodycare-briefs']","D-30, SECTOR 63, NOIDA - 201301Noida , Uttar pradesh - 201301",Buy BODYCARE Pack Of 6 Assorted Solid Hipster Briefs E26C 6PCS - Briefs for Women from Bodycare at Rs. 600. Style ID: 8637495,"BODYCARE Pack Of 6 Assorted Solid Hipster Briefs E26C 6PCS,  Bodycare, Briefs, Innerwear, Apparel, Apparel for Women, Buy BODYCARE Pack Of 6 Assorted Solid Hipster Briefs E26C 6PCS Online in India, Buy Briefs at best price"
tshirts/allen-solly/allen-solly-men-blue-printed-polo-collar-pure-cotton-t-shirt/17730492/buy,"['clothing', 'men-clothing', 'tshirts', 'allen-solly-tshirts']","Ground Floor, No 65/64, old No 65, 6th Block, Ward No 21, 2ndMain Road,Bengaluru , Karnataka - 560044",Buy Allen Solly Men Blue Printed Polo Collar Pure Cotton T Shirt - Tshirts for Men from Allen Solly at Rs. 1579. Style ID: 17730492,"Allen Solly Men Blue Printed Polo Collar Pure Cotton T Shirt,  Allen Solly, Tshirts, Topwear, Apparel, Apparel for Men, Buy Allen Solly Men Blue Printed Polo Collar Pure Cotton T Shirt Online in India, Buy Tshirts at best price"
sweatshirts/only/only-women-red-cotton-sweatshirt/16349510/buy,"['clothing', 'women-clothing', 'sweatshirts', 'only-sweatshirts']","5th Floor, The Lalit Residency, The Lalit Mumbai, Sahar Airport Road, Andheri East, Mumbai Suburban, Maharashtra, 400059Mumbai , Maharashtra - 400059",Buy ONLY Women Red Cotton Sweatshirt - Sweatshirts for Women from ONLY at Rs. 999. Style ID: 16349510,"ONLY Women Red Cotton Sweatshirt,  ONLY, Sweatshirts, Topwear, Apparel, Apparel for Women, Buy ONLY Women Red Cotton Sweatshirt Online in India, Buy Sweatshirts at best price"
kurta-sets/inweave/inweave-women-pink-pure-cotton-print-parade-kurta-set/17563952/buy,"['clothing', 'women-clothing', 'kurta-sets', 'inweave-kurta-sets']","1001, Tower 14, Orchid PetalsSector 49, Sohna RoadGurugram , Haryana - 122015",Buy InWeave Women Pink Pure Cotton Print Parade Kurta Set - Kurta Sets for Women from InWeave at Rs. 1695. Style ID: 17563952,"InWeave Women Pink Pure Cotton Print Parade Kurta Set,  InWeave, Kurta Sets, Apparel Set, Apparel, Apparel for Women, Buy InWeave Women Pink Pure Cotton Print Parade Kurta Set Online in India, Buy Kurta Sets at best price"
kitchen-storage/nestroots/nestroots-blue-enamel-floral-printed-mango-wood-masala-box-or-spice-jar-container/14119108/buy,"['home-furnishing', 'unisex-home-furnishing', 'kitchen-storage', 'nestroots-kitchen-storage']","179 Ground floor, UDYOG VIHAR PH-1, GURGAON, Gurgaon, Haryana, Delhi , Delhi - 122016",Buy Nestroots Blue Enamel Floral Printed Mango Wood Masala Box Or Spice Jar Container - Kitchen Storage for Unisex from Nestroots at Rs. 2562. Style ID: 14119108,"Nestroots Blue Enamel Floral Printed Mango Wood Masala Box Or Spice Jar Container,  Nestroots, Kitchen Storage, Kitchen And Dining, Home, Home for Unisex, Buy Nestroots Blue Enamel Floral Printed Mango Wood Masala Box Or Spice Jar Container Online in India, Buy Kitchen Storage at best price"
sofa-covers/house-of-quirk/house-of-quirk-blue--white-printed-3-seater-stretchable-non-slip-sofa-slipcover/16105720/buy,"['home-furnishing', 'unisex-home-furnishing', 'sofa-covers', 'house-of-quirk-sofa-covers']","Plot of Khasra No.1016 Extended Lal Dora Village Mundka New Delhi - 110041Delhi , Delhi - 110041",Buy HOUSE OF QUIRK Blue & White Printed 3 Seater Stretchable Non Slip Sofa Slipcover - Sofa Covers for Unisex from HOUSE OF QUIRK at Rs. 2309. Style ID: 16105720,"HOUSE OF QUIRK Blue & White Printed 3 Seater Stretchable Non Slip Sofa Slipcover,  HOUSE OF QUIRK, Sofa Covers, Home Furnishing, Home, Home for Unisex, Buy HOUSE OF QUIRK Blue & White Printed 3 Seater Stretchable Non Slip Sofa Slipcover Online in India, Buy Sofa Covers at best price"
night-suits/nap-chief/nap-chief-unisex-kids-red-iron-man-printed-night-suits/18243684/buy,"['clothing', 'unisex-kids-clothing', 'night-suits', 'nap-chief-night-suits']","89 Shringar Nagar, 5th Street Bharathicolony, PeelameduCoimbatore , Tamil Nadu - 641004",Buy Nap Chief Kids Red & Black Iron Man Printed Cotton Night Suits - Night Suits for Unisex Kids from Nap Chief at Rs. 795. Style ID: 18243684,"Nap Chief Kids Red & Black Iron Man Printed Cotton Night Suits,  Nap Chief, Night Suits, Loungewear And Nightwear, Apparel, Apparel for Unisex Kids, Buy Nap Chief Kids Red & Black Iron Man Printed Cotton Night Suits Online in India, Buy Night Suits at best price"
tshirts/pluss/pluss-women-green--pink-printed-t-shirt/15009434/buy,"['clothing', 'women-clothing', 'tshirts', 'pluss-tshirts']","First and Second Floor, A 38/3, MAYAPURI INDUSTRIAL AREA-1,  New Delhi, West Delhi, Delhi, 110064New Delhi , Delhi - 110064",Buy PlusS Women Green & Pink Printed T Shirt - Tshirts for Women from PlusS at Rs. 600. Style ID: 15009434,"PlusS Women Green & Pink Printed T Shirt,  PlusS, Tshirts, Topwear, Apparel, Apparel for Women, Buy PlusS Women Green & Pink Printed T Shirt Online in India, Buy Tshirts at best price"
tops/tokyo-talkies/tokyo-talkies-teal-knitted-top/16612390/buy,"['clothing', 'women-clothing', 'tops', 'tokyo-talkies-tops']","5th Floor, Office No 504, Punj Essen House, 17-18, Nehru PlaceDelhi , Delhi - 110019",Buy Tokyo Talkies Teal Knitted Top - Tops for Women from Tokyo Talkies at Rs. 599. Style ID: 16612390,"Tokyo Talkies Teal Knitted Top,  Tokyo Talkies, Tops, Topwear, Apparel, Apparel for Women, Buy Tokyo Talkies Teal Knitted Top Online in India, Buy Tops at best price"
