prod_link,tags,seller_address,meta_description,meta_keyword
shirts/van-heusen-sport/van-heusen-sport-men-white-solid-slim-fit-pure-cotton-casual-shirt/18139868/buy,"['clothing', 'men-clothing', 'shirts', 'van-heusen-sport-shirts']",,Buy Van Heusen Sport Men White Solid Slim Fit Pure Cotton Casual Shirt - Shirts for Men from Van Heusen Sport at Rs. 2199. Style ID: 18139868,"Van Heusen Sport Men White Solid Slim Fit Pure Cotton Casual Shirt,  Van Heusen Sport, Shirts, Topwear, Apparel, Apparel for Men, Buy Van Heusen Sport Men White Solid Slim Fit Pure Cotton Casual Shirt Online in India, Buy Shirts at best price"
jeggings/clora-creation/clora-creation-women-black-solid-treggings/12329602/buy,"['clothing', 'women-clothing', 'jeggings', 'clora-creation-jeggings']","C-170, BasementDayanand Colony, Lajpat Nagar - 4Delhi , Delhi - 110024",Buy Clora Creation Women Black Solid Treggings - Jeggings for Women from Clora Creation at Rs. 1139. Style ID: 12329602,"Clora Creation Women Black Solid Treggings,  Clora Creation, Jeggings, Bottomwear, Apparel, Apparel for Women, Buy Clora Creation Women Black Solid Treggings Online in India, Buy Jeggings at best price"
jeggings/herenow/herenow-women-light-blue-mid-rise-clean-look-jeans/16878076/buy,"['clothing', 'women-clothing', 'jeggings', 'here-and-now-jeggings']","11th Floor, Flat No. 1106, 1107, 26, Kailash, Kasturba Gandhi Marg, New Delhi, New Delhi, Delhi, 110001Delhi , Delhi - 110001",Buy HERE&NOW Women Light Blue Mid Rise Clean Look Jeans - Jeggings for Women from HERE&NOW at Rs. 389. Style ID: 16878076,"HERE&NOW Women Light Blue Mid Rise Clean Look Jeans,  HERE&NOW, Jeggings, Bottomwear, Apparel, Apparel for Women, Buy HERE&NOW Women Light Blue Mid Rise Clean Look Jeans Online in India, Buy Jeggings at best price"
cushion-covers/i-am-for-you/i-am-for-you-beige--red-set-of-3-ethnic-motifs-square-pure-cotton-cushion-covers/15578920/buy,"['home-furnishing', 'unisex-home-furnishing', 'cushion-covers', 'i-am-for-you-cushion-covers']","A-10, Hosiery Complex Phase-II,Gautam Buddha Nagar Noida 201305, UPNoida , Uttar pradesh - 201301",Buy I AM FOR YOU Beige & Red Set Of 3 Ethnic Motifs Square Pure Cotton Cushion Covers - Cushion Covers for Unisex from I AM FOR YOU at Rs. 569. Style ID: 15578920,"I AM FOR YOU Beige & Red Set Of 3 Ethnic Motifs Square Pure Cotton Cushion Covers,  I AM FOR YOU, Cushion Covers, Home Furnishing, Home, Home for Unisex, Buy I AM FOR YOU Beige & Red Set Of 3 Ethnic Motifs Square Pure Cotton Cushion Covers Online in India, Buy Cushion Covers at best price"
watches/fossil/fossil-men-grey-factory-serviced-analogue-watch-fs5521i/9036637/buy,"['accessories', 'men-accessories', 'watches', 'fossil-watches']","621, 12th Main, HAL 2nd Stage,IndiranagarBengaluru , Karnataka - 560008",Buy Fossil Men Grey Factory Serviced Analogue Watch FS5521I - Watches for Men from Fossil at Rs. 11995. Style ID: 9036637,"Fossil Men Grey Factory Serviced Analogue Watch FS5521I,  Fossil, Watches, Watches, Accessories, Accessories for Men, Buy Fossil Men Grey Factory Serviced Analogue Watch FS5521I Online in India, Buy Watches at best price"
watches/casio/casio-women-rose-gold-toned-embellished-dial--stainless-steel-bracelet-style-straps-watch/17935910/buy,"['accessories', 'women-accessories', 'watches', 'casio-watches']","Unit No.9A, First Floor CSC-5, Sector-9, RohiniNew Delhi , Delhi - 110085",Buy CASIO Women Rose Gold Toned Embellished Dial & Stainless Steel Bracelet Style Straps Watch - Watches for Women from CASIO at Rs. 9895. Style ID: 17935910,"CASIO Women Rose Gold Toned Embellished Dial & Stainless Steel Bracelet Style Straps Watch,  CASIO, Watches, Watches, Accessories, Accessories for Women, Buy CASIO Women Rose Gold Toned Embellished Dial & Stainless Steel Bracelet Style Straps Watch Online in India, Buy Watches at best price"
formal-shoes/louis-philippe/louis-philippe-men-brown-solid-leather-formal-oxfords-with-textured-detail/17238978/buy,"['footwear', 'men-footwear', 'formal-shoes', 'louis-philippe-formal-shoes']","Ground Floor, No 65/64, old No 65, 6th Block, Ward No 21, 2ndMain Road,Bengaluru , Karnataka - 560044",Buy Louis Philippe Men Brown Solid Leather Formal Oxfords With Textured Detail - Formal Shoes for Men from Louis Philippe at Rs. 5599. Style ID: 17238978,"Louis Philippe Men Brown Solid Leather Formal Oxfords With Textured Detail,  Louis Philippe, Formal Shoes, Shoes, Footwear, Footwear for Men, Buy Louis Philippe Men Brown Solid Leather Formal Oxfords With Textured Detail Online in India, Buy Formal Shoes at best price"
casual-shoes/roadster/roadster-women-white-solid-mid-top-sneakers/14914602/buy,"['footwear', 'women-footwear', 'casual-shoes', 'roadster-casual-shoes']","406, B2 and C, 4th Floor,Centrum Plaza, Golf Course Road, Sector - 53,Gurugram , Haryana - 122102",Buy Roadster Women White Solid Mid Top Sneakers - Casual Shoes for Women from Roadster at Rs. 1079. Style ID: 14914602,"Roadster Women White Solid Mid Top Sneakers,  Roadster, Casual Shoes, Shoes, Footwear, Footwear for Women, Buy Roadster Women White Solid Mid Top Sneakers Online in India, Buy Casual Shoes at best price"
flats/footons/footons-women-black-open-toe-flats/17425154/buy,"['footwear', 'women-footwear', 'flats', 'footons-flats']","Plot No 44, Sector 6,IMT ManesarGurugram , Haryana - 122050",Buy FOOTONS Women Black Open Toe Flats - Flats for Women from FOOTONS at Rs. 999. Style ID: 17425154,"FOOTONS Women Black Open Toe Flats,  FOOTONS, Flats, Shoes, Footwear, Footwear for Women, Buy FOOTONS Women Black Open Toe Flats Online in India, Buy Flats at best price"
shorts/hm/-hm-women-orange-ribbed-jersey-shorts/17185492/buy,"['clothing', 'women-clothing', 'shorts', 'h-and-m-shorts']","Prakhhyat Infraprojects PVT. LTD., BUILDING 6, K-Square Logistics Park C/O LF LogisticsNear Padgha Toll Naka on MUMBAI-NASIKThane , Maharashtra - 421101",Buy H&M Women Orange Ribbed Jersey Shorts - Shorts for Women from H&M at Rs. 799. Style ID: 17185492,"H&M Women Orange Ribbed Jersey Shorts,  H&M, Shorts, Bottomwear, Apparel, Apparel for Women, Buy H&M Women Orange Ribbed Jersey Shorts Online in India, Buy Shorts at best price"
shirts/highlander/highlander-men-white-slim-fit-casual-shirt/16532698/buy,"['clothing', 'men-clothing', 'shirts', 'highlander-shirts']","10, Cabin No 17, PVR Plaza Building, H Block, Connaught CircusDelhi , Delhi - 110001",Buy HIGHLANDER Men White Slim Fit Casual Shirt - Shirts for Men from HIGHLANDER at Rs. 505. Style ID: 16532698,"HIGHLANDER Men White Slim Fit Casual Shirt,  HIGHLANDER, Shirts, Topwear, Apparel, Apparel for Men, Buy HIGHLANDER Men White Slim Fit Casual Shirt Online in India, Buy Shirts at best price"
bra/zivame/zivame-blue-underwired-lightly-padded-bra/18157152/buy,"['clothing', 'women-clothing', 'bra', 'zivame-bra']",,Buy Zivame Blue Underwired Lightly Padded Bra - Bra for Women from Zivame at Rs. 796. Style ID: 18157152,"Zivame Blue Underwired Lightly Padded Bra,  Zivame, Bra, Innerwear, Apparel, Apparel for Women, Buy Zivame Blue Underwired Lightly Padded Bra Online in India, Buy Bra at best price"
blazers/louis-philippe-sport/louis-philippe-sport-men-grey--white-regular-fit-self-design-formal-blazer/14115512/buy,"['clothing', 'men-clothing', 'blazers', 'louis-philippe-sport-blazers']","5A/19,Ground Floor ( Front Portion),Ansari Raod,DaryaganjDelhi , Delhi - 110002",Buy Louis Philippe Sport Men Grey & White Regular Fit Self Design Formal Blazer - Blazers for Men from Louis Philippe Sport at Rs. 5999. Style ID: 14115512,"Louis Philippe Sport Men Grey & White Regular Fit Self Design Formal Blazer,  Louis Philippe Sport, Blazers, Topwear, Apparel, Apparel for Men, Buy Louis Philippe Sport Men Grey & White Regular Fit Self Design Formal Blazer Online in India, Buy Blazers at best price"
night-suits/rosaline-by-zivame/rosaline-by-zivame-women-yellow--white-printed-night-suit/17786486/buy,"['clothing', 'women-clothing', 'night-suits', 'rosaline-by-zivame-night-suits']","MILA STAR RETAIL PRIVATE LIMITED3rd FLOOR, 2726, Sri Lakshminarayana Nivas, 80 Feet Road, Indiranagar, HAL 3rd stage,Bengaluru , Karnataka - 560075",Buy Rosaline By Zivame Women Yellow & White Printed Night Suit - Night Suits for Women from Rosaline By Zivame at Rs. 539. Style ID: 17786486,"Rosaline By Zivame Women Yellow & White Printed Night Suit,  Rosaline By Zivame, Night Suits, Loungewear And Nightwear, Apparel, Apparel for Women, Buy Rosaline By Zivame Women Yellow & White Printed Night Suit Online in India, Buy Night Suits at best price"
sweaters/mango/mango-women-white-floral-knit-pullover/16608852/buy,"['clothing', 'women-clothing', 'sweaters', 'mango-sweaters']","Unit 406 B2 & C, 4th Floor, Centrum Plaza, Golf Course Road, Gurgaon-122013Gurugram , Haryana - 122102",Buy MANGO Women White Floral Knit Pullover - Sweaters for Women from MANGO at Rs. 3913. Style ID: 16608852,"MANGO Women White Floral Knit Pullover,  MANGO, Sweaters, Topwear, Apparel, Apparel for Women, Buy MANGO Women White Floral Knit Pullover Online in India, Buy Sweaters at best price"
kurta-sets/anubhutee/anubhutee-women-pink-ethnic-motifs-embroidered-kurta-with-trousers--with-dupatta/18036618/buy,"['clothing', 'women-clothing', 'kurta-sets', 'anubhutee-kurta-sets']","2nd Floor, NO. 39, NGEF Lane, Indiranagar First StageBangaloreBengaluru , Karnataka - 560038",Buy Anubhutee Women Pink Ethnic Motifs Embroidered Kurta With Trousers & With Dupatta - Kurta Sets for Women from Anubhutee at Rs. 1839. Style ID: 18036618,"Anubhutee Women Pink Ethnic Motifs Embroidered Kurta With Trousers & With Dupatta,  Anubhutee, Kurta Sets, Apparel Set, Apparel, Apparel for Women, Buy Anubhutee Women Pink Ethnic Motifs Embroidered Kurta With Trousers & With Dupatta Online in India, Buy Kurta Sets at best price"
jeans/kassually/kassually-women-blue-wide-leg-mid-rise-low-distress-jeans/12335162/buy,"['clothing', 'women-clothing', 'jeans', 'kassually-jeans']","GROUND FLOOR, 154, Udyog ViharPhase-1, GURGAONGurugram , Haryana - 122016",Buy KASSUALLY Women Blue Wide Leg Mid Rise Low Distress Jeans - Jeans for Women from KASSUALLY at Rs. 892. Style ID: 12335162,"KASSUALLY Women Blue Wide Leg Mid Rise Low Distress Jeans,  KASSUALLY, Jeans, Bottomwear, Apparel, Apparel for Women, Buy KASSUALLY Women Blue Wide Leg Mid Rise Low Distress Jeans Online in India, Buy Jeans at best price"
tshirts/roadster/the-roadster-lifestyle-co-women-green--white-typography-printed-drop-shoulder-sleeves-pure-cotton--t-shirt/16961598/buy,"['clothing', 'women-clothing', 'tshirts', 'roadster-tshirts']","406, B2 and C, 4th Floor,Centrum Plaza, Golf Course Road, Sector - 53,Gurugram , Haryana - 122102",Buy The Roadster Lifestyle Co Women Green & White Typography Printed Drop Shoulder Sleeves Pure Cotton  T Shirt - Tshirts for Women from Roadster at Rs. 404. Style ID: 16961598,"The Roadster Lifestyle Co Women Green & White Typography Printed Drop Shoulder Sleeves Pure Cotton  T Shirt,  Roadster, Tshirts, Topwear, Apparel, Apparel for Women, Buy The Roadster Lifestyle Co Women Green & White Typography Printed Drop Shoulder Sleeves Pure Cotton  T Shirt Online in India, Buy Tshirts at best price"
jackets/roadster/roadster-men-black--rust-colourblocked-tailored-jacket/14991644/buy,"['clothing', 'men-clothing', 'jackets', 'roadster-jackets']",,Buy Roadster Men Black & Rust Colourblocked Tailored Jacket - Jackets for Men from Roadster at Rs. 999. Style ID: 14991644,"Roadster Men Black & Rust Colourblocked Tailored Jacket,  Roadster, Jackets, Topwear, Apparel, Apparel for Men, Buy Roadster Men Black & Rust Colourblocked Tailored Jacket Online in India, Buy Jackets at best price"
flip-flops/power/power-men-coffee-brown-solid-thong-flip-flops/12453834/buy,"['footwear', 'men-footwear', 'flip-flops', 'power-flip-flops']","BATA INDIA LTDGurugram , Haryana - 122504",Buy Power Men Coffee Brown Solid Thong Flip Flops - Flip Flops for Men from Power at Rs. 719. Style ID: 12453834,"Power Men Coffee Brown Solid Thong Flip Flops, Power, Flip Flops, Flip Flops, Footwear, Footwear for Men, Buy Power Men Coffee Brown Solid Thong Flip Flops Online in India, Buy Flip Flops at best price"
trousers/louis-philippe-sport/louis-philippe-sport-men-blue-solid-slim-fit-low-rise-trousers/17578340/buy,"['clothing', 'men-clothing', 'trousers', 'louis-philippe-sport-trousers']","5A/19,Ground Floor ( Front Portion),Ansari Raod,DaryaganjDelhi , Delhi - 110002",Buy Louis Philippe Sport Men Blue Solid Slim Fit Low Rise Trousers - Trousers for Men from Louis Philippe Sport at Rs. 2789. Style ID: 17578340,"Louis Philippe Sport Men Blue Solid Slim Fit Low Rise Trousers,  Louis Philippe Sport, Trousers, Bottomwear, Apparel, Apparel for Men, Buy Louis Philippe Sport Men Blue Solid Slim Fit Low Rise Trousers Online in India, Buy Trousers at best price"
wallets/baggit/baggit-men-black-textured-three-fold-wallet/18229624/buy,"['accessories', 'men-accessories', 'wallets', 'baggit-wallets']","204/218Narayan Udyog BhavanLalbaughMumbai , Maharashtra - 400012",Buy Baggit Men Black Textured Three Fold Wallet - Wallets for Men from Baggit at Rs. 790. Style ID: 18229624,"Baggit Men Black Textured Three Fold Wallet,  Baggit, Wallets, Wallets, Accessories, Accessories for Men, Buy Baggit Men Black Textured Three Fold Wallet Online in India, Buy Wallets at best price"
blazers/blackberrys/-blackberrys-men-red-solid-cotton-super-slim-fit-blazer/18026314/buy,"['clothing', 'men-clothing', 'blazers', 'blackberrys-blazers']","C/o M/s Glaucus Supply Chain Solutions Pvt.Ltd Khasara No.193//2,6/2,78,9,14,15Near by HP petrol pump Village Farruknagar Dist GurugramGurugram , Haryana - 122506",Buy Blackberrys Men Red Solid Cotton Super Slim Fit Blazer - Blazers for Men from Blackberrys at Rs. 7995. Style ID: 18026314,"Blackberrys Men Red Solid Cotton Super Slim Fit Blazer,  Blackberrys, Blazers, Topwear, Apparel, Apparel for Men, Buy Blackberrys Men Red Solid Cotton Super Slim Fit Blazer Online in India, Buy Blazers at best price"
watches/fossil/fossil-women-rose-gold-analogue-factory-serviced-watch-es3020fss/8649953/buy,"['accessories', 'women-accessories', 'watches', 'fossil-watches']","621, 12th Main, HAL 2nd Stage,IndiranagarBengaluru , Karnataka - 560008",Buy Fossil Women Rose Gold Analogue Factory Serviced Watch ES3020_FSS - Watches for Women from Fossil at Rs. 9995. Style ID: 8649953,"Fossil Women Rose Gold Analogue Factory Serviced Watch ES3020_FSS,  Fossil, Watches, Watches, Accessories, Accessories for Women, Buy Fossil Women Rose Gold Analogue Factory Serviced Watch ES3020_FSS Online in India, Buy Watches at best price"
shirts/pepe-jeans/pepe-jeans-men-white-pure-cotton-solid-casual-shirt/14206132/buy,"['clothing', 'men-clothing', 'shirts', 'pepe-jeans-shirts']","No . 397/1, Parvathi Nilaya, Basavannagudi Main RoadBengaluru , Karnataka - 560068",Buy Pepe Jeans Men White Pure Cotton Solid Casual Shirt - Shirts for Men from Pepe Jeans at Rs. 1099. Style ID: 14206132,"Pepe Jeans Men White Pure Cotton Solid Casual Shirt,  Pepe Jeans, Shirts, Topwear, Apparel, Apparel for Men, Buy Pepe Jeans Men White Pure Cotton Solid Casual Shirt Online in India, Buy Shirts at best price"
tshirts/hrx-by-hrithik-roshan/hrx-by-hrithik-roshan-men-orange--white-colourblocked-rapid-dry-basketball-t-shirt/15289824/buy,"['clothing', 'men-clothing', 'tshirts', 'hrx-by-hrithik-roshan-tshirts']","11th Floor, Flat No. 1106, 1107, 26, Kailash, Kasturba Gandhi Marg, New Delhi, New Delhi, Delhi, 110001Delhi , Delhi - 110001",Buy HRX By Hrithik Roshan Men Orange & White Colourblocked Rapid Dry Basketball T Shirt - Tshirts for Men from HRX By Hrithik Roshan at Rs. 749. Style ID: 15289824,"HRX By Hrithik Roshan Men Orange & White Colourblocked Rapid Dry Basketball T Shirt,  HRX By Hrithik Roshan, Tshirts, Topwear, Apparel, Apparel for Men, Buy HRX By Hrithik Roshan Men Orange & White Colourblocked Rapid Dry Basketball T Shirt Online in India, Buy Tshirts at best price"
sports-sandals/hush-puppies/hush-puppies-men-black-leather-sports-sandals/12452156/buy,"['footwear', 'men-footwear', 'sports-sandals', 'hush-puppies-sports-sandals']","BATA INDIA LTDGurugram , Haryana - 122504",Buy Hush Puppies Men Black Leather Sports Sandals - Sports Sandals for Men from Hush Puppies at Rs. 2549. Style ID: 12452156,"Hush Puppies Men Black Leather Sports Sandals, Hush Puppies, Sports Sandals, Sandal, Footwear, Footwear for Men, Buy Hush Puppies Men Black Leather Sports Sandals Online in India, Buy Sports Sandals at best price"
tops/chemistry/chemistry-blue-denim-top/18323874/buy,"['clothing', 'women-clothing', 'tops', 'chemistry-tops']","Godown No. 7,8,9,10, Building No.I-10 Shri Arihant Complex, S. no. 40 H No. 1 and 3 and S no. 42, Kopar, Bhiwandi, Thane, Maharashtra,Mumbai , Maharashtra - 421302",Buy Chemistry Blue Denim Top - Tops for Women from Chemistry at Rs. 1574. Style ID: 18323874,"Chemistry Blue Denim Top,  Chemistry, Tops, Topwear, Apparel, Apparel for Women, Buy Chemistry Blue Denim Top Online in India, Buy Tops at best price"
kurta-sets/inddus/inddus-mauve-poly-georgette-dhoti-set/17206456/buy,"['clothing', 'women-clothing', 'kurta-sets', 'inddus-kurta-sets']","4-B, Anjani TowerParle PointSurat , Gujarat - 395007",Buy Inddus Mauve Poly Georgette Dhoti Set - Kurta Sets for Women from Inddus at Rs. 2919. Style ID: 17206456,"Inddus Mauve Poly Georgette Dhoti Set,  Inddus, Kurta Sets, Apparel Set, Apparel, Apparel for Women, Buy Inddus Mauve Poly Georgette Dhoti Set Online in India, Buy Kurta Sets at best price"
sarees/inddus/inddus-mauve-and-white-embroidered-ruffled-saree/14171786/buy,"['clothing', 'women-clothing', 'sarees', 'inddus-sarees']","4-B, Anjani TowerParle PointSurat , Gujarat - 395007",Buy Inddus Mauve And White Embroidered Ruffled Saree - Sarees for Women from Inddus at Rs. 2573. Style ID: 14171786,"Inddus Mauve And White Embroidered Ruffled Saree,  Inddus, Sarees, Saree, Apparel, Apparel for Women, Buy Inddus Mauve And White Embroidered Ruffled Saree Online in India, Buy Sarees at best price"
backpacks/wildcraft/wildcraft-unisex-blue-solid-backpack/8419355/buy,"['accessories', 'unisex-accessories', 'backpacks', 'wildcraft-backpacks']","5th Floor, Office No 504, Punj Essen House, 17-18, Nehru PlaceDelhi , Delhi - 110019",Buy Wildcraft Unisex Blue Solid Backpack - Backpacks for Unisex from Wildcraft at Rs. 2499. Style ID: 8419355,"Wildcraft Unisex Blue Solid Backpack,  Wildcraft, Backpacks, Bags, Accessories, Accessories for Unisex, Buy Wildcraft Unisex Blue Solid Backpack Online in India, Buy Backpacks at best price"
trousers/peter-england-casuals/peter-england-casuals-men-black-checked-slim-fit-trousers/16597766/buy,"['clothing', 'men-clothing', 'trousers', 'peter-england-casuals-trousers']","Ground Floor, No 65/64, old No 65, 6th Block, Ward No 21, 2ndMain Road,Bengaluru , Karnataka - 560044",Buy Peter England Casuals Men Black Checked Slim Fit Trousers - Trousers for Men from Peter England Casuals at Rs. 1199. Style ID: 16597766,"Peter England Casuals Men Black Checked Slim Fit Trousers,  Peter England Casuals, Trousers, Bottomwear, Apparel, Apparel for Men, Buy Peter England Casuals Men Black Checked Slim Fit Trousers Online in India, Buy Trousers at best price"
backpacks/metronaut/metronaut-unisex-navy-blue--black-brand-logo-backpack/11965626/buy,"['accessories', 'unisex-accessories', 'backpacks', 'metronaut-backpacks']",,Buy Metronaut Unisex Navy Blue & Black Brand Logo Backpack - Backpacks for Unisex from Metronaut at Rs. 495. Style ID: 11965626,"Metronaut Unisex Navy Blue & Black Brand Logo Backpack,  Metronaut, Backpacks, Bags, Accessories, Accessories for Unisex, Buy Metronaut Unisex Navy Blue & Black Brand Logo Backpack Online in India, Buy Backpacks at best price"
sherwani/hangup/hangup-men-cream-coloured--maroon-printed-sherwani-set/13546096/buy,"['clothing', 'men-clothing', 'sherwani', 'hangup-sherwani']","676,phase-2sector-37Gurugram , Haryana - 122001",Buy Hangup Men Cream Coloured & Maroon Printed Sherwani Set - Sherwani for Men from Hangup at Rs. 3399. Style ID: 13546096,"Hangup Men Cream Coloured & Maroon Printed Sherwani Set,  Hangup, Sherwani, Apparel Set, Apparel, Apparel for Men, Buy Hangup Men Cream Coloured & Maroon Printed Sherwani Set Online in India, Buy Sherwani at best price"
shorts/mast--harbour/mast--harbour-women-blue-washed-denim-shorts-with-side-taping-detail-/15045554/buy,"['clothing', 'women-clothing', 'shorts', 'mast-and-harbour-shorts']",,Buy Mast & Harbour Women Blue Washed Denim Shorts With Side Taping Detail - Shorts for Women from Mast & Harbour at Rs. 524. Style ID: 15045554,"Mast & Harbour Women Blue Washed Denim Shorts With Side Taping Detail,  Mast & Harbour, Shorts, Bottomwear, Apparel, Apparel for Women, Buy Mast & Harbour Women Blue Washed Denim Shorts With Side Taping Detail Online in India, Buy Shorts at best price"
bedsheets/storyhome/storyhome-purple--white-floral-210-tc-cotton-1-king-bedsheet-with-2-pillow-covers/10017399/buy,"['home-furnishing', 'unisex-home-furnishing', 'bedsheets', 'story-at-home-bedsheets']","31, DEV INDUSTRIAL ESTATE, GORWAVadodra , Gujarat - 390016",Buy Story@home Purple & White Floral 210 TC Cotton 1 King Bedsheet With 2 Pillow Covers - Bedsheets for Unisex from Story@home at Rs. 1599. Style ID: 10017399,"Story@home Purple & White Floral 210 TC Cotton 1 King Bedsheet With 2 Pillow Covers,  Story@home, Bedsheets, Bedding, Home, Home for Unisex, Buy Story@home Purple & White Floral 210 TC Cotton 1 King Bedsheet With 2 Pillow Covers Online in India, Buy Bedsheets at best price"
innerwear-vests/damensch/damensch-men-pack-of-2--anti-microbial-neo-bamboo-round-neck-vest-dam--ib-bz-pack-2-mix/11978542/buy,"['clothing', 'men-clothing', 'innerwear-vests', 'damensch-innerwear-vests']","Third Floor, Municipal No.612/1, PID No.68-229-612/1, Attic Space- Lotus, 80 Feet Road, 4th Block, Koramangala, Bengaluru Urban, Karnataka, 560034Bengaluru , Karnataka - 560034",Buy DAMENSCH Men Pack Of 2  Anti Microbial NEO Bamboo Round Neck Vest DAM  IB BZ PACK 2 MIX - Innerwear Vests for Men from DAMENSCH at Rs. 694. Style ID: 11978542,"DAMENSCH Men Pack Of 2  Anti Microbial NEO Bamboo Round Neck Vest DAM  IB BZ PACK 2 MIX,  DAMENSCH, Innerwear Vests, Innerwear, Apparel, Apparel for Men, Buy DAMENSCH Men Pack Of 2  Anti Microbial NEO Bamboo Round Neck Vest DAM  IB BZ PACK 2 MIX Online in India, Buy Innerwear Vests at best price"
water-bottle/boldfit/boldfit-blue--white-motivational-time-markers-measurement-sipper-water-bottle/18172290/buy,"['home-furnishing', 'unisex-home-furnishing', 'water-bottle', 'boldfit-water-bottle']","Sasvat Omnicare Private Limited. Chandra Reddy Layout, Ranka Colony,H No.11A4th Main Road, Banerghatta Road, Bilekahalli ,BangaloreBengaluru , Karnataka - 560076",Buy BOLDFIT Blue & White Motivational Time Markers Measurement Sipper Water Bottle - Water Bottle for Unisex from BOLDFIT at Rs. 805. Style ID: 18172290,"BOLDFIT Blue & White Motivational Time Markers Measurement Sipper Water Bottle,  BOLDFIT, Water Bottle, Kitchen And Dining, Home, Home for Unisex, Buy BOLDFIT Blue & White Motivational Time Markers Measurement Sipper Water Bottle Online in India, Buy Water Bottle at best price"
bra/coucou-by-zivame/coucou-by-zivame-black-solid-non-padded-medium-coverage-t-shirt-bra/17390982/buy,"['clothing', 'women-clothing', 'bra', 'coucou-by-zivame-bra']","MILA STAR RETAIL PRIVATE LIMITED3rd FLOOR, 2726, Sri Lakshminarayana Nivas, 80 Feet Road, Indiranagar, HAL 3rd stage,Bengaluru , Karnataka - 560075",Buy Coucou By Zivame Black Solid Non Padded Medium Coverage T Shirt Bra - Bra for Women from Coucou By Zivame at Rs. 224. Style ID: 17390982,"Coucou By Zivame Black Solid Non Padded Medium Coverage T Shirt Bra,  Coucou By Zivame, Bra, Innerwear, Apparel, Apparel for Women, Buy Coucou By Zivame Black Solid Non Padded Medium Coverage T Shirt Bra Online in India, Buy Bra at best price"
handbags/guess/guess-charcoal-grey--black-printed-structured-handheld-bag/15572266/buy,"['accessories', 'women-accessories', 'handbags', 'guess-handbags']","Second Floor, Plot No. 82, Okhla Industrial Estate, Phase - III, New Delhi, Delhi, 110020Delhi , Delhi - 110020",Buy GUESS Charcoal Grey & Black Printed Structured Handheld Bag - Handbags for Women from GUESS at Rs. 11199. Style ID: 15572266,"GUESS Charcoal Grey & Black Printed Structured Handheld Bag,  GUESS, Handbags, Bags, Accessories, Accessories for Women, Buy GUESS Charcoal Grey & Black Printed Structured Handheld Bag Online in India, Buy Handbags at best price"
backpacks/cat/cat-blue-camouflage-backpack-with-compression-straps/18302118/buy,"['accessories', 'unisex-accessories', 'backpacks', 'cat-backpacks']","DHL Logistics Pvt Ltd Survey Nos 96,114,115 and 116, KIADB Industrial Area, Bashettyhalli Village, Kasaba Hobli, Doddaballapura Taluk BengaluruBengaluru , Karnataka - 561203",Buy CAT Blue Camouflage Backpack With Compression Straps - Backpacks for Unisex from CAT at Rs. 3599. Style ID: 18302118,"CAT Blue Camouflage Backpack With Compression Straps,  CAT, Backpacks, Bags, Accessories, Accessories for Unisex, Buy CAT Blue Camouflage Backpack With Compression Straps Online in India, Buy Backpacks at best price"
showpieces/tied-ribbons/tied-ribbons-set-of-3-red--blue-buddha-monk-statue-figurines-showpiece/11170484/buy,"['home-furnishing', 'unisex-home-furnishing', 'showpieces', 'tied-ribbons-showpieces']",,Buy TIED RIBBONS Set Of 3 Red & Blue Buddha Monk Statue Figurines Showpiece - Showpieces for Unisex from TIED RIBBONS at Rs. 1199. Style ID: 11170484,"TIED RIBBONS Set Of 3 Red & Blue Buddha Monk Statue Figurines Showpiece,  TIED RIBBONS, Showpieces, Home Decor, Home, Home for Unisex, Buy TIED RIBBONS Set Of 3 Red & Blue Buddha Monk Statue Figurines Showpiece Online in India, Buy Showpieces at best price"
