prod_link,tags,seller_address,meta_description,meta_keyword
dresses/and/and-multicoloured-v-neck-georgette-fit-and-flare-dress/17847148/buy,"['clothing', 'women-clothing', 'dresses', 'and-dresses']","Building F Prathamesh Dream Complex Near Vatike Hotel Nashik Road Sarvali Goan Thakur Pada.Bhiwandi , Maharashtra - 421302",Buy AND Multicoloured V Neck Georgette Fit And Flare Dress - Dresses for Women from AND at Rs. 2609. Style ID: 17847148,"AND Multicoloured V Neck Georgette Fit And Flare Dress,  AND, Dresses, Dress, Apparel, Apparel for Women, Buy AND Multicoloured V Neck Georgette Fit And Flare Dress Online in India, Buy Dresses at best price"
night-suits/bannos-swagger/bannos-swagger-women-purple--white-printed-night-suit/14303570/buy,"['clothing', 'women-clothing', 'night-suits', 'bannos-swagger-night-suits']","Keev Lifestyles LLP, Plot no.326, GIDC Pandesara, Surat- 394221Surat , Gujarat - 394221",Buy Bannos Swagger Women Purple & White Printed Night Suit - Night Suits for Women from Bannos Swagger at Rs. 764. Style ID: 14303570,"Bannos Swagger Women Purple & White Printed Night Suit,  Bannos Swagger, Night Suits, Loungewear And Nightwear, Apparel, Apparel for Women, Buy Bannos Swagger Women Purple & White Printed Night Suit Online in India, Buy Night Suits at best price"
formal-shoes/clarks/clarks-men-brown-perforated-leather-formal-derbys/7228032/buy,"['footwear', 'men-footwear', 'formal-shoes', 'clarks-formal-shoes']","Kila No. 25// 13/1, 18/2, 18/3, 19/2, 22/2, 35 // 1/2, 2/2, 9,10,11, 12, 19, 20, 21/1, 22/1,Village KokaJhajjar , Haryana - 124108",Buy Clarks Men Brown Perforated Leather Formal Derbys - Formal Shoes for Men from Clarks at Rs. 2449. Style ID: 7228032,"Clarks Men Brown Perforated Leather Formal Derbys,  Clarks, Formal Shoes, Shoes, Footwear, Footwear for Men, Buy Clarks Men Brown Perforated Leather Formal Derbys Online in India, Buy Formal Shoes at best price"
dresses/hm/hm-girls-5-pack-cotton-jersey-dresses/17964596/buy,"['clothing', 'girls-clothing', 'dresses', 'h-and-m-dresses']","Prakhhyat Infraprojects PVT. LTD., BUILDING 6, K-Square Logistics Park C/O LF LogisticsNear Padgha Toll Naka on MUMBAI-NASIKThane , Maharashtra - 421101",Buy H&M Girls 5 Pack Cotton Jersey Dresses - Dresses for Girls from H&M at Rs. 2299. Style ID: 17964596,"H&M Girls 5 Pack Cotton Jersey Dresses,  H&M, Dresses, Dress, Apparel, Apparel for Girls, Buy H&M Girls 5 Pack Cotton Jersey Dresses Online in India, Buy Dresses at best price"
tshirts/uth-by-roadster/uth-by-roadster-girls-olive-green-solid-extended-sleeves-pure-cotton-t-shirt/15184706/buy,"['clothing', 'girls-clothing', 'tshirts', 'uth-by-roadster-tshirts']","Second Floor, Plot No. 82, Okhla Industrial Estate, Phase - III, New Delhi, Delhi, 110020Delhi , Delhi - 110020",Buy UTH By Roadster Girls Olive Green Solid Extended Sleeves Pure Cotton T Shirt - Tshirts for Girls from UTH By Roadster at Rs. 149. Style ID: 15184706,"UTH By Roadster Girls Olive Green Solid Extended Sleeves Pure Cotton T Shirt,  UTH By Roadster, Tshirts, Topwear, Apparel, Apparel for Girls, Buy UTH By Roadster Girls Olive Green Solid Extended Sleeves Pure Cotton T Shirt Online in India, Buy Tshirts at best price"
jackets/selected/selected-men-green-solid-fleece-trimmed-sporty-jacket/14690724/buy,"['clothing', 'men-clothing', 'jackets', 'selected-jackets']","2nd Floor, The Lalit Residency, The Lalit Mumbai,Sahar Airport Road, Sahar, Andheri East.Mumbai , Maharashtra - 400059",Buy SELECTED Men Green Solid Fleece Trimmed Sporty Jacket - Jackets for Men from SELECTED at Rs. 4499. Style ID: 14690724,"SELECTED Men Green Solid Fleece Trimmed Sporty Jacket,  SELECTED, Jackets, Topwear, Apparel, Apparel for Men, Buy SELECTED Men Green Solid Fleece Trimmed Sporty Jacket Online in India, Buy Jackets at best price"
dresses/aask/aask-mustard-yellow-crepe-midi-dress/17152076/buy,"['clothing', 'women-clothing', 'dresses', 'aask-dresses']","SY NO 25, PL NO 247, FN PL NO 6/C, H NO 409/40,, UMIYA NAGAR, B/S. CHOKSI DYING,, Udhna Magdalla RoadSurat , Gujarat - 395002",Buy AASK Mustard Yellow Crepe Midi Dress - Dresses for Women from AASK at Rs. 815. Style ID: 17152076,"AASK Mustard Yellow Crepe Midi Dress,  AASK, Dresses, Dress, Apparel, Apparel for Women, Buy AASK Mustard Yellow Crepe Midi Dress Online in India, Buy Dresses at best price"
nightdress/maybell/-maybell-women-yellow-nightdress/18457274/buy,"['clothing', 'women-clothing', 'nightdress', 'maybell-nightdress']","NO. 523/18 N.S.K.NAGAR, ANNA NAGAR 3RD AVENUE, ARUMBAKKAM,Chennai , Tamilnadu - 600106",Buy Maybell Women Yellow Nightdress - Nightdress for Women from Maybell at Rs. 1199. Style ID: 18457274,"Maybell Women Yellow Nightdress,  Maybell, Nightdress, Loungewear And Nightwear, Apparel, Apparel for Women, Buy Maybell Women Yellow Nightdress Online in India, Buy Nightdress at best price"
wallets/hidesign/hidesign-men-red--black-crocodile-skin-textured-two-fold-leather-wallet/12071920/buy,"['accessories', 'men-accessories', 'wallets', 'hidesign-wallets']","Awfis, 7th floor, HM Vibha Tower, 25 Laskar Hosur Road, Adugodi, Bengalore 560029Bengaluru , Karnataka - 560029",Buy Hidesign Men Red & Black Crocodile Skin Textured Two Fold Leather Wallet - Wallets for Men from Hidesign at Rs. 1596. Style ID: 12071920,"Hidesign Men Red & Black Crocodile Skin Textured Two Fold Leather Wallet,  Hidesign, Wallets, Wallets, Accessories, Accessories for Men, Buy Hidesign Men Red & Black Crocodile Skin Textured Two Fold Leather Wallet Online in India, Buy Wallets at best price"
jeans/louis-philippe-jeans/louis-philippe-jeans-men-blue-matt-slim-fit-low-rise-clean-look-stretchable-jeans/11028212/buy,"['clothing', 'men-clothing', 'jeans', 'louis-philippe-jeans-jeans']","Ground Floor, No 65/64, old No 65, 6th Block, Ward No 21, 2ndMain Road,Bengaluru , Karnataka - 560044",Buy Louis Philippe Jeans Men Blue Matt Slim Fit Low Rise Clean Look Stretchable Jeans - Jeans for Men from Louis Philippe Jeans at Rs. 2159. Style ID: 11028212,"Louis Philippe Jeans Men Blue Matt Slim Fit Low Rise Clean Look Stretchable Jeans,  Louis Philippe Jeans, Jeans, Bottomwear, Apparel, Apparel for Men, Buy Louis Philippe Jeans Men Blue Matt Slim Fit Low Rise Clean Look Stretchable Jeans Online in India, Buy Jeans at best price"
thermal-tops/neva/neva-women-grey-melange-striped-slim-fit-thermal-top/13776320/buy,"['clothing', 'women-clothing', 'thermal-tops', 'neva-thermal-tops']","GT ROAD WEST,NEAR JALANDHAR BYE PASS, LUDHIANALudhiana , Punjab - 141008",Buy NEVA Women Grey Melange Striped Slim Fit Thermal Top - Thermal Tops for Women from NEVA at Rs. 431. Style ID: 13776320,"NEVA Women Grey Melange Striped Slim Fit Thermal Top,  NEVA, Thermal Tops, Innerwear, Apparel, Apparel for Women, Buy NEVA Women Grey Melange Striped Slim Fit Thermal Top Online in India, Buy Thermal Tops at best price"
dresses/sassafras/sassafras-women-stylish-black-solid-bling-and-sparkly-dress/14994858/buy,"['clothing', 'women-clothing', 'dresses', 'sassafras-dresses']","KH No. 37/19, 3rd FloorKapasheraDelhi , Delhi - 110037",Buy SASSAFRAS Women Stylish Black Solid Bling And Sparkly Dress - Dresses for Women from SASSAFRAS at Rs. 799. Style ID: 14994858,"SASSAFRAS Women Stylish Black Solid Bling And Sparkly Dress,  SASSAFRAS, Dresses, Dress, Apparel, Apparel for Women, Buy SASSAFRAS Women Stylish Black Solid Bling And Sparkly Dress Online in India, Buy Dresses at best price"
shirts/moda-rapido/moda-rapido-men-white-windowpane-checks-slim-fit-casual-shirt/16877200/buy,"['clothing', 'men-clothing', 'shirts', 'moda-rapido-shirts']","5th Floor, Office No 504, Punj Essen House, 17-18, Nehru PlaceDelhi , Delhi - 110019",Buy Moda Rapido Men White Windowpane Checks Slim Fit Casual Shirt - Shirts for Men from Moda Rapido at Rs. 911. Style ID: 16877200,"Moda Rapido Men White Windowpane Checks Slim Fit Casual Shirt,  Moda Rapido, Shirts, Topwear, Apparel, Apparel for Men, Buy Moda Rapido Men White Windowpane Checks Slim Fit Casual Shirt Online in India, Buy Shirts at best price"
flats/roadster/roadster-women-tan-brown-crocs-textured-open-toe-flats-with-buckle-detail/14880728/buy,"['footwear', 'women-footwear', 'flats', 'roadster-flats']","406, B2 and C, 4th Floor,Centrum Plaza, Golf Course Road, Sector - 53,Gurugram , Haryana - 122102",Buy Roadster Women Tan Brown Crocs Textured Open Toe Flats With Buckle Detail - Flats for Women from Roadster at Rs. 1999. Style ID: 14880728,"Roadster Women Tan Brown Crocs Textured Open Toe Flats With Buckle Detail,  Roadster, Flats, Shoes, Footwear, Footwear for Women, Buy Roadster Women Tan Brown Crocs Textured Open Toe Flats With Buckle Detail Online in India, Buy Flats at best price"
deodorant/david-beckham/david-beckham-men-instinct-sport-deodarant-150-ml/2383585/buy,"['personal-care', 'men-personal-care', 'deodorant', 'david-beckham-deodorant']","11th Floor, Flat No. 1106, 1107, 26, Kailash, Kasturba Gandhi Marg, New Delhi, New Delhi, Delhi, 110001Delhi , Delhi - 110001",Buy DAVID BECKHAM Men Instinct Sport Deodarant 150 Ml - Deodorant for Men from DAVID BECKHAM at Rs. 339. Style ID: 2383585,"DAVID BECKHAM Men Instinct Sport Deodarant 150 Ml, DAVID BECKHAM, Deodorant, Fragrance, Personal Care, Personal Care for Men, Buy DAVID BECKHAM Men Instinct Sport Deodarant 150 Ml Online in India, Buy Deodorant at best price"
flip-flops/ajile-by-pantaloons/ajile-by-pantaloons-men-grey--yellow-printed-sliders/16914042/buy,"['footwear', 'men-footwear', 'flip-flops', 'ajile-by-pantaloons-flip-flops']","Business Ground Floor,No 65/64, old No 65, 6th Block, Ward No 21, 2nd Main RoadBengaluru (Bangalore) UrbanBengaluru , Karnataka - 560044",Buy Ajile By Pantaloons Men Grey & Yellow Printed Sliders - Flip Flops for Men from Ajile By Pantaloons at Rs. 699. Style ID: 16914042,"Ajile By Pantaloons Men Grey & Yellow Printed Sliders,  Ajile By Pantaloons, Flip Flops, Flip Flops, Footwear, Footwear for Men, Buy Ajile By Pantaloons Men Grey & Yellow Printed Sliders Online in India, Buy Flip Flops at best price"
tops/the-kaatn-trail/the-kaatn-trail-woven-red-solid-top/18416624/buy,"['clothing', 'women-clothing', 'tops', 'the-kaatn-trail-tops']","A403, Rivona Building, Hiranandani Heritage, S.V Road, Poiser, Kandivali (West)Mumbai , MAHARASHTRA - 400067",Buy The Kaatn Trail Woven Red Solid Top - Tops for Women from The Kaatn Trail at Rs. 2470. Style ID: 18416624,"The Kaatn Trail Woven Red Solid Top,  The Kaatn Trail, Tops, Topwear, Apparel, Apparel for Women, Buy The Kaatn Trail Woven Red Solid Top Online in India, Buy Tops at best price"
boxers/damensch/damensch-breeeze-men-black--grey-striped-pure-cotton-ultra-light-everyday-boxers-dam-stp-sbx-ntb/14905414/buy,"['clothing', 'men-clothing', 'boxers', 'damensch-boxers']","Third Floor, Municipal No.612/1, PID No.68-229-612/1, Attic Space- Lotus, 80 Feet Road, 4th Block, Koramangala, Bengaluru Urban, Karnataka, 560034Bengaluru , Karnataka - 560034",Buy DAMENSCH Breeeze Men Black & Grey Striped Pure Cotton Ultra Light Everyday Boxers DAM STP SBX NTB - Boxers for Men from DAMENSCH at Rs. 490. Style ID: 14905414,"DAMENSCH Breeeze Men Black & Grey Striped Pure Cotton Ultra Light Everyday Boxers DAM STP SBX NTB,  DAMENSCH, Boxers, Innerwear, Apparel, Apparel for Men, Buy DAMENSCH Breeeze Men Black & Grey Striped Pure Cotton Ultra Light Everyday Boxers DAM STP SBX NTB Online in India, Buy Boxers at best price"
kurtas/w/w-women-green--white-striped-thread-work-kurta/16924208/buy,"['clothing', 'women-clothing', 'kurtas', 'w-kurtas']","Cabin No. 6, Property 2, Gujarat Vihar, Vikas Marg, New Delhi, Delhi, 110092Delhi , Delhi - 110092",Buy W Women Green & White Striped Thread Work Kurta - Kurtas for Women from W at Rs. 1799. Style ID: 16924208,"W Women Green & White Striped Thread Work Kurta,  W, Kurtas, Topwear, Apparel, Apparel for Women, Buy W Women Green & White Striped Thread Work Kurta Online in India, Buy Kurtas at best price"
tops/imfashini/imfashini-women-lime-green-striped-shirt-style-top/13523634/buy,"['clothing', 'women-clothing', 'tops', 'imfashini-tops']","A-24, First floor, Street no. 10East Azad nagarDelhi , Delhi - 110051",Buy Imfashini Women Lime Green Striped Shirt Style Top - Tops for Women from Imfashini at Rs. 640. Style ID: 13523634,"Imfashini Women Lime Green Striped Shirt Style Top,  Imfashini, Tops, Topwear, Apparel, Apparel for Women, Buy Imfashini Women Lime Green Striped Shirt Style Top Online in India, Buy Tops at best price"
shirts/indian-terrain/indian-terrain-men-red-slim-fit-checked-cotton-casual-shirt/14130464/buy,"['clothing', 'men-clothing', 'shirts', 'indian-terrain-shirts']","208, Velachery Tambaram Main Road, Narayanapuram, PallikaranaiChennai , Tamilnadu - 600100",Buy Indian Terrain Men Red Slim Fit Checked Cotton Casual Shirt - Shirts for Men from Indian Terrain at Rs. 1209. Style ID: 14130464,"Indian Terrain Men Red Slim Fit Checked Cotton Casual Shirt,  Indian Terrain, Shirts, Topwear, Apparel, Apparel for Men, Buy Indian Terrain Men Red Slim Fit Checked Cotton Casual Shirt Online in India, Buy Shirts at best price"
kurtas/w/w-women-green--white-striped-thread-work-kurta/16924208/buy,"['clothing', 'women-clothing', 'kurtas', 'w-kurtas']","Cabin No. 6, Property 2, Gujarat Vihar, Vikas Marg, New Delhi, Delhi, 110092Delhi , Delhi - 110092",Buy W Women Green & White Striped Thread Work Kurta - Kurtas for Women from W at Rs. 1799. Style ID: 16924208,"W Women Green & White Striped Thread Work Kurta,  W, Kurtas, Topwear, Apparel, Apparel for Women, Buy W Women Green & White Striped Thread Work Kurta Online in India, Buy Kurtas at best price"
tops/imfashini/imfashini-women-lime-green-striped-shirt-style-top/13523634/buy,"['clothing', 'women-clothing', 'tops', 'imfashini-tops']","A-24, First floor, Street no. 10East Azad nagarDelhi , Delhi - 110051",Buy Imfashini Women Lime Green Striped Shirt Style Top - Tops for Women from Imfashini at Rs. 640. Style ID: 13523634,"Imfashini Women Lime Green Striped Shirt Style Top,  Imfashini, Tops, Topwear, Apparel, Apparel for Women, Buy Imfashini Women Lime Green Striped Shirt Style Top Online in India, Buy Tops at best price"
shirts/indian-terrain/indian-terrain-men-red-slim-fit-checked-cotton-casual-shirt/14130464/buy,"['clothing', 'men-clothing', 'shirts', 'indian-terrain-shirts']","208, Velachery Tambaram Main Road, Narayanapuram, PallikaranaiChennai , Tamilnadu - 600100",Buy Indian Terrain Men Red Slim Fit Checked Cotton Casual Shirt - Shirts for Men from Indian Terrain at Rs. 1209. Style ID: 14130464,"Indian Terrain Men Red Slim Fit Checked Cotton Casual Shirt,  Indian Terrain, Shirts, Topwear, Apparel, Apparel for Men, Buy Indian Terrain Men Red Slim Fit Checked Cotton Casual Shirt Online in India, Buy Shirts at best price"
tshirts/artengo-by-decathlon/artengo-by-decathlon-kids-white-tennis-polo-collar-t-shirt/17035324/buy,"['clothing', 'unisex-kids-clothing', 'tshirts', 'artengo-by-decathlon-tshirts']","No 41, No 42/3 part, Soukya Road, Kacherkanahalli, Hosakote Taluk, Bengaluru (Bangalore) Rural, Karnataka, 560067Bengaluru , Karnataka - 560067",Buy Artengo By Decathlon Kids White Tennis Polo Collar T Shirt - Tshirts for Unisex Kids from Artengo By Decathlon at Rs. 639. Style ID: 17035324,"Artengo By Decathlon Kids White Tennis Polo Collar T Shirt,  Artengo By Decathlon, Tshirts, Topwear, Apparel, Apparel for Unisex Kids, Buy Artengo By Decathlon Kids White Tennis Polo Collar T Shirt Online in India, Buy Tshirts at best price"
bar-and-drinkware/goodhomes/goodhomes-set-of-2-transparent-skull-shaped-beer-glasses-520-ml/13332232/buy,"['home-furnishing', 'unisex-home-furnishing', 'bar-and-drinkware', 'goodhomes-bar-and-drinkware']","116-121, AMAR VIJAY TOWER,NEAR HOTEL MANSINGH,SANSAR CHANDRA,ROAD,Rajasthan,India,302001Jaipur , Rajasthan - 303704",Buy GOODHOMES Set Of 2 Transparent Skull Shaped Beer Glasses 520 Ml - Bar And Drinkware for Unisex from GOODHOMES at Rs. 432. Style ID: 13332232,"GOODHOMES Set Of 2 Transparent Skull Shaped Beer Glasses 520 Ml,  GOODHOMES, Bar And Drinkware, Kitchen And Dining, Home, Home for Unisex, Buy GOODHOMES Set Of 2 Transparent Skull Shaped Beer Glasses 520 Ml Online in India, Buy Bar And Drinkware at best price"
tshirts/roadster/roadster-women-white--yellow-printed-drop-shoulder-sleeves-pure-cotton-t-shirt/13555478/buy,"['clothing', 'women-clothing', 'tshirts', 'roadster-tshirts']","406, B2 and C, 4th Floor,Centrum Plaza, Golf Course Road, Sector - 53,Gurugram , Haryana - 122102",Buy Roadster Women White & Yellow Printed Drop Shoulder Sleeves Pure Cotton T Shirt - Tshirts for Women from Roadster at Rs. 269. Style ID: 13555478,"Roadster Women White & Yellow Printed Drop Shoulder Sleeves Pure Cotton T Shirt,  Roadster, Tshirts, Topwear, Apparel, Apparel for Women, Buy Roadster Women White & Yellow Printed Drop Shoulder Sleeves Pure Cotton T Shirt Online in India, Buy Tshirts at best price"
flats/shezone/shezone-women-peach-coloured-embellished-ballerinas-with-laser-cuts-flats/16583686/buy,"['footwear', 'women-footwear', 'flats', 'shezone-flats']","Shop no 159, Desh Bandhu Gupta Road, Karol Bagh, Central DelhiDelhi , Delhi - 110005",Buy Shezone Women Peach Coloured Embellished Ballerinas With Laser Cuts Flats - Flats for Women from Shezone at Rs. 799. Style ID: 16583686,"Shezone Women Peach Coloured Embellished Ballerinas With Laser Cuts Flats,  Shezone, Flats, Shoes, Footwear, Footwear for Women, Buy Shezone Women Peach Coloured Embellished Ballerinas With Laser Cuts Flats Online in India, Buy Flats at best price"
lounge-tshirts/tokyo-talkies/tokyo-talkies-women-black-solid-sleep-shirt/13462830/buy,"['clothing', 'women-clothing', 'lounge-tshirts', 'tokyo-talkies-lounge-tshirts']","5th Floor, Office No 504, Punj Essen House, 17-18, Nehru PlaceDelhi , Delhi - 110019",Buy Tokyo Talkies Women Black Solid Sleep Shirt - Lounge Tshirts for Women from Tokyo Talkies at Rs. 409. Style ID: 13462830,"Tokyo Talkies Women Black Solid Sleep Shirt,  Tokyo Talkies, Lounge Tshirts, Loungewear And Nightwear, Apparel, Apparel for Women, Buy Tokyo Talkies Women Black Solid Sleep Shirt Online in India, Buy Lounge Tshirts at best price"
dresses/vero-moda/vero-moda-blue-off-shoulder-sheath-dress/17737482/buy,"['clothing', 'women-clothing', 'dresses', 'vero-moda-dresses']","4th floor, The Lalit Residency, The Lalit Mumbai, Sahar Airport Road, Andheri east, Mumbai Suburban, Maharashtra, 400059Mumbai , Maharashtra - 400059",Buy Vero Moda Blue Off Shoulder Sheath Dress - Dresses for Women from Vero Moda at Rs. 4999. Style ID: 17737482,"Vero Moda Blue Off Shoulder Sheath Dress,  Vero Moda, Dresses, Dress, Apparel, Apparel for Women, Buy Vero Moda Blue Off Shoulder Sheath Dress Online in India, Buy Dresses at best price"
bra/triumph/triumph-true-shape-sensation-02-non-padded-wired-360-support-minimizer-bra/15591198/buy,"['clothing', 'women-clothing', 'bra', 'triumph-bra']","240B, Sengundram Village Singaperumal Koli Kancheepuram Dist. Chennai 603204   Sengundram TN IN 603204 04467414533MARAIMALAINAGAR , Tamil Nadu - 603204",Buy Triumph True Shape Sensation 02 Non Padded Wired 360deg Support Minimizer Bra - Bra for Women from Triumph at Rs. 2276. Style ID: 15591198,"Triumph True Shape Sensation 02 Non Padded Wired 360deg Support Minimizer Bra,  Triumph, Bra, Innerwear, Apparel, Apparel for Women, Buy Triumph True Shape Sensation 02 Non Padded Wired 360deg Support Minimizer Bra Online in India, Buy Bra at best price"
wall-art/999store/999store-set-of-5-brown--copper-coloured-buddha-wall-art-frames/14611446/buy,"['home-furnishing', 'unisex-home-furnishing', 'wall-art', '999store-wall-art']",,Buy 999Store Set Of 5 Brown & Copper Coloured Buddha Wall Art Frames - Wall Art for Unisex from 999Store at Rs. 1799. Style ID: 14611446,"999Store Set Of 5 Brown & Copper Coloured Buddha Wall Art Frames,  999Store, Wall Art, Home Decor, Home, Home for Unisex, Buy 999Store Set Of 5 Brown & Copper Coloured Buddha Wall Art Frames Online in India, Buy Wall Art at best price"
caps/fabseasons/fabseasons-unisex-black-solid-beanie/7800667/buy,"['accessories', 'unisex-accessories', 'caps', 'fabseasons-caps']",,Buy FabSeasons Unisex Black Solid Beanie - Caps for Unisex from FabSeasons at Rs. 455. Style ID: 7800667,"FabSeasons Unisex Black Solid Beanie,  FabSeasons, Caps, Headwear, Accessories, Accessories for Unisex, Buy FabSeasons Unisex Black Solid Beanie Online in India, Buy Caps at best price"
heels/scholl/scholl-women-pink-sandals/13201476/buy,"['footwear', 'women-footwear', 'heels', 'scholl-heels']","BATA INDIA LTDGurugram , Haryana - 122504",Buy Scholl Women Pink Sandals - Heels for Women from Scholl at Rs. 1499. Style ID: 13201476,"Scholl Women Pink Sandals,  Scholl, Heels, Shoes, Footwear, Footwear for Women, Buy Scholl Women Pink Sandals Online in India, Buy Heels at best price"
tshirts/forever-21/forever-21-men-black--white-typography-printed-t-shirt/15078416/buy,"['clothing', 'men-clothing', 'tshirts', 'forever-21-tshirts']","Cabin No. 6, Property 2, Gujarat Vihar, Vikas Marg, New Delhi, Delhi, 110092Delhi , Delhi - 110092",Buy FOREVER 21 Men Black & White Typography Printed T Shirt - Tshirts for Men from FOREVER 21 at Rs. 349. Style ID: 15078416,"FOREVER 21 Men Black & White Typography Printed T Shirt,  FOREVER 21, Tshirts, Topwear, Apparel, Apparel for Men, Buy FOREVER 21 Men Black & White Typography Printed T Shirt Online in India, Buy Tshirts at best price"
heels/taavi/taavi-beige--black-printed-handcrafted-sandals/16040848/buy,"['footwear', 'women-footwear', 'heels', 'taavi-heels']","Second Floor, Plot No. 82, Okhla Industrial Estate, Phase - III, New Delhi, Delhi, 110020Delhi , Delhi - 110020",Buy Taavi Beige & Black Printed Handcrafted Sandals - Heels for Women from Taavi at Rs. 1999. Style ID: 16040848,"Taavi Beige & Black Printed Handcrafted Sandals,  Taavi, Heels, Shoes, Footwear, Footwear for Women, Buy Taavi Beige & Black Printed Handcrafted Sandals Online in India, Buy Heels at best price"
sports-shoes/bacca-bucci/bacca-bucci-men-navy-blue-running-non-marking-shoes/15059568/buy,"['footwear', 'men-footwear', 'sports-shoes', 'bacca-bucci-sports-shoes']","G-152, Gazipur Village, Near Edmc School New Delhi Delhi 110096New Delhi , Delhi - 110096",Buy Bacca Bucci Men Navy Blue Running Non Marking Shoes - Sports Shoes for Men from Bacca Bucci at Rs. 1619. Style ID: 15059568,"Bacca Bucci Men Navy Blue Running Non Marking Shoes,  Bacca Bucci, Sports Shoes, Shoes, Footwear, Footwear for Men, Buy Bacca Bucci Men Navy Blue Running Non Marking Shoes Online in India, Buy Sports Shoes at best price"
kurtas/extra-love-by-libas/extra-love-by-libas-plus-size-women-green--grey-ethnic-motifs-printed-kurta/17061734/buy,"['clothing', 'women-clothing', 'kurtas', 'extra-love-by-libas-kurtas']","B-19, Phase - II, ,Sector -83Noida , Uttar pradesh - 201305",Buy EXTRA LOVE BY LIBAS Plus Size Women Green & Grey Ethnic Motifs Printed Kurta - Kurtas for Women from EXTRA LOVE BY LIBAS at Rs. 1299. Style ID: 17061734,"EXTRA LOVE BY LIBAS Plus Size Women Green & Grey Ethnic Motifs Printed Kurta,  EXTRA LOVE BY LIBAS, Kurtas, Topwear, Apparel, Apparel for Women, Buy EXTRA LOVE BY LIBAS Plus Size Women Green & Grey Ethnic Motifs Printed Kurta Online in India, Buy Kurtas at best price"
frames/peter-jones-eyewear/peter-jones-eyewear-unisex-silver--transparent-anti-glare-aviator-frames-tk002s/17690100/buy,"['accessories', 'unisex-accessories', 'frames', 'peter-jones-eyewear-frames']","2nd Floor, J-181, VISHNU GARDEN, VISHNU GARDEN, West DelhiDelhi , Delhi - 110018",Buy Peter Jones Eyewear Unisex Silver & Transparent Anti Glare Aviator Frames TK002S - Frames for Unisex from Peter Jones Eyewear at Rs. 699. Style ID: 17690100,"Peter Jones Eyewear Unisex Silver & Transparent Anti Glare Aviator Frames TK002S,  Peter Jones Eyewear, Frames, Accessories, Accessories, Accessories for Unisex, Buy Peter Jones Eyewear Unisex Silver & Transparent Anti Glare Aviator Frames TK002S Online in India, Buy Frames at best price"
jeans/v-dot/v-dot-men-navy-blue-skinny-fit-jeans/18389172/buy,"['clothing', 'men-clothing', 'jeans', 'v-dot-jeans']","Ground Floor, No 65/64, old No 65, 6th Block, Ward No 21, 2ndMain Road,Bengaluru , Karnataka - 560044",Buy V Dot Men Navy Blue Skinny Fit Jeans - Jeans for Men from V Dot at Rs. 979. Style ID: 18389172,"V Dot Men Navy Blue Skinny Fit Jeans,  V Dot, Jeans, Bottomwear, Apparel, Apparel for Men, Buy V Dot Men Navy Blue Skinny Fit Jeans Online in India, Buy Jeans at best price"
dresses/urbanic/urbanic-black--white-polka-dot-a-line-dress/16106942/buy,"['clothing', 'women-clothing', 'dresses', 'urbanic-dresses']","90-B, 91SPRINGBOARD, Delhi - Jaipur Expy, Sector 18Gurgaon, HaryanaGurugram , HARYANA - 122008",Buy URBANIC Black & White Polka Dot A Line Dress - Dresses for Women from URBANIC at Rs. 834. Style ID: 16106942,"URBANIC Black & White Polka Dot A Line Dress,  URBANIC, Dresses, Dress, Apparel, Apparel for Women, Buy URBANIC Black & White Polka Dot A Line Dress Online in India, Buy Dresses at best price"
kurta-sets/ziyaa/ziyaa-women-black-foil-printed-kurta-with-trousers/13959960/buy,"['clothing', 'women-clothing', 'kurta-sets', 'ziyaa-kurta-sets']","Plot No.- 711, Road No. 7, Opp. Arman Mill, Sachin GIDCSurat , Gujarat - 394230",Buy ZIYAA Women Black Foil Printed Kurta With Trousers - Kurta Sets for Women from ZIYAA at Rs. 877. Style ID: 13959960,"ZIYAA Women Black Foil Printed Kurta With Trousers,  ZIYAA, Kurta Sets, Apparel Set, Apparel, Apparel for Women, Buy ZIYAA Women Black Foil Printed Kurta With Trousers Online in India, Buy Kurta Sets at best price"
